1961,3077,Even ground I probably all a.,1943-07-18,1
2130,1349,Exist other spend detail no production meeting hundred.,1965-02-28,-9
1734,1566,Material various across miss fill ability.,2019-11-10,3
4926,162,Allow process war think quite argue hit.,1990-12-05,-8
1156,433,Able number difference prevent forget less.,1979-11-22,-9
4293,1807,Just research newspaper relationship nice fact account.,1919-03-17,-3
4629,639,Section red specific exactly in.,1937-04-30,3
897,2544,History pattern send.,1920-04-12,-4
3199,2367,Risk remain case.,1974-12-05,3
2972,3609,Here newspaper whom respond.,1941-07-16,6
3839,1723,Interview wish business must.,1975-04-05,6
152,2452,Compare mother involve kind.,1940-01-10,5
1309,3105,Entire may system.,1907-07-04,-4
1501,2018,Item must every special when economic manage.,2018-10-14,-7
801,1375,Memory current quite.,1986-01-22,-5
4288,636,According difference machine building player citizen message.,1917-12-12,7
2612,2411,Involve positive garden next executive.,2015-05-07,-1
1945,3376,Discussion actually again hundred so degree score head.,1979-01-12,-6
1735,3243,Often body control standard song cell.,1960-06-08,-8
4373,1002,Water body hotel red treat clearly.,1970-04-21,-7
1971,3256,Voice serve move front start keep sing.,2014-11-22,9
723,3770,List these need.,2012-04-13,-5
1183,1418,Fact experience training impact identify believe.,1984-11-30,6
4250,1324,Chance firm technology politics.,1926-01-12,-9
1903,1582,Beyond southern her add price.,1937-11-05,-5
63,3716,Everybody behind individual official sport job.,1928-12-27,1
225,48,Its growth low sort maintain political.,1957-06-06,8
1382,2572,Southern instead different state reflect power attention.,1922-07-27,-10
4620,2795,Get with never fine million role edge.,1938-09-01,0
72,2850,Great rest job forget finish quality light.,1979-05-23,6
2868,3918,Worry wrong up clear responsibility.,1913-06-25,8
3577,3060,Often single wide already human someone guess wrong.,1991-08-18,-9
1596,2617,Keep save method state guy no top different.,1978-11-14,6
1173,365,Nor nothing old.,2001-10-29,1
2976,2697,Rate decade wide movement history professor space.,1962-01-01,6
3810,2926,Sort action city.,1914-12-25,-8
1290,2689,Property card kitchen show.,1986-11-24,-9
647,2143,Owner late amount toward fact plant good imagine.,1990-04-21,-6
135,3358,Cost chance scene especially exist shoulder paper.,2017-01-12,5
2118,1066,Season oil threat interesting heavy.,1974-11-26,-10
628,2910,Identify child worker mother worry.,1948-11-25,1
278,2043,Herself term effort.,1964-08-03,-4
988,1296,You position respond think them entire stand.,1990-07-03,-5
3716,583,Executive prepare build entire degree report when.,1974-07-06,-10
2615,536,Center page meet surface form.,1955-06-24,10
2772,2764,Road already figure.,1970-08-05,10
952,1906,Page type new instead large draw do.,2007-02-05,-5
2202,324,Lead during risk describe good.,1930-11-26,-9
709,1134,Participant during with police no sell.,2010-10-26,6
3446,2099,Might include alone billion image point about.,1944-09-01,-2
4057,2709,Result trial we find religious general despite line.,2016-02-04,-2
1579,1376,Indeed fly seat second two treat just.,2002-11-10,-6
25,2792,Stop address material edge.,2009-11-09,-1
505,1206,Low building middle across however.,1933-07-20,4
583,1863,Occur food degree arm reality south rise.,1906-11-27,2
1955,3223,Out cause if audience.,1935-04-03,-10
535,3641,Out begin education political.,2016-09-08,-4
1057,2187,Student inside yet poor board parent because tough.,1922-06-10,6
1174,3538,Hit growth cup ten interesting with industry.,1974-06-09,-5
1246,3359,Account affect process less ago like everyone.,1944-04-09,-3
3457,1807,By by education American discussion we meet.,1922-07-04,-6
2399,3523,Gas full today moment effect language.,1924-04-22,4
3469,1763,Major require quality.,2002-11-23,3
336,518,Threat wind audience big through.,1978-11-24,-1
2744,2292,Minute ground back week court serve population.,1959-05-02,-2
4715,1885,List time box music mother consider at nor.,2007-09-25,-7
536,620,Race soon down civil coach.,1925-10-27,-3
280,216,Course imagine matter act.,1917-07-01,3
1268,112,While east their already especially air.,2005-09-25,-2
2395,3153,So agree form nearly major.,1907-10-09,-8
4663,3192,Standard song within like enough not.,1921-06-26,-6
4384,1437,Bring example soon bit college generation population.,1967-11-29,-4
2012,1244,Three use commercial truth.,1948-04-21,-8
374,1705,Movie piece career old money after one ok.,2014-11-27,0
2615,626,Follow exist member lot walk.,1966-10-16,-3
1999,347,Hundred college fill onto mother result throughout explain.,1931-04-05,8
4495,3122,Onto movement market move majority decision market.,1925-02-26,5
3049,3128,Ask important line learn everybody analysis coach fast.,1934-02-09,4
4905,1052,Staff it true bring month manage.,1966-12-17,9
4815,3889,Strategy sell green exist she treat.,1933-06-10,-2
4904,2184,Per everything against exist attention American southern television.,1930-10-01,-2
4329,389,Attention need enter most capital various news.,1958-12-24,2
1182,3793,Where popular move sister.,1932-09-30,6
2666,2643,Generation change challenge kind single alone.,1981-04-05,6
2948,1060,Speech floor agreement if soldier.,1916-01-11,6
4064,162,Media serious seem special hospital including.,1958-12-09,1
2995,2406,Situation call skill understand wrong stock.,1931-02-05,4
1137,1415,Attention day son rate though attention.,1920-05-17,-1
2753,206,True while find late drop.,1923-09-26,0
1788,2676,Mission water crime couple mind continue.,1918-11-21,-1
4150,2647,Again kid music everybody now.,1922-10-02,-6
1328,1758,Responsibility grow suddenly identify student.,1998-07-16,5
706,3751,He no civil after tax side.,2016-12-06,-10
4568,2357,Term leader act market.,2010-08-28,4
31,1374,Ago smile ago beat recently need.,1944-04-04,5
456,3590,Offer avoid kid agree.,1943-11-29,9
1647,1423,Station century value your surface realize.,1975-12-26,-7
1008,2672,Clearly computer someone begin.,1942-03-29,8
736,3966,Force camera value know run heavy major.,1962-09-30,3
1394,893,Large there speak.,1937-01-26,8
2331,3051,Apply particularly question cultural herself why.,1963-12-15,3
4422,2683,Firm you happen.,1951-08-17,6
3662,27,Marriage seven of charge bar.,1959-06-19,2
1325,1420,Mrs often must wish pull weight order.,1955-10-15,-5
4371,1478,System travel market safe wrong mother old.,1916-01-02,10
1945,3806,Since pick top.,1912-04-20,4
1257,1958,Truth their Mrs exist.,1917-06-02,9
3044,2008,These perhaps per in yeah.,1919-03-02,6
3984,125,None get outside partner individual sign concern.,1942-02-21,-1
1776,440,Prove law prove some trial color wait.,1960-06-08,10
3545,1297,Page involve deal.,1910-09-21,2
497,799,Someone significant to story bill guess.,1929-12-30,-10
4208,1254,Century event truth project over necessary miss laugh.,2016-08-17,0
3248,2159,Economic address language ten.,1972-10-20,9
2246,1006,Like parent when form fall history case particularly.,1987-11-04,-9
771,1891,Base agent them scientist.,1930-01-06,8
4751,1438,City miss reveal happen discussion admit direction.,1977-07-14,5
3378,3816,All chance statement institution behind from Republican.,1948-06-02,7
803,2451,Discuss stock old woman.,1931-08-07,-2
2000,2658,Phone degree order same.,1969-05-05,1
1877,1078,Low talk bed.,1910-01-30,1
4847,1599,Political team its final his final.,1932-07-25,-8
3526,184,Enter change hot save identify court must.,1966-10-28,-1
4708,28,Win first nature ago hit maybe.,2010-05-29,-7
1473,936,High easy least really skin politics term.,2003-11-22,4
89,1091,Now concern eat thank say admit.,1999-02-17,10
1903,1727,Do live image reveal.,1983-07-15,-6
1502,2969,From series allow single.,2016-10-05,-6
685,611,Law clearly tell left condition great.,1918-02-01,4
2652,1132,Avoid too technology task book class.,1995-05-03,8
302,3795,Such these show do.,2019-02-10,-2
3026,2338,Necessary create fear often school ready same morning.,1978-06-16,1
4350,329,Radio practice yet week degree best.,1980-08-28,-3
1445,2724,Still step song.,2002-12-01,-9
4043,1810,Arm structure wall successful stay.,1908-12-01,9
395,3138,Have street history film myself.,1954-10-25,-9
2679,3111,Day learn sort since play every reason itself.,1988-06-10,-10
2670,3773,Gun fill edge want.,2000-08-18,-9
1078,385,Control teach through break base win.,1940-02-08,9
2748,3091,Factor to might travel.,1970-09-17,-5
810,981,Position fish east could reality.,1906-12-26,3
3166,2374,Certain goal might program.,1937-08-23,-10
2561,1271,Baby accept matter line entire.,1953-11-15,-3
1083,2576,During both bill since again six.,1973-04-18,-9
4091,295,But positive hospital check like.,1970-06-15,-8
641,2907,Simple medical his person east north present.,1926-10-31,9
3929,3636,Worry bank yeah nation part usually.,1954-04-08,-6
23,2077,Recent always effect stop consumer bag.,1911-07-24,7
3229,1663,Dream sense general.,1959-05-05,-1
1211,1533,Lead determine candidate.,1946-03-01,3
709,3080,Strategy street stop power window why possible.,1941-02-27,-4
464,3607,Style whose dinner near store.,1907-06-12,8
399,3400,Cell Republican reach method southern raise.,2013-03-02,6
3347,3759,Quickly deep others goal office successful make.,2017-09-04,2
3661,3769,Artist recently ever.,1962-03-16,5
4551,1883,Democratic garden stage through dinner risk.,1947-02-18,-1
236,3131,Speak about indeed pay blue traditional away.,1978-03-05,-9
78,3109,Our turn once take small statement word.,1971-10-12,7
2874,177,Minute provide young might.,2009-03-17,-8
4862,1513,Plan husband sure or lay laugh.,2017-03-21,5
4084,1422,Series sell collection.,1965-12-01,1
2573,469,Player phone half find name government man.,1964-01-17,-6
1371,3585,Simple actually quality create its evening.,1925-04-08,9
3076,2516,Who pass tree property increase class.,2002-06-09,-1
1069,543,Option media only trouble measure approach.,1908-03-26,-4
2419,2593,Fast trip thousand month relationship million set.,1920-10-31,-5
2228,2489,Future behavior health citizen.,1966-07-18,3
3995,1921,Senior Congress energy person test.,1953-03-31,-8
2536,3730,Call want reality say your result capital.,1918-09-21,5
4287,1648,Would education economic cup process hope.,1944-06-01,5
974,1849,Start consider game industry success.,1993-01-29,0
2549,1028,Move technology only couple always fast.,1999-08-01,1
3775,1857,Environment eat thing same less.,2003-05-26,0
4874,1996,Camera a campaign will.,2016-01-04,-3
1925,3487,Enough thousand place.,2009-11-02,-8
1530,3528,Anyone reflect organization add.,1979-03-28,8
585,728,Must word race involve.,2001-11-06,-9
2878,634,Wide rate southern.,2019-11-23,-9
3457,2154,About friend ahead bill himself least character.,2005-12-25,-8
4834,1884,Congress never theory social detail.,1924-10-04,1
503,3504,History effect agent policy.,1913-04-29,9
3879,3990,Together option thing go every wife.,1954-02-14,2
1950,3043,We that yourself agree computer remember more.,1947-12-16,4
2858,434,Impact act century million news.,1969-08-01,-9
2424,3915,Show space sure we ground cause.,1912-11-13,8
554,2896,Majority how college lay yeah raise.,1988-01-31,3
4383,954,Same tell blood industry fight example believe.,1969-01-10,-2
4209,247,Total save reflect.,1918-03-31,-4
4456,510,Whole most range according simple method want.,1940-11-04,-2
1426,1004,Above actually small many.,1904-09-24,-6
4857,2996,Staff pay entire whole dark sure through.,1914-04-08,-6
4194,64,Possible wide door likely level hospital upon.,1916-09-05,1
1322,415,Reach future cold among own now mouth.,2003-08-29,8
713,583,Ready rule method now.,1957-10-16,5
1257,3057,Develop hour gas ball eight occur single.,1906-01-15,2
3411,545,Country sound pressure shoulder another.,1909-09-13,0
955,3031,Use three exist pull network far push.,1999-07-30,7
4610,2760,Whose material state various term discuss blue.,1942-07-09,-2
335,2762,You star give small along time shoulder possible.,1969-01-14,1
936,3223,How bar direction.,1958-11-01,10
2042,148,Or yes policy positive alone.,1980-08-10,-3
3284,3077,Deal contain executive building.,1919-09-23,-6
4767,2695,Lead window color.,1994-03-17,2
3621,2092,Free television data major.,1950-11-27,-9
2650,2474,Prepare modern home relationship want account customer.,1915-12-20,4
4796,700,Imagine still rich most might become.,1941-04-25,6
3951,661,Responsibility since small everyone special against market.,2000-08-24,-7
3110,1103,Necessary wife as city none.,1942-07-23,10
882,1526,Scene senior include college heavy whatever great.,1941-07-09,-3
1772,3921,Store up style rise member several region.,1992-02-17,4
1234,3712,Wish service skill.,2002-03-25,-3
1397,2518,Position health deal without both support send.,1993-03-26,10
4303,3674,Window glass help technology song Mrs.,1941-01-20,-3
1382,1977,Service hot someone occur up or quickly.,1999-03-29,-8
624,825,Oil rule note laugh seem person market.,1986-06-18,-8
2834,3582,Around forget sell he behavior.,1988-07-17,-8
4605,1656,Decision between inside debate interesting note.,2008-06-28,-10
2802,758,Bill new alone between growth natural.,1966-07-23,-7
3710,1523,Especially several wife agency.,1970-03-03,3
460,2031,Week organization daughter another language.,1918-09-06,2
1547,1904,Six cold increase discover.,2013-07-05,5
2909,81,Amount raise maintain ability education.,1967-07-28,-3
4032,3085,Live maintain whether detail imagine establish stock reflect.,1923-04-02,9
3337,886,Look message region company reduce than.,1943-03-16,2
2597,2042,Design different hit dinner station.,2013-10-26,-9
3953,1208,Box item south if hundred guy understand.,1926-08-09,0
3286,112,Market her tonight important yet what.,2017-08-16,-10
4371,1248,Partner price shoulder.,1954-06-07,-3
3278,412,Week thus gas rise myself back.,1943-08-18,5
4150,757,Song physical form feeling away this save.,2015-02-15,1
4331,1864,Type include American heart move.,1965-09-05,1
4571,2523,Each role cultural house subject join anyone behind.,1960-05-13,-3
1722,239,Parent at matter painting.,1997-01-15,-8
671,2741,Dream want no series day why treatment.,1953-02-10,2
3322,3634,Into report yard debate left call continue.,1974-10-30,-10
3673,2604,Man significant project across car.,1925-12-11,-1
27,2729,Thought pick care.,1985-08-30,-4
1441,2527,Several work senior seven wind.,1926-09-11,-2
2258,3127,Place world western live.,1927-06-25,1
302,2186,Evening truth peace whether western.,1963-04-18,-5
1770,2630,Model none future medical stay area.,1992-02-23,-8
4046,3946,Conference represent thus thus.,1968-01-22,10
4905,1903,Energy often alone whose dream service.,1992-08-08,-4
611,3638,Computer health they personal money significant.,1984-10-26,-5
2636,1334,Foreign western anything coach every.,1952-04-18,-4
4,3780,Century federal lose cost blue produce.,1935-05-29,6
1544,3642,Tend position another score human.,1988-10-18,5
2611,3430,She floor you.,1917-08-28,5
2353,3350,Bring ready treatment yet call through agree necessary.,1987-09-21,-5
1093,107,Despite a bank guess recent good realize collection.,1976-02-28,5
532,1273,Mean three bed sometimes interesting gas approach good.,2000-06-27,-6
4815,3057,Teach threat arrive force.,1970-05-25,8
2016,3279,Detail site doctor reach once south.,1983-01-30,2
3039,2377,Bad third man now leave sound city.,1996-04-28,4
2863,3166,Culture woman phone factor low.,1909-05-09,8
2258,1600,Leave group out result late.,1953-03-22,4
2910,1762,Boy report else thank issue too.,1964-02-06,5
2089,3643,Sing character summer break simply.,1949-08-08,7
1247,617,Surface manage to possible.,1936-03-17,-4
1054,1287,Food produce without animal opportunity.,1944-08-18,-3
1749,946,Perhaps ten someone argue teach live tough catch.,1984-06-06,-8
2577,1037,Traditional wrong real admit who simple rule.,1915-04-05,-5
3230,2698,Single use production.,1962-01-27,4
2254,1809,Employee check always.,1994-01-01,6
698,3923,History bit financial market down magazine.,1954-09-07,3
4894,1985,Talk nearly network sit ready you.,1950-03-02,6
2649,3916,Road despite available picture door these.,1991-10-11,0
1438,2507,Station beautiful type worry.,1915-03-30,6
3207,283,Time ten debate.,1953-08-20,-3
4568,455,Myself instead article head son.,1965-06-10,-5
3501,1197,Plant place Mrs attack accept collection.,1921-08-22,2
2700,516,Laugh like stage find.,2008-03-15,1
4862,2146,Mother visit response practice.,1974-08-22,2
2313,2574,Yeah account computer figure pick agent pressure.,1959-03-17,5
862,1503,Current mean worry to skill mean.,1971-06-27,-9
1896,2740,Certainly economy myself method much action.,1938-01-30,6
363,183,Good look plan develop.,1922-04-09,-1
1777,1943,Animal benefit first guy.,1908-09-21,1
4759,2281,Prepare property pattern per.,1994-05-10,-6
4202,691,Always bill blood general skill rule west.,1995-05-08,-3
3476,541,Food pick realize.,1944-09-28,5
4480,2940,Until sister result because worker.,1963-01-13,9
1077,3174,Black anyone stay rich.,1918-11-01,6
4196,3603,Man growth decade record staff inside generation space.,2011-12-29,-3
3735,2496,Purpose factor customer.,1973-02-06,5
525,1883,Tend rise institution buy strategy.,2006-12-26,8
434,3626,Explain energy weight myself evidence character.,1958-12-04,0
4155,795,Third alone she enough step work shoulder.,1942-11-17,10
4577,553,Star claim politics majority society.,2013-02-05,-2
712,2764,Mouth fight parent.,1939-03-20,-6
2397,2889,Condition necessary push by.,1929-06-07,8
3423,1739,Picture fish technology important public serious culture.,1957-10-31,-7
715,2251,Lead start president cold board.,1943-03-28,6
520,3213,Film son hand.,1982-01-12,-9
897,1527,Sing down standard result how action base study.,1984-07-23,9
1849,3742,Blue practice ground their suffer popular a me.,1984-05-06,-10
2725,1243,Why time today blood exactly.,1986-06-21,-2
4147,3453,Campaign whom gas wall hour else nor.,1957-06-21,-10
208,2776,Former learn decade grow particular.,1929-08-29,9
2266,216,American among investment respond possible join.,1922-10-10,1
2503,2967,Agent own debate around entire run.,1963-04-28,1
791,1224,Recent property election such.,1928-12-22,-6
4073,2317,Huge tonight reveal television.,2019-05-14,-4
2934,939,Agree future issue accept fall short still.,1912-12-24,3
743,3651,Peace argue line theory.,1935-01-09,8
3759,1400,Civil during represent within understand.,1939-12-12,1
2245,3661,Different just model age ten fish exactly.,2008-06-04,6
474,387,Individual question always buy share small.,1935-02-13,-4
3970,705,Executive art bring last past take leg.,1932-02-29,2
2422,402,Respond door door star nature store media quality.,1940-06-17,-6
751,2232,Condition half station wear my we.,1957-08-30,7
3494,645,Suggest my operation lay outside.,2003-09-28,0
3064,2789,Social participant any five yet product man.,1981-01-28,-1
4880,264,Citizen possible huge interview all.,1938-06-02,-9
554,1928,Age they nice.,1942-06-19,-2
2324,1620,Draw good return support.,1921-11-29,-7
1597,745,Total customer wait position focus recent continue.,2003-09-12,-6
2177,289,Popular else meet night take heavy would start.,2002-01-06,5
3747,1566,Tonight fire agency population.,1931-03-08,-8
4385,2738,Quite live draw form.,2016-06-23,10
696,721,Major party example young after.,1946-06-11,-9
3423,1042,Movie happy affect ball.,1941-01-23,0
3759,2632,School ready station perhaps respond particular crime.,1961-07-03,7
4352,2343,Kitchen friend officer here.,1953-05-15,-3
4632,390,Today whom degree move system.,1939-07-22,-10
1973,453,Despite every final.,1917-06-22,1
4210,3650,Deal building why agree when sure.,2012-01-09,-5
910,1452,Family have single sea.,2012-02-26,-10
4075,2330,Machine light common type.,1911-11-03,-2
898,1642,Choice pass particularly summer behind hair scientist whole.,1965-07-20,0
4361,3026,Side home more season high wind doctor fund.,1949-07-19,-1
2319,3734,Eye someone major name international interesting.,1968-01-04,4
1484,1755,Claim condition least light alone.,1961-02-18,-4
192,2252,Mouth star green chair.,2017-01-06,-8
1759,697,Score respond present factor.,1922-06-29,-8
1066,2033,Car safe manager.,1929-12-30,9
3189,3399,Prove on off this but season try.,1925-03-05,7
1967,2527,Culture grow course join rather positive.,1977-08-16,4
3474,1899,Deal religious require approach international lay stay.,2003-05-24,-9
1374,1176,Value decide campaign each age peace thousand.,1973-04-26,3
4311,947,Worker real wish send knowledge.,1961-06-19,4
2612,3398,All save lose staff push cultural.,2018-10-02,5
850,2599,Speak until avoid leg tell outside across.,1939-08-21,-4
3108,1652,Degree continue difficult political central.,1955-12-28,-1
836,3923,Attorney hot win subject relate tree pressure.,2011-01-27,-8
849,125,Message reduce real until fly.,1913-04-25,-4
1914,2048,Break as raise.,1915-10-21,-7
1407,351,East agreement feeling perhaps step expert.,1953-09-22,-10
1605,1877,Take woman white executive anything.,2001-10-23,1
2837,2451,Impact budget major news.,2013-07-24,7
290,1287,Across hit firm religious.,1951-06-16,-6
3572,732,Early leg these be rise.,1975-03-04,-3
3312,3329,Production right spring our ask set.,1994-01-10,0
636,3799,Way spring budget range.,1981-11-29,-2
2855,2972,Sea receive mouth street both.,1908-12-18,7
3639,943,Could nor blue artist story.,1967-06-26,9
1518,1754,Girl government gun design view.,1981-11-24,4
2650,2740,Main scientist discover will.,1943-07-21,8
2552,1070,Share memory often power western.,1940-07-27,-2
3408,885,Send now worry tax commercial.,1911-05-23,6
1122,2765,Visit various away fine size pick.,1934-01-15,4
2258,1966,With Congress real.,1952-06-02,-2
2164,330,Describe network us easy fire water within.,1971-05-08,-3
4197,3854,Father air born home ok forget black.,1924-09-03,10
2640,2878,Interview agency court carry weight simple own.,2011-02-09,5
2004,18,Skin trial risk ago support until.,1997-03-23,-9
677,2752,Southern much security these.,1956-11-28,9
1548,222,Debate article sometimes and practice.,1959-02-03,2
4392,427,Participant movie along.,1983-10-14,8
3931,1885,Activity list watch throughout within.,1962-09-29,6
1977,3137,Order agree lose wonder performance coach man.,1931-06-14,-3
2944,1474,Get discuss make while their agency agent with.,2009-04-17,-6
4506,319,Church end lawyer hard clear event rate.,1939-05-23,-3
4141,1517,Product ago least information late question line.,1913-02-05,-4
1344,165,Something charge else physical field nation.,2013-02-25,-5
2375,3543,Nation nice option statement across.,1935-08-28,9
4170,3821,Door challenge order management they success future particularly.,1960-12-23,-5
3585,2189,Ready sometimes write case.,2009-06-26,3
4150,1545,But tree customer everyone hard.,1959-05-26,-8
3818,3725,Author difference show him record certainly teach.,2004-08-02,4
3420,2777,Million defense order mean put power team.,1905-03-08,3
2627,659,Reality reduce clear common.,1987-02-17,-3
1657,2920,Expert throughout audience part.,2006-05-10,2
1654,3239,Under charge cultural fire by perform everybody business.,1962-12-14,7
5,2300,Event much so region.,1959-09-12,8
953,2623,Old country face bill serve decision within.,1949-04-01,3
4750,3588,Movie project staff believe.,1939-07-17,10
2599,2611,Suggest change eye white.,2016-09-17,10
3435,947,Later three star he finally community not.,1971-12-15,1
4364,3521,Law series bit watch off bag whom.,1937-09-20,-7
1356,3583,Discuss floor analysis because nation produce improve.,1985-01-16,10
994,2679,Success about meeting bag.,1952-10-14,-7
1779,1369,Interview kitchen customer dark because detail natural remember.,1917-11-20,-4
3491,528,Let goal century future job soon return.,1977-04-16,-6
2429,2249,Each believe party song light rate senior left.,1907-12-27,-1
4935,378,According very difference shake.,1925-09-30,0
727,188,He themselves land poor candidate important focus rock.,1958-07-01,6
2362,2843,Indicate decide before ten own from.,1908-05-15,10
4533,1130,Media since understand check.,2006-02-19,5
4558,1667,Authority any station contain blood style.,1940-09-29,-10
3946,500,Movement eye expect wide day himself role.,1961-12-11,-10
3254,2055,Decide father film street music blood.,1965-02-08,-5
3597,2091,Opportunity hold sell issue become fish.,1918-01-20,2
2091,1313,Never different cell ask most.,2000-06-23,-8
2397,3097,Its forget artist.,2010-06-01,2
126,2781,Could into above for could increase star rise.,1952-04-04,-1
4407,1189,Police shoulder ago measure myself.,2016-09-29,4
3256,2382,Hope maintain morning think investment country time reality.,2013-02-16,10
2158,2170,Movie pay standard floor.,1921-02-10,-9
2817,3357,Western you lawyer various recently family whatever.,1999-07-28,-3
827,3157,Data there be care stop dream land.,1919-06-04,5
4535,223,Ever edge before window ability population bank own.,1912-06-23,7
1069,2423,Democratic future voice ground really always.,1990-10-31,3
3184,1870,Management than once there.,1920-12-01,6
4703,2234,Figure admit attention everybody war determine event.,1977-12-18,9
4243,2212,Ever write then represent walk investment you.,1994-12-28,10
2982,2435,President choice teacher Republican break series staff one.,1925-10-08,5
2176,826,Story human look act board because.,1956-12-28,-9
1524,3608,Chance generation medical wear director on.,1998-09-27,3
3290,942,Turn call never decision name exactly either.,2005-04-07,1
4797,3563,Effect church particularly spring similar by.,1959-10-11,6
4477,3786,Night option employee or body.,2009-05-11,5
3688,1387,Statement relate large put.,1938-07-21,-5
314,1485,Really environmental light from my.,1914-03-27,-8
1658,2351,Training energy her where toward money reveal.,2015-10-11,-4
860,3402,He lot too will.,1943-10-07,0
2335,3277,Go point whether risk personal serious.,1934-04-22,-3
867,2240,Owner adult threat sort time nation.,1999-09-23,-4
3474,3475,Sense among respond.,1912-11-16,9
4368,3900,Job mother behind early always short rule choose.,1916-10-01,-9
1693,2612,Economy middle majority.,1944-11-22,-8
