4664,3487,Rather real now program above.,1916-11-28,-6
4533,1509,Sell only expect main wonder mean federal.,1986-09-19,3
4775,2118,Science clear after wait.,2002-08-10,-2
775,2927,Forget occur most early indicate.,2013-05-31,-8
4193,2712,But customer house particularly rule improve.,2004-04-16,10
2342,790,Wait for upon can.,1952-03-23,-1
4507,2222,Edge somebody long make campaign.,2001-04-11,2
4063,1236,Likely bank young rise defense gun.,2009-06-25,1
3653,1101,Subject provide difference discover than item public.,1950-09-12,-1
624,2815,Help who remember rate increase believe.,1998-06-25,-10
3131,3372,Hotel single cup agent cause thousand rather.,1951-12-01,2
2780,3990,Federal herself age generation.,1913-07-17,-4
3143,2188,Push exactly together reality along.,1997-04-04,7
1938,252,Game task time theory administration break.,1992-10-20,-7
2185,1441,What someone marriage must those put.,1940-03-01,-4
3590,2499,Still or likely provide cost.,1979-11-03,1
3114,2731,Decide national recent quality town.,1960-06-02,2
4103,973,Fight local seem amount.,2007-02-17,4
4325,2264,Health bar main cut choose.,1941-03-22,2
2966,3841,Total only need lead.,1997-11-09,-2
3419,3769,Pm once foreign prove way use trip.,1914-10-12,6
1672,2790,Other cost according foreign bar.,1954-11-24,7
2980,3069,Author sister ago possible station.,1941-03-31,7
4692,3691,High much early stop must agency suffer.,1967-11-14,0
2880,1526,Reveal already behind enough fire challenge.,1948-02-29,7
2655,281,Approach discover school raise according traditional situation.,1909-04-22,10
4144,3646,Soldier pay student bed.,1908-12-15,-10
124,1885,Option laugh around current we computer approach.,2014-01-25,-5
2264,2008,Statement degree must with agree share.,1950-05-30,-2
4859,505,Whether seek left picture.,1928-05-19,10
4299,1714,Future sense single raise rock.,2011-08-25,7
2041,2011,Particularly whole size artist show nearly dinner.,1920-09-28,5
1416,61,Speak young within quite.,2003-03-12,5
4645,292,Clearly summer get far go evidence.,1940-12-22,-8
1784,3763,Decision agent green.,1908-08-18,-2
4312,890,Bar energy evidence research possible charge much bed.,1974-06-02,-5
2206,2563,Yourself war age chance head.,1930-07-04,-2
4963,991,Call expert class visit part mission.,2014-04-23,10
4465,525,Lose spring concern sea police religious.,1952-07-23,6
4748,2233,Budget visit human today approach economic.,2014-01-13,2
3091,1427,When bring TV adult adult series.,2000-11-19,1
526,3880,Inside field grow project.,1942-09-10,10
4588,170,Movement very really resource each.,1935-08-19,3
1866,933,Education reveal mother police stuff.,2015-09-21,5
3790,913,Seem poor detail financial.,1924-03-25,4
2948,3384,Continue forget arrive pass nation.,1917-05-28,-10
4446,2582,Nation develop effort moment kid drug both.,1919-06-06,1
3974,291,Accept be simply situation sometimes now.,1934-07-14,-10
3233,162,Affect rock box maybe range.,2001-12-15,-7
4017,1025,Under standard budget bank.,1954-11-24,1
2248,3270,Long property could in.,2013-06-09,-10
4609,1955,Phone focus including land wish very PM.,1933-12-04,5
1791,165,Explain grow mouth brother week deal laugh.,1927-04-17,-6
1723,2089,Strong record teach Democrat me choice home build.,1919-03-15,6
3346,837,Decade computer yes know officer defense.,1989-03-26,10
159,200,Door way yet glass.,2003-03-12,-9
2472,2415,Money star PM himself.,2009-01-19,-6
3823,2053,Will majority record wind though dark prove.,1974-06-26,2
451,3908,Citizen television anything professor now position follow within.,1929-05-04,9
1918,1539,Scientist consider finally TV.,1966-07-04,-7
3076,2035,Tonight anything born on.,1922-07-16,-5
1842,1850,Sell fire yet shoulder field kind.,1944-06-16,-5
23,1862,On glass watch.,1987-12-10,-3
4663,2870,Training decide issue.,1918-09-28,5
939,826,Government might film tell some soon.,1951-04-29,-5
3245,1865,Consider finish white among.,1962-10-25,0
4441,3318,Election behavior fly no Mrs.,2008-07-26,-3
3483,989,Good major message tough recently commercial.,2013-02-03,-4
3137,1274,Drug city suffer individual financial.,2017-05-24,7
1561,1649,Position base prevent newspaper political.,1916-03-30,4
1981,2557,Increase him news charge live.,1926-03-29,10
2462,2563,President seem administration finally state parent certainly early.,1954-04-01,-8
1357,2336,Television great matter administration.,1925-01-10,-2
4534,2844,Still cup environmental task.,1908-11-18,5
46,63,Sister TV into agreement ok him development.,1935-09-12,-6
1960,1783,Cover power past media Mr.,2003-07-27,-2
2758,157,Fast task ago race son will rule.,2011-05-22,-5
4799,1493,Democrat base brother tree only.,1989-03-18,-5
3250,382,Total reality rock later.,1983-12-18,10
4581,1175,Five improve everything through.,1917-11-06,1
1606,3184,Same debate per pass age outside.,1968-02-12,5
1755,3170,Note suggest close seem high nothing.,2016-09-28,-6
4002,1919,Discuss floor decision dark enter security.,1950-05-15,-7
2746,1084,Everyone kitchen affect machine skin city.,1957-05-07,5
3166,1060,Drop medical shoulder.,1977-05-25,-6
4959,2936,Argue perhaps sell.,1986-09-26,5
2582,3811,Property operation across born partner reality move.,1915-02-14,-2
2791,821,Provide million nation rule.,2018-06-15,6
2479,2406,Describe boy expect simply buy to peace.,1958-11-08,-7
3972,3118,Nation myself attorney against.,1920-09-30,-7
4846,2482,Station source something kind certainly benefit color.,1956-01-10,5
1855,420,Oil property often her floor.,1997-06-04,-1
4708,2051,Technology hand within.,1987-07-17,-2
342,2671,Article write morning arrive sign writer include.,1916-10-09,0
3040,3272,Floor drive continue probably produce his.,2002-12-22,-2
3756,3112,Leg blood chance a out son truth.,1989-07-27,3
1058,2275,Environment discussion training.,1957-04-27,0
4816,29,Write performance new throughout anything per word.,1983-06-16,5
705,2809,Major arrive color wear action.,1915-05-28,-8
2396,1384,Help citizen get popular figure fear.,1930-08-15,-6
2196,179,Increase tend number amount professional that.,2014-05-10,-7
1784,3105,Especially type open nation rich sometimes.,1996-11-08,2
335,901,Value manage run right determine.,2017-06-13,8
721,3610,Big space place money.,1907-11-12,6
443,2181,Pull then time cultural short his.,1954-11-29,-10
3110,3236,Usually heavy every bar need relationship about.,1917-06-17,-3
4810,1107,Street task recent.,1959-06-21,-4
60,1077,End civil mean trade hotel fire eye.,1984-10-18,0
4075,1505,Go talk business human approach.,1942-01-08,9
1578,3073,Treat tend learn research.,1983-01-31,-8
1030,171,Environmental along participant he detail return.,2013-03-11,-3
2068,1370,Its during laugh part.,1989-09-09,-9
4499,3088,Its property across character own alone result.,1999-06-10,5
2340,2194,Assume option certain wonder true.,1939-06-10,-9
3885,596,Special difficult artist positive.,1909-07-23,-8
129,3542,Bar board free throughout.,1952-05-23,9
217,1750,Still road after choice around theory.,2010-05-30,4
1181,3502,Prevent bad total everybody.,1939-12-24,10
2450,1448,Song hard future say form camera.,1987-01-02,8
1994,3468,Term seem responsibility head beat treatment.,1970-04-14,-1
4462,245,Ahead sometimes stock carry animal.,1932-03-29,7
98,970,Article power simple personal father.,2000-11-03,2
328,2318,Chair report east cell.,1960-05-11,0
4524,2309,Media capital admit section.,1984-09-03,-4
1394,3357,Laugh day sound partner data.,2007-07-14,10
4196,3592,Amount door its site maintain treat.,2016-06-05,2
1892,2173,Every door official factor final.,1952-08-26,-4
3675,2861,Our free cup sort three.,1985-03-30,3
1748,628,Truth evening risk else network give gas.,1984-12-25,-1
3159,921,Growth concern part avoid type.,1979-04-21,4
976,3153,Development right lot single song another.,1947-09-21,-3
1953,212,Care stuff decision occur actually.,1951-08-27,-3
1183,529,Return building stuff.,1910-09-11,10
4146,1822,Bit middle see throughout end.,1907-09-21,0
2054,2227,Among so receive example.,2018-10-29,-5
3616,212,Do hospital station them perhaps scene.,2002-06-25,3
2802,2513,Between open animal whom debate happy address out.,1966-08-31,-10
1429,1009,Policy establish lawyer build door contain try.,1917-10-22,-2
3134,3522,Within free let.,2000-10-21,10
2640,731,Suffer forward expect movement beat three.,2013-06-28,-9
3657,3852,Live want green energy moment five he.,1976-06-30,0
1085,1119,Chance arrive full determine time fear.,1956-02-21,-8
2665,2390,Off affect event meeting.,1960-04-13,3
4584,2551,Conference right want vote boy bring.,1976-11-02,-10
4878,316,Risk success capital only no one treatment.,1921-10-28,-3
1531,3672,Seven whether one teacher wall center heavy.,1917-02-14,-5
4590,2516,Off economic time that force.,1906-08-10,1
2880,1040,This sister throw guy woman.,2004-06-27,9
1730,1453,White message us stand allow scientist test maintain.,1923-02-26,7
515,2063,Speech point he.,1916-01-24,-3
4573,293,Hand growth remain same play establish throughout.,2010-07-13,-10
3755,3150,Usually option give see amount include member.,1978-04-23,0
2234,1495,Less few each teacher water.,2009-05-12,1
2222,1299,Really brother list space.,1938-01-15,2
4088,3806,Free one truth.,1915-12-26,8
3900,3715,Born relate they its difference network.,1961-10-04,-10
468,1535,Only check president be good national.,1977-10-05,4
701,1747,Bag personal at TV.,1916-12-05,8
169,2273,Article why quite thought.,2002-02-25,-1
2397,2708,Collection talk traditional wind weight rate response.,1930-11-12,5
543,2557,Side television police next win detail ready result.,2017-11-29,-6
3085,3200,Base perform return particularly.,2002-10-19,1
2003,3599,List high future hear behind foot threat.,2000-12-31,1
4337,3052,Various building wall evidence speak war scientist.,1994-04-03,10
2450,2716,Performance or close one direction.,2020-04-03,4
3087,425,Thank establish the nice century.,1977-03-04,8
11,456,Blue best past agent.,1971-04-19,-3
4810,1063,Movie billion realize kid.,1971-05-30,-7
3655,3574,Out garden up full seven if how child.,1970-08-01,5
3950,166,Bag that meet east idea would.,1957-03-02,6
2135,3829,However majority of like.,1968-01-06,-6
208,1563,Field character wear test in side draw.,1936-05-27,8
172,2658,Here any scene.,1959-04-27,5
1895,1850,Clear last class company.,1974-10-21,10
1167,1663,Social simple instead Democrat fight.,1997-07-18,4
2685,1035,Since political heavy account.,1939-09-15,-10
1998,2025,Move whole become carry.,1995-05-23,-3
3175,2963,Store least image score manage central fund.,1913-10-17,-4
1924,1913,Ten family there which hot news.,1959-12-21,0
416,2782,Film sport trade recently last business that.,1996-08-03,-7
2680,2569,President increase report difference light.,1988-12-24,5
3410,3716,Feel positive phone throughout any magazine arrive stand.,1995-08-24,8
1865,2504,End national modern room lose perhaps.,1992-06-05,5
1383,2730,Day develop side from popular.,1932-01-05,0
1914,3082,Bad local finally environmental beyond.,1941-05-02,6
1798,610,Change time cut at travel figure knowledge few.,1936-03-02,-9
924,2751,Along thing director yourself say major.,1925-02-06,10
696,1954,Family over kitchen feeling hand know late.,1948-03-20,-4
4696,2354,Ever statement lawyer lawyer cover.,1957-01-29,-6
455,3243,Style teach become while guess career.,1938-08-20,8
4324,3567,This everyone method four civil.,2007-08-04,-7
533,1360,Past order there lawyer.,1947-05-06,4
377,1396,Become budget camera half reality however follow success.,1999-01-31,8
106,3768,Most soon direction tree have real and.,1915-07-08,-1
3099,1264,Peace into turn strategy leave thousand pass us.,1991-11-17,0
2375,617,Management phone front perform wish sign finally.,1961-05-11,-9
1161,3879,Serious smile vote trial.,2013-05-16,4
3013,439,Would film throw fill thousand analysis little protect.,2009-12-11,3
4910,1988,Join first condition.,1959-11-22,4
3593,3857,Parent clearly conference either.,1940-09-09,0
95,577,Understand role garden national course tell.,2004-09-12,3
192,2729,Forward fish poor arrive suggest.,2019-08-31,8
1540,1087,Edge young fund business century bank environmental.,1934-09-16,1
4840,3645,Sister market you finally.,2007-11-02,8
3500,1912,Respond expert cultural space maintain.,1996-05-15,3
1877,44,Want during bit less.,2002-04-07,-5
749,2662,Race person still ball trial project into.,1991-02-03,0
4267,1560,Book customer weight tend sound.,1976-05-30,-7
4937,3630,Pass themselves maintain close society.,1926-02-14,0
3526,1257,Social understand until return child program religious fight.,2009-02-05,5
4695,1221,Local situation across soldier everything.,1930-09-29,-5
3785,3543,Up executive carry important media realize smile.,2014-07-25,-5
1484,3677,Radio someone candidate simple.,2014-01-10,9
1792,611,Cost it southern article year.,1991-04-15,-6
894,3909,Case away real can site act fall difficult.,1918-06-24,0
1633,206,Sign majority wife conference bill air.,2015-11-26,8
3097,1147,Specific ok describe before.,1929-02-12,7
3473,44,Eat many she statement like.,2010-12-31,3
4569,1109,Information gas education federal represent all.,1946-09-04,9
315,1892,Enjoy late three describe main nation space.,1917-09-28,7
3915,3571,Building newspaper too benefit however laugh.,1948-06-24,9
996,752,Often begin population hundred defense Mrs pull cause.,1999-06-04,9
4775,389,Off phone someone.,1908-07-03,3
604,354,Step ground less same stuff myself.,2001-03-22,8
2160,580,Even determine east establish less social I democratic.,1909-11-11,7
682,182,Its even continue huge ago push win case.,1957-06-29,5
3088,1258,Spring necessary indeed very suffer side.,1917-05-30,9
2814,2288,Policy several theory administration computer weight eat.,1990-02-14,2
1787,724,Media southern while music east report.,1963-04-03,7
509,3642,Put professional education.,1978-01-30,-9
4791,2702,Body may her recognize although level leave.,1920-09-28,-9
1579,436,Raise modern project part brother scientist doctor.,1943-04-23,10
3583,999,Whatever anything have also wish data.,1905-11-12,7
3252,1388,Building degree quite decision.,2020-03-20,-7
2144,2926,Happen power see girl store environment democratic.,1954-04-17,3
2636,3648,Point discussion draw administration citizen.,1938-09-15,1
296,3160,With it than beyond behavior approach unit.,1939-03-11,1
4562,3099,On ok politics pattern authority moment.,2017-11-18,-7
4428,1476,Movie mother quality writer produce.,1907-06-07,-2
1160,1196,Strong later memory tough.,1977-07-20,9
3619,1813,Head explain wonder share cost point.,1986-02-20,6
2876,944,Remember chair give late page involve.,1971-09-25,-7
4474,312,Television parent whether.,1957-10-25,7
4226,302,Plant pay girl chance character newspaper.,1979-02-10,-4
4368,2799,Just data find scientist happen.,1910-11-25,-6
767,2324,Evening cause old single.,1988-06-10,7
3888,3094,Him catch probably identify player nation front.,1955-05-08,-10
3961,3266,Recognize station for position program knowledge let large.,1986-11-17,10
3856,3574,Image third source mean environmental.,2004-12-08,7
2966,3653,Responsibility cost beat exist citizen fly.,1932-05-29,-4
241,3087,Nice maybe lot suddenly anyone method.,2002-11-19,5
1023,231,Never on chair fund coach.,1970-07-18,2
203,2810,Clear blue more finish carry feeling.,1914-03-31,9
4516,3177,Big really become style by adult health off.,2014-01-10,-5
3739,437,Seem best politics turn.,1983-07-24,-1
1310,1277,Create yard break wish leg.,2019-12-13,9
3578,3583,Finally discuss artist network news close source.,1908-02-16,2
792,2546,Rest during our animal box.,2002-02-23,-3
1548,2316,Source commercial report consider.,2010-04-30,-2
1000,666,All heavy seek old.,1951-01-13,-4
327,1830,Agency I worry modern result.,1906-01-05,-8
2525,1165,Particular per change agency top sound.,1964-10-28,-8
3321,1284,Tv believe marriage market.,1957-07-27,0
2305,3441,Green worker suddenly check.,2016-03-09,-7
4342,233,Close democratic yourself agreement good employee.,1930-01-05,-7
3575,241,Travel rate thousand own conference simply mean.,1958-08-20,-6
636,927,Computer it house table himself sport town.,1914-09-29,-2
1147,1178,Her firm partner candidate owner most deep process.,2013-09-13,8
4919,735,War case particular especially say realize page.,2004-01-11,10
4645,3485,Ok people its pick.,2006-11-13,9
1826,1227,Couple six be describe.,1972-06-20,-4
2509,204,Leave management out born.,1993-03-01,0
1383,2420,Discussion month receive again cut.,2008-08-22,8
2862,2580,Court then executive nearly talk.,2019-11-06,10
1944,3923,Window environmental local lay physical they trial.,1969-02-21,-3
4811,1506,Resource eat benefit.,1928-11-12,-8
2627,3673,Couple unit since then alone want.,1906-10-20,6
1560,3813,Have peace least garden idea beat.,1906-01-23,-8
1402,1363,Part decide debate project as.,1924-10-18,3
1661,210,He apply item television.,1949-08-05,-5
2730,2438,Bar fast official reduce total agreement once security.,2018-10-29,2
1404,3908,Score management walk result window age impact.,2001-07-08,1
1016,259,Lay whose character offer upon training voice understand.,1981-05-21,1
2830,578,Expert south must factor field think one.,1991-04-11,7
267,3217,Fear every make before build.,1988-03-06,-4
1787,77,Summer source available.,1986-03-07,-9
1008,2727,Plant that ability.,1923-08-07,3
4450,567,Threat give report discover phone individual.,1963-02-26,-4
2690,2922,Difference glass financial the turn better many.,1911-12-03,-8
4236,3960,Through poor management start.,1983-02-07,2
2819,2041,Idea boy seek team.,1912-01-26,-6
3643,772,Interest recent interview case.,1942-06-06,-5
4078,1918,Indeed our operation space move ground occur.,1937-06-08,1
634,505,In writer shoulder security standard green believe.,1910-07-04,8
3797,3438,Return key street sense skill full accept rock.,1935-08-12,3
3605,3036,Could seek whose truth life so.,1937-10-25,1
4945,1217,Sell inside reflect.,1928-05-06,0
3497,900,Improve likely reveal late.,1946-03-09,4
236,3509,Ask note stay my suggest activity minute structure.,1946-02-06,-10
2801,719,East arrive drug open indeed president.,1957-11-11,2
3347,816,Although seat wind appear people live pick a.,1973-04-03,1
2336,2935,Bill make individual fly doctor difference.,1950-08-14,10
2310,1935,Still case idea participant someone two answer reveal.,1967-01-21,-9
4747,835,Part despite when.,2019-08-21,-10
4276,3651,Particular factor learn plant clear truth.,1975-12-02,1
2967,2841,Paper fill inside sister all arm.,1993-08-10,-9
2601,2865,Enter he side night.,1933-09-18,3
4010,3057,Direction eight animal suddenly prove yes.,1949-01-09,-6
2850,3896,Range seven wrong relationship especially price beat.,1906-09-29,-5
4811,2532,Sense quite score part great.,1964-03-09,-9
4014,3676,Time through piece age call section.,1927-03-29,0
3830,192,Well ask worker.,1973-02-12,3
3672,3632,Court sell side mother child.,2015-12-21,-10
1729,3599,Government what what media.,1942-05-29,-4
2188,2996,Third lay his positive rise knowledge these perhaps.,1974-08-15,10
1968,3525,Pattern hospital PM attorney when baby education force.,1996-03-06,6
3403,1833,See full task space.,1909-05-03,-5
964,688,Role want every poor call standard.,1963-10-04,-9
1972,48,Sit guy people room item.,1948-09-01,9
1570,743,Pass democratic should say.,1941-12-28,8
3673,2932,Pattern day such company like commercial new.,1976-01-11,-10
159,809,Language his and sell different west.,1917-01-07,-10
2437,776,Movie technology morning.,2010-03-10,-5
727,1648,Thousand institution believe order peace significant.,1949-12-27,6
2709,2890,Fall note expect hard name.,1931-08-11,2
452,1726,Continue year foreign common pick according event.,1932-11-03,-7
3236,3641,State character entire consider.,1953-08-30,-8
172,3922,Exist population reflect board peace computer.,1983-07-19,-10
4849,3856,Indicate off about sell write car.,1934-07-08,-9
1364,2397,Section subject resource class common our.,1994-08-07,-1
394,1924,Myself administration game peace significant any sign teach.,1929-08-10,-4
3238,15,Follow hour economy.,1961-05-05,6
3953,1471,Plan seek situation so form game.,1972-07-26,-8
1654,2783,Total commercial herself man.,1929-07-02,3
4696,1204,For author personal.,1949-06-25,-1
4279,3937,Region dark green thing during establish stand change.,1994-02-25,9
4174,3386,Break marriage cause shake consider east.,2005-11-15,8
3663,3954,Poor their ago garden audience thought.,2006-11-03,8
1518,1511,Star serious message should half.,2018-10-25,-10
3445,3198,Set community last cup guess.,1971-12-04,1
2797,2252,As own business none.,1914-05-29,-3
293,872,These also billion husband policy.,1998-10-23,3
1057,1906,Mission main how last public theory.,1961-01-31,1
4511,2833,Office billion population whole technology type body once.,1980-01-20,7
4182,2979,Thought build store probably report.,1945-04-22,1
1747,2358,Care both visit member tonight run bill.,1909-06-12,2
1964,3151,American image own why.,2009-08-21,6
1211,1770,Tonight improve war.,1908-04-19,7
3387,3872,Right matter special difficult behind story.,1951-06-28,-5
4218,1129,Kitchen out more school.,1971-06-01,-2
3135,1296,Large federal great image.,1999-04-29,6
896,262,Maintain ok responsibility worry wind magazine attack toward.,2008-08-14,-10
2568,2944,Production executive fact activity billion.,2007-05-20,-6
4368,1940,Fast record far ok.,1932-07-07,-8
598,2116,Defense pretty hour.,1955-08-11,1
3455,354,Hear measure all issue decade chair oil work.,1911-02-19,-9
4891,2452,Future likely pull environmental how.,2018-02-03,7
3229,3858,Music recognize dinner.,1928-06-11,1
3485,1736,Admit ask sometimes imagine.,2002-10-26,5
761,2121,Option north determine friend buy.,1939-04-10,10
4440,2294,Return give standard ask nor.,1920-03-28,8
4964,1621,Arrive from over society must machine always tell.,1940-12-28,0
2365,847,Set writer even meet.,1921-07-26,-6
2614,1500,Both happen around town begin collection economy.,1976-04-26,-9
4506,153,Thus language maybe fire financial blue increase parent.,1947-07-15,7
3063,2497,Language discussion door civil from music speak.,1970-09-16,3
64,1355,Coach be us partner.,1950-09-28,-8
1078,1624,American window at ready person amount.,1932-02-05,-8
4594,1225,Area here dark news reflect.,1947-04-23,-9
1246,2300,Rather fire mission defense.,1919-07-18,-2
4243,1687,Case charge answer child ten wrong.,1987-01-25,-10
3518,3986,Democratic American special at relationship investment.,1952-07-26,-5
1355,2320,Happen mission beyond language subject enjoy wall today.,1995-12-01,-9
3545,3903,Key nation increase social improve performance.,1928-06-04,-8
1659,319,Run physical available second imagine total.,1937-12-19,2
913,3652,Develop possible require simple.,1915-06-20,8
2117,1816,Give action according smile answer should.,1941-08-16,2
4696,2243,Film more her together without same stop finally.,1906-11-14,10
1761,1899,Off break strong per.,2000-05-17,10
2024,3699,Vote family election within.,1911-11-11,-2
4980,2688,True chair rich.,1984-09-05,-8
3085,3110,Myself around purpose college well air people.,1918-01-30,5
1096,1786,Turn budget sure quality identify look.,2013-04-24,2
772,1527,Report home one then.,2003-06-27,-9
675,1844,Wear exactly get who.,2020-01-14,-4
1875,2080,Near painting place trouble international center sister.,1928-08-27,-6
2244,3465,Say life of positive financial son.,1909-01-03,7
2707,2831,Other bit though all late nearly.,1977-05-02,7
4580,2132,Through standard pick include far particular tend each.,1911-05-19,10
1929,2977,Probably financial southern what public hospital.,2017-02-01,-9
1423,3088,Training meeting less.,1977-01-17,-4
4815,1635,Current under first.,1925-12-07,8
4688,3916,Develop something but late claim stand painting.,1979-12-04,0
148,1781,Either final trouble reduce.,2018-06-16,5
244,442,Account choose political involve.,1970-05-07,-3
4501,1499,Interview style though energy.,1992-12-31,-7
4436,1390,Language look their.,1992-03-12,8
1678,2730,Sure rather Mr find involve recent.,1976-10-28,-4
1692,472,Chair grow before recent you.,1985-11-28,-2
2008,2326,Hospital return popular level store.,1957-11-23,2
1401,557,Religious our per adult.,1941-06-29,10
543,2476,Officer agency sport.,1959-04-28,10
1292,2409,Create side many wear.,2020-03-24,-10
506,1576,Provide course plan rock young story approach road.,1927-09-09,2
3696,2871,Share name season of question.,2010-03-02,-6
487,1084,Half accept game.,2006-10-11,-1
2833,3095,Result strategy order note.,1911-07-08,-4
4242,791,Full film recently.,2012-08-03,8
1423,281,Conference loss bank into executive others.,1986-01-30,5
3610,1323,Tv its focus onto would.,1950-11-29,3
3385,3993,Structure bag us modern understand decision.,1920-09-07,2
4444,3038,Officer country can.,1959-04-22,7
4139,1349,Picture end this public tonight environment.,1956-02-25,-2
596,3054,Into difficult enjoy catch those.,1921-06-19,-9
2922,1253,Provide clearly difference they policy.,1973-08-19,8
1263,2923,Eye teacher themselves.,1967-11-18,-6
2533,2764,Ok get new.,1964-06-20,3
3789,2294,Oil win tell protect trial college.,1980-05-09,2
1780,1269,Free fish network worry front interview ok.,1998-11-30,10
3457,3621,Mention performance choose large north opportunity data.,2019-09-24,-2
782,195,Officer draw imagine reality table.,1962-11-25,6
4465,3564,Some whose expect what nothing.,1987-08-29,7
3270,733,Important blood real least turn.,1947-11-25,7
975,2386,Response visit subject think.,1966-12-18,-1
4496,1006,Drive pull city.,1982-03-03,-9
1386,3262,Focus last purpose create choice.,1943-11-19,2
3737,2180,Husband home deep assume claim product evening yes.,1945-01-23,-2
419,3249,Staff relationship development market.,2005-10-26,-6
3252,2733,Local life know identify.,1927-04-19,-2
2823,163,Many he capital.,1995-11-09,2
329,851,Future accept return effort although four upon.,1977-11-11,-2
4590,2668,Writer why more view rate to party.,2004-05-18,-6
4310,3367,Issue guess those increase president.,1989-03-23,1
1405,369,Ago democratic bar administration tough whole.,2003-02-12,-3
