348,1383,Think bar impact glass.,2016-10-01,-7
4186,2243,Public painting resource tend wall perform.,1971-12-29,4
3284,3127,Police lay group white hard.,1916-10-11,-9
4779,2519,Respond past address sell hair during.,1943-04-27,-10
4614,2520,Sell leave top likely never focus.,1967-01-10,-8
1624,2661,Debate probably personal difficult long.,2012-12-02,7
2725,3518,To fast travel test after.,1984-04-29,-6
2064,3446,Research on town entire tend.,1974-08-08,1
3134,393,Often study since try factor defense experience guy.,1926-04-16,7
382,3036,Always painting feel south local.,1923-10-09,10
4010,1507,Miss tough assume spring himself important.,1952-11-30,6
2108,2209,Record during personal front itself.,1933-09-30,-10
2451,2899,Born together money detail meet whom.,2002-06-29,-8
3280,3315,Nature news process mouth study.,1962-04-21,7
903,934,Many style according marriage rule.,1939-01-21,5
2802,809,Buy our specific local reveal.,1943-03-20,-6
4767,107,Ever discuss church professor notice population.,2003-04-06,1
506,873,Standard theory far foot key big civil.,1928-12-13,2
3913,3088,Lead form administration meeting certain.,2008-06-09,-10
1846,2160,Improve while clear behind this range open protect.,1916-11-25,6
4081,2987,These serve able.,1978-06-17,-9
2437,405,Agency different nature wrong.,1932-06-02,-7
22,3075,Employee body myself create.,1933-01-13,3
3326,3767,Whatever right without painting thought.,2006-11-15,-4
4734,3966,Image stop suggest enter policy material player put.,1952-08-17,-10
2808,307,Raise stage prepare necessary.,2014-04-22,6
1614,5,Chair common successful offer.,1914-11-10,6
2237,803,Chance service condition already.,1928-02-11,-3
3126,709,Practice relate memory executive foreign.,1963-10-05,0
2824,1173,Understand despite know story wind machine.,1919-09-27,-10
3814,318,Wonder bed individual hope necessary action per.,1913-04-09,-5
658,3499,Late worry wait available against.,1963-12-06,8
4415,716,Position reveal up according practice management.,1956-04-13,2
309,3849,Laugh court past material world.,1914-02-08,9
2284,2905,Seem per suddenly.,1957-08-21,7
1947,496,Happy house cold guy rate.,2002-06-26,0
1557,3071,Watch however pay imagine room series.,1980-04-11,-4
4381,3465,Hotel wait arrive brother candidate try others item.,2019-11-03,7
3080,2936,Race performance alone read thing together top than.,2004-01-29,-10
3546,3921,Season southern pretty shoulder serve specific continue.,2020-03-21,8
2451,3343,Still consider capital actually American lot item.,1909-05-01,-3
317,3975,Soldier fund ten hope.,1912-01-03,5
2999,511,Which treatment house.,1937-02-03,10
414,1001,Move blood cold free tend nation.,1998-10-29,-1
3070,1354,Despite mother official author.,1986-03-07,-1
2891,2338,Do guy media special drop set current.,2005-05-26,9
4128,3802,Bill factor still edge military model six.,1993-03-14,-4
3158,3051,Answer pull minute learn.,1913-04-25,10
1251,3843,Leader spring play outside sound about speak.,1942-02-07,-9
761,1499,Actually health new as ball project service.,1962-01-03,-6
4881,1393,Open happy scientist shoulder model building throughout.,1976-06-27,10
2868,2780,Century such everybody bill when answer season consumer.,1964-04-19,-6
3628,314,Step voice Mrs me including.,1912-02-24,-8
4301,442,Run piece single everyone.,1994-02-09,0
400,2376,Probably others seven.,1929-03-03,2
3150,3297,Clear first message style seem culture.,1949-09-13,-10
823,569,Particularly executive seem child.,2018-03-18,-3
539,1997,Participant either where situation tonight.,1932-01-26,5
3407,2482,Out near sister somebody.,1987-04-21,5
2343,1149,Law learn already with produce office.,1943-07-09,-6
4241,1476,Yes somebody him drop dark.,1906-05-17,-2
2015,1797,Leave gun catch him.,2016-07-24,-2
3500,2670,Collection never style nearly color lose everything.,1911-08-12,-6
2314,1462,Factor kid security actually window dinner.,2001-10-12,8
1555,2159,Stock institution meeting western once agree worry.,1952-11-02,-5
4943,367,Lead possible as goal camera.,1984-05-23,2
4039,2294,Performance event and.,1984-05-26,-1
4545,2618,Fish car education son movement economic.,1974-09-15,-2
3022,1433,Enough magazine recognize after.,1940-12-20,10
3416,2699,Ball often finish yes amount.,1909-01-06,-2
4683,1833,Land politics wall pass watch.,1938-05-17,-4
3733,812,Chance should ready few.,2020-07-06,-9
1944,2998,Because our whole organization that.,1999-11-20,-5
2980,1231,Mrs mind where maybe view report hope maintain.,1921-12-07,-3
2361,3242,Recently every than wear.,1981-10-21,4
3646,2089,Make media cultural painting.,1936-10-10,3
1800,943,Step head phone door shoulder understand.,1920-02-20,3
4841,3552,Administration against newspaper degree others.,1987-11-19,9
2405,355,Sign able reflect beautiful doctor.,2016-03-22,3
4026,2562,By three under deal.,1917-05-14,-5
3699,3093,Man letter spend way upon edge authority yard.,1910-12-12,6
2347,2632,Always bank last after easy avoid.,1954-04-13,-1
2517,2746,Approach simple never glass.,1927-06-10,-3
2308,3099,Gas either church force art.,1978-10-20,9
1536,2109,Success suffer let.,1990-09-19,0
3484,94,Beat everything present red.,1978-05-05,-9
1649,3238,There this six finally different mind thing.,1974-02-12,-10
3369,318,Capital speech or college trouble single enough.,1921-12-11,5
3189,1632,Hour defense attention success health about edge.,1931-05-17,9
2957,610,School great since.,1920-11-18,-5
3031,3350,Rise approach drop black upon collection between.,1997-05-13,2
42,2271,Modern prevent movement.,1927-11-09,-8
3375,495,Television thing less visit send organization.,1942-08-10,4
2932,1544,Movie end reason standard his key.,2015-08-26,0
318,727,Light another plan direction performance seek.,1939-07-25,3
4759,3153,Begin number oil.,1977-02-26,3
2793,1908,And team address itself purpose author meet whole.,1939-04-16,3
1223,2293,Message add sell level week someone between.,1955-06-06,6
204,2651,Later place cold.,1909-09-21,9
2310,2929,Parent person give wife here open near.,1964-07-04,4
4848,269,Want name foreign challenge action western option car.,1953-12-22,-9
3706,3747,Sense could method star city personal national.,1925-02-22,-10
1968,2422,Western voice return new.,1926-08-07,-7
2675,3536,She spend soldier blue treatment.,1917-08-28,-6
4409,793,Hear trial about for.,1912-12-14,4
4061,3009,Head blue piece reason project.,1918-11-02,10
4871,2980,Common production pass career concern stay table.,1969-10-17,-3
3632,2190,Tend nearly reflect.,1906-07-29,-9
4461,2129,Religious although article under.,1908-05-16,8
4824,1964,Relationship old economic loss.,2019-06-26,-9
2436,1054,Science rise technology leader author religious white.,1969-09-02,-7
1471,474,Modern be bill put.,1922-04-19,-10
422,663,Natural child compare carry drive.,1934-09-21,-6
3943,654,Opportunity court reveal or tonight film develop.,2017-08-01,10
2741,828,Agent cut represent possible commercial work painting.,2019-08-24,-8
3269,871,Beyond subject live production.,1967-01-03,-2
4946,2239,Knowledge tonight record the game enough according.,1911-10-25,9
777,2936,Collection possible he must finish.,1935-04-10,6
2450,1838,Cup mission shoulder down size trouble.,1931-03-31,0
1842,2223,Agency fire window realize control.,1934-06-30,-4
259,3545,Region understand coach friend.,1939-05-22,1
747,591,Personal heart reflect central general.,1951-05-27,-5
4983,2878,Gas believe term feeling for politics.,1981-11-15,-5
4772,2196,Prepare word picture catch employee.,1992-05-12,4
2466,647,Father rather every condition difference every account.,1963-11-23,-5
2874,3062,Shoulder upon onto decade tax if writer service.,2009-09-21,-6
1875,631,Change nice million likely cell control.,1920-02-16,6
263,1180,Write sport still.,1925-01-18,-6
1743,333,Knowledge example probably left.,1984-05-26,6
4533,455,Skill these teacher thing senior.,1941-05-11,-3
4929,3943,Result begin left somebody.,1943-06-18,-10
237,2994,Fine include office reveal.,1988-07-16,10
3522,1541,Appear clear expert.,1922-11-19,6
2458,2320,Business rule game same answer himself.,1948-02-20,-1
596,3256,Upon believe floor likely part effect discuss.,1986-06-30,-3
4179,1193,Hope them yourself.,1999-04-20,8
49,1821,Sea rest song fear.,1944-12-06,6
744,3131,Nor interesting suggest environmental around care hot.,1995-09-17,-3
4778,3062,Base force challenge animal.,1944-06-02,9
184,3691,Little school themselves.,1935-11-02,-6
2131,1038,Film order network standard size writer across his.,2000-01-22,-3
2189,1807,Left girl letter apply firm agent.,1905-01-20,-8
3581,551,Consumer property view discover star baby enjoy.,1928-06-20,6
4202,581,As out sort ability tax.,1937-10-23,-8
2178,1455,Morning Mr become before popular book.,1945-11-05,-7
2169,3040,Treat organization south adult growth too.,1952-11-02,-7
498,3388,Another realize tonight matter stuff ten enough measure.,1910-03-27,-7
3648,3226,Order gas along major order.,1987-05-29,10
1870,1046,If Mrs then among across.,1942-06-28,-4
2358,1098,Best player very that stay.,1995-07-12,4
4539,815,Break beyond seven hot high Congress collection direction.,2019-07-30,-1
943,409,Director seat most culture prove area.,1958-09-14,-6
395,3868,Structure nice firm.,1947-05-10,1
4415,2780,Still body region test its.,1952-05-26,6
535,736,Use position rest.,1981-02-14,4
3585,397,Different themselves try court three against rest mouth.,1913-11-07,-1
2866,1741,Sort fine land care do miss perhaps.,1926-05-28,4
777,359,Great model simple audience.,2018-05-21,2
1646,1359,Word firm traditional off cultural west.,1920-01-07,-9
1773,1975,Seven trouble general finish.,1925-10-14,-1
2305,2334,Soon business cultural conference yard television see.,2006-01-05,6
640,92,Risk cell find hot main.,1992-03-03,-4
3142,368,Media few probably health worry happy.,1993-09-06,-4
1118,3672,Me mind west subject for loss.,1972-10-21,-7
4254,1525,Exist player represent gun house.,2014-10-15,-8
3800,3144,Across read anyone determine real.,1926-01-05,-7
3099,1506,Wait on heart sister difference.,1957-07-24,-10
4368,101,Entire stage inside section cup.,1974-08-23,9
1118,1531,Bad cause herself section operation simple.,1913-08-08,-8
1488,3566,Start budget unit game participant science.,2009-09-16,3
4146,2577,Southern gun suddenly talk star determine plan.,1963-08-29,-9
1956,3179,Carry still spend hear last how authority sign.,1922-01-12,-4
1666,1936,Return weight federal thought senior.,1984-07-22,-7
1569,3200,Member note forward wish course.,2018-03-25,-7
616,76,Economic group board when white key very.,1981-06-09,-7
3325,2703,See Republican ability life as the identify.,1999-11-19,4
2374,1000,Together herself pass focus add difference trip.,1982-12-29,-10
3275,2023,Edge among small name.,1937-10-11,5
594,433,Blue paper clearly generation although interest.,1955-01-04,9
2626,3758,Free responsibility sister.,1922-03-10,-2
3613,3194,Hospital history once fire.,1933-06-20,-1
2721,1605,Represent girl right serious.,1935-08-31,2
1016,2867,Research situation night in budget instead statement.,2002-12-30,3
2519,3912,Reason despite sell expert day.,1953-03-06,-4
2603,1341,Him character high sea officer learn billion.,1980-05-04,0
1599,3151,Heart during economy story figure letter.,1995-05-08,1
533,3743,Join fill perform result run statement deep.,1942-06-13,2
1281,1278,Half determine just nothing last institution happen.,2016-10-22,-6
4447,915,Win point win old expert.,1996-09-14,-4
739,919,Interest information remain then.,1929-08-15,-5
152,1543,Whom play value always open others eye election.,2004-06-12,7
1580,3388,Mother require official federal inside mission.,2014-08-04,2
206,3493,Too order term say chance every.,1933-06-22,-4
3743,3202,Floor able sort.,1989-03-08,-1
1010,2572,Data blue matter development modern.,2017-06-26,-7
2274,3649,Hot available since.,1967-10-01,-7
2835,1728,Pressure condition wall director.,1924-08-06,2
3354,794,Fast mission friend property career body school.,1978-09-25,-5
2873,3439,After data tough minute.,1983-06-25,2
3850,902,Place city tend first anyone.,1998-04-22,-6
4347,3659,Through meet edge pull.,2004-03-02,7
1664,325,Place same interesting middle management.,1910-07-17,4
3972,2595,Evening yeah detail arrive source.,1911-04-07,0
2711,2278,Character rise real government.,2002-03-24,-9
4743,2589,Girl teacher water thing evening card investment.,1961-02-07,-9
4143,2832,Both want great physical dinner manage.,1943-03-11,1
3628,1784,American cultural stand kind hour school pretty.,1966-09-03,-8
3220,2261,Night ago short throughout.,2020-04-21,-6
2542,1623,Sport fly safe find day black free why.,1962-11-07,-7
2728,414,Nice race fill may everything against.,1941-06-01,-8
4372,1406,Continue manager you there property ready respond.,1984-10-16,1
1802,2146,Series too sing set movement style.,1966-10-06,-5
3880,704,Story run support hospital.,1935-03-04,-2
4468,1013,Level and marriage five take customer this.,1984-09-25,7
3646,3458,Unit usually age after chance area ability.,1973-06-06,-2
4071,1986,Common toward relationship girl compare central free.,1939-09-29,-4
1861,2897,Front unit fish glass operation physical morning.,1988-12-02,6
1437,2022,Bag natural voice effort war about me.,2004-10-21,-6
39,1178,Government perform film of.,1933-08-03,1
1238,3642,Condition wall yet agent song.,1960-12-03,-7
4243,992,Central hear former rest kind company score.,2008-01-08,8
3923,2942,Teach learn state.,1921-04-02,6
57,1755,Game color manage later memory garden action.,2017-12-29,-5
365,2904,Program month special model since.,1947-05-31,10
2273,3929,Seat financial character too.,1919-08-13,4
1502,1099,Quite one blue collection job happy.,1974-02-09,5
1881,477,Table eight son.,1912-12-01,3
3196,2279,Almost model scene shoulder ability.,1905-12-13,4
2756,5,Option hand over.,1993-11-29,-5
1788,3562,Send education surface exactly.,1955-01-12,-6
1016,1297,Dream consider company next employee.,1910-11-01,3
238,2948,Arm happen watch out well.,2020-04-06,-2
233,347,Hit he why quickly bring risk.,1919-08-07,-7
1423,2502,Chance memory project rate song plan support.,1908-02-21,-5
3128,1312,Style that happen quite kid.,1929-12-13,10
371,907,Brother cell realize let training.,1905-09-22,4
1132,18,Production about Mrs base total.,1911-12-28,5
2171,1816,The human crime charge worry.,2002-02-25,-10
3150,1817,Fire feeling some feel cold your parent.,1941-05-10,-9
87,3117,How join lead current base everything effect.,2007-02-23,-8
1520,2162,Others attorney could decade election hour two than.,1928-10-23,-7
273,293,Blue animal economic story prove.,2013-08-17,-4
2308,123,National see those population question front.,1907-10-06,10
4904,3510,Until animal well.,1976-12-28,0
2133,1457,Education sister small.,1942-02-05,-7
1853,2375,Under should share free able something.,1937-04-23,4
4609,1238,Home old that if.,1938-04-08,-10
4263,406,Religious red message read firm.,2003-08-10,5
4942,1312,Boy window describe.,2002-07-17,5
4719,243,Throughout point apply move single accept.,1953-10-21,6
2374,1538,American wrong spring after begin soldier nearly.,2005-07-03,-2
2192,2029,Whole mouth others bad suddenly professor.,1920-08-19,-8
3409,1837,Federal task fight meeting control position.,1967-05-13,4
2153,1475,Could simply exist society remain.,1976-08-30,-7
2590,3805,Significant know practice bad eight.,1965-06-01,6
2467,407,Information develop perform cause two trade.,1939-01-08,1
3773,121,Probably involve community industry color.,1979-10-23,9
3353,3056,Beautiful rather across tell discuss everybody somebody though.,2006-07-21,-6
1129,1572,Baby tough just.,1922-04-06,-9
4514,3025,Than magazine wear draw station part.,1940-10-20,-10
4179,3708,Field drug husband teach power.,1981-11-06,-7
4671,522,Begin line analysis beat.,2006-11-11,-8
7,2860,I campaign teacher beyond.,1968-06-01,-7
1409,3678,Any deep people and field commercial could.,1928-04-01,-7
4123,3521,Really tough marriage way role administration.,2019-01-08,1
4664,2007,Skill last effort feel usually.,1991-06-27,-4
1575,768,Security four despite general front stuff.,1949-03-22,-6
4327,2551,Society seven set music.,1971-03-16,8
4866,72,Sense nature man show even cell again.,1979-06-10,-6
459,1549,Out keep beat address late real base.,1979-03-30,-1
1941,558,War we my go.,2017-02-16,-9
1541,842,Remember movement card minute.,1989-07-12,5
2442,3981,Ok wear after edge without.,1936-05-07,-4
1628,2845,Often rule newspaper ok account.,1908-09-30,-1
1777,1014,Idea place understand draw deal as office nature.,1944-12-29,-9
4728,1848,Some sell interview theory than green.,1972-08-10,-2
3233,2293,Her impact stop other responsibility positive.,2002-02-28,10
3989,1012,Claim medical front become.,1966-08-30,9
3429,387,Worry at stuff occur.,1908-12-18,4
3397,1524,Range institution husband value firm dream imagine.,1916-10-31,10
3434,3914,Fly easy range mean wonder.,1984-04-24,5
4663,1911,Bring situation indicate environmental scientist which.,1925-10-06,2
4234,368,Early your decision during generation property.,1953-12-12,6
2756,425,To represent total something.,1994-04-03,10
2388,1641,Visit necessary figure.,1915-12-14,-6
4491,2505,See show effort minute however director.,1986-06-09,1
293,1819,Old agreement agree Congress.,1988-12-24,-8
4676,2862,Join happy ago fish clearly college.,1999-04-23,-7
1401,2888,Center song street open.,1904-10-30,2
2058,2419,Then ready understand happy produce report.,1978-10-06,-3
2535,180,Anything threat four street court mention different quality.,2016-01-03,10
4629,3559,Task available young tough type mission.,1933-11-13,6
3587,3633,Cut arm contain.,1970-10-03,4
2666,3759,Citizen go organization again lawyer smile with.,1915-12-01,-7
2795,1577,Miss onto me sort media alone challenge garden.,1965-05-10,-10
4385,2395,Address animal usually fear medical.,1917-10-01,-1
115,3826,All whole arm time suddenly see itself car.,1947-10-12,1
420,399,According appear marriage manage her.,1976-09-14,0
887,1738,Call relate you live coach wear.,1964-02-03,-7
2980,3741,Forget start program customer career your.,2000-05-14,10
2982,463,Claim quite issue push training visit party.,2009-05-25,-6
3691,674,Pretty medical even senior.,1952-06-27,6
3986,743,Opportunity mention ahead.,1983-10-27,4
2271,3814,Arrive much claim work half value.,1985-04-18,-10
3096,3583,Data especially size career letter during test.,1917-06-01,-2
4975,71,Carry crime seek now former attention.,2006-08-15,2
4819,1879,Eat team skill will role company continue.,1956-04-20,1
4826,2297,Country think movie black but just pull.,1926-03-26,6
1392,1425,Long follow purpose charge.,1906-09-19,6
3640,3415,Allow student seven.,1960-01-10,2
4866,1888,Certain recent peace beat time decade ten develop.,1978-04-19,8
4156,446,Whole subject firm pay lot.,1946-01-22,0
4286,3227,Perform field sport look majority rise window.,1947-07-12,8
3653,1103,Hot poor water language task own rate.,1913-05-06,10
4677,1696,Compare instead agency various seven campaign happen.,1973-11-10,10
2488,2657,Budget nice medical teacher challenge put art.,1997-04-18,2
2780,3440,Father early guess thus why.,1934-06-12,-1
2873,183,Memory section front recognize together appear expect.,1968-09-20,7
3905,2714,Teacher oil marriage.,1961-04-25,-3
2446,2244,Feeling again respond firm.,1950-03-17,-6
3717,2591,Under past century have.,1951-09-15,2
4586,687,Property career certain later chair Democrat popular.,1945-10-20,8
1912,2816,Across thing face effort those life join.,1973-12-24,10
207,1919,See both appear rate.,1984-12-04,-4
166,757,Finish guess item energy trial when help turn.,2018-05-17,1
4474,3456,Character behind pretty member story.,1946-02-27,4
1847,3065,Dog bed throw customer together set rest.,1920-05-27,-4
2689,544,Treat do politics stay write.,1964-10-06,9
3846,3045,Television identify action happy set card local.,1919-11-23,0
767,948,Space bring major cold foreign actually commercial.,1983-01-23,-8
2746,2507,Former choice kid crime subject board catch.,1915-09-05,-9
2921,2220,Project relationship make start arm out.,1949-05-04,-5
3301,3359,Race seem our yes.,1923-02-12,-7
3312,1307,Attorney happen fire staff run after change.,1937-05-19,-1
2011,3993,Computer behind like worry structure.,1919-11-15,10
525,1154,The wait think strong.,1931-06-13,-1
4829,1797,Voice case them environment likely put site piece.,1963-06-05,3
2921,2864,Plan court so human several event.,1957-02-28,5
4435,499,Discover discuss bill.,1991-02-07,5
3770,1662,Bill lead door leader be believe ability.,1924-09-07,7
1706,156,Send share push character protect then.,1951-11-23,3
769,1710,Follow hard player executive world everybody trade knowledge.,1933-05-01,7
4984,1826,Similar hard design face our to.,2013-02-11,-2
399,2428,Drop million them reason up service.,1996-11-13,-9
552,2115,Business easy perhaps green.,1911-03-21,3
1671,2167,Foot phone alone.,1986-08-20,9
3333,1946,Game drug per water alone.,2011-08-20,1
1844,1576,Operation Mr short rest.,1968-02-18,1
2890,739,Democratic billion how around.,1943-11-11,5
4493,75,Rate stop future pattern catch relationship.,1912-07-15,0
2411,3403,Later different pass politics difference.,1996-12-02,-4
3223,1291,Method keep spend Mrs pay woman.,1940-12-01,-5
3616,2507,Write amount every we.,1994-02-24,3
4468,728,Move kitchen heart despite break site.,2005-10-09,7
1936,2939,Head successful couple field would Democrat ahead.,1978-10-20,3
766,1528,Never look seat however.,1909-11-08,4
4925,1581,Describe month despite argue them own.,1945-03-26,-2
1607,2473,Boy response much growth bit.,1918-03-16,6
3534,311,Theory entire resource lot boy each.,1930-02-26,1
4714,1430,Purpose serve such explain never still.,1965-12-29,-2
2574,642,Standard who maintain job they eye arm.,1998-01-15,-2
4192,498,Memory herself ready movement science get evidence.,2013-06-05,-10
2392,1372,Since let value politics within Mr chair likely.,2016-09-18,-5
1562,1735,Put speak drive program production magazine.,1922-01-22,-4
1649,3851,Hour sometimes mission fly despite radio argue.,1958-07-12,-4
2162,2741,Available kitchen whose explain too.,1931-08-24,-9
1230,1327,Say general population once relationship especially part question.,1905-06-09,-9
3465,2161,Any land condition.,1946-10-07,-1
3061,2487,Place find executive fine detail.,1980-12-30,9
3347,3180,Between front war event.,1986-09-01,-3
2907,1891,Material school area medical charge.,1935-02-10,4
804,1099,When once health sing Democrat.,1949-10-04,-8
2299,1195,Song audience fast movie door thing.,1990-08-20,0
2539,1141,Reveal above magazine decide maintain owner.,2017-08-30,-1
3733,3232,High long those impact.,1964-10-14,4
4279,1735,American lose wall lose ahead.,2017-06-27,1
4383,3641,War support trade sign off standard.,1931-08-03,-2
3768,799,Morning ten be that throughout interest face computer.,1993-04-03,-5
4890,1227,Per start shoulder.,1930-07-06,3
704,173,Here international tend your high Republican.,2014-01-21,-6
3149,1614,Television explain study production military might success Democrat.,1969-06-30,-9
2878,2867,Try ground marriage fast least.,1972-03-19,9
475,1604,Age deal door eye around.,1933-04-08,4
3926,2802,Bring interest rise hope.,1987-08-18,5
2981,627,Get own start put then kitchen his at.,1993-03-15,-3
959,3947,Difference month improve suggest Mr employee different.,1936-04-06,-6
2023,1040,Like when wish.,1940-08-18,7
1055,2313,Ahead later indicate understand pick job.,1976-08-04,6
4292,2176,Executive international state huge everybody.,1981-11-11,-4
11,1550,Room kitchen agent chance.,1922-11-05,-6
3842,2500,Ground dream may.,1968-11-30,-3
4643,692,Deep certain difficult position several collection sell.,1949-02-25,-8
4547,154,Four add from only if matter box.,2014-01-02,8
871,3340,Sell wear training Republican.,1966-05-22,3
2151,860,Different rule hope thought able.,1972-02-14,-1
2746,406,Adult only audience.,2007-11-17,7
1299,3647,Ball capital before part wait.,2001-11-28,3
4413,2102,Know its about at.,1953-04-29,3
1090,596,Not fact foot experience security this.,1982-01-27,3
2190,1904,Peace hour under area their.,1966-03-28,6
380,2078,Executive report draw social artist physical picture.,2001-12-26,8
926,1150,Water strategy only music whose sometimes.,2020-08-21,-9
1526,1873,Peace when affect.,1992-09-04,-2
3687,2717,Soldier create able figure try.,1918-03-12,3
3838,3980,Stock quality there camera.,1949-07-20,-3
4972,3283,Human skill human detail free.,2007-01-10,7
4600,598,Get laugh foreign week city consider mouth whole.,1939-01-14,-10
4563,2065,Large blue political include page politics nothing trade.,2019-02-02,9
1207,3613,Paper order pretty.,1921-07-17,8
3999,1935,Against probably official audience picture place per.,2017-08-18,-9
1141,3803,Class into mention.,1988-03-08,-3
3905,2737,Government cause art there.,2016-11-12,0
4617,1183,Gas chance firm every bar case quite blood.,1986-08-06,-5
1663,3640,Spend over side yet general leader.,1967-06-01,6
1173,351,Boy challenge rate Mr.,1947-06-15,4
2936,185,Ahead church single young building common from.,1989-06-11,-1
2284,3186,Establish education a of determine politics sign.,1970-05-18,-7
4527,2729,Common we effort behind.,1917-02-02,3
1723,1220,President result yes foreign news reach.,1954-12-30,1
2889,2380,Bring theory ago sea country operation hold.,1970-03-02,6
2636,2442,Speech effect line life middle.,1960-05-02,1
2130,443,Program foot give plant go month clear attorney.,1914-03-02,-4
2878,1248,Major word meet common control our institution.,2003-05-20,-8
4509,1416,Writer gas something condition sea table political.,1971-02-02,-2
1444,3811,Mouth movie phone prove toward group.,1972-03-31,-3
183,483,Long speech her feel.,1977-03-31,7
3159,3591,Case she final sign these.,1929-05-20,-4
4349,2842,Other forward be indicate century prove.,1924-06-14,10
932,3378,Raise cup quickly deep enjoy light.,1994-01-23,-10
3440,2765,One ask for yourself.,1985-12-05,7
424,837,Quality visit head once group table company.,2016-01-01,-1
4690,1986,Marriage left away against nation involve yourself not.,1928-10-23,-8
