3943,372,Model baby chair last all suddenly key responsibility.,2001-06-03,-6
3170,3328,Now no fine ground meeting.,1961-12-07,-3
1155,886,Big plant nature catch commercial third.,1905-12-02,-1
695,2673,By cell actually firm forward point cultural.,1961-10-21,-10
267,3907,Suffer sure recently effort various.,2010-10-08,0
988,2789,With western couple.,1982-01-25,-3
3368,3679,Suffer southern real.,2020-05-01,4
4419,665,Ago play better loss.,1927-08-20,-3
1361,328,Into officer easy answer above.,1924-06-23,4
2440,2623,Friend his cell charge.,1947-03-09,7
2577,1538,At network fast now.,1999-01-19,9
1533,1062,Assume including special speak former prepare know behavior.,2010-11-01,8
1249,1878,We continue blood eat get maybe loss.,1943-03-22,-10
1543,3130,Accept computer performance hit white.,1996-01-09,-6
1479,3780,Structure drop and on north up.,2010-02-18,-1
585,1167,Value voice growth address.,1908-03-07,-1
1666,2963,Protect there artist do president Mrs thank skill.,2014-05-12,-3
4718,1351,What moment either body detail attorney.,1963-06-08,-7
4494,2646,Suffer let east total speech leave.,1974-01-30,4
1748,1762,Whether pick discussion president decade.,1995-02-18,-6
4578,718,Hospital quality soon player.,1941-01-03,9
1279,656,Cell accept itself natural candidate cut along.,1993-03-28,0
2580,788,Effect big chance watch sister responsibility.,1990-05-16,7
3435,737,Make across always become when anyone.,1966-02-27,3
2742,219,Brother despite rise candidate.,1950-10-12,7
1949,2171,Hot room make support certain.,1957-04-05,-3
4347,240,Whatever particularly organization rule late street serious.,1907-08-21,3
1718,332,Campaign term room along together.,1977-07-01,6
3420,3186,Oil road sort member project rather.,1976-05-12,9
2571,1209,And today service easy subject drug choice.,1937-10-15,-8
1378,3694,Television need five.,1947-10-24,-9
3496,237,Health purpose site write company real candidate.,1917-11-22,-2
488,1211,State property win central economic.,2010-01-27,8
2326,3165,War health away official sister force.,1965-05-19,-4
597,2563,Pick some choice citizen share.,1996-08-23,-7
1314,941,Cover inside cell benefit blood.,1919-08-28,-8
4581,551,Together paper space member my phone finally.,2009-07-29,-10
4686,1010,Concern in agreement level she.,1961-04-25,10
3057,263,Seek sure range say offer participant.,1990-05-23,1
3382,73,Hot scene summer writer.,1947-01-07,7
2395,1926,Add professional nature involve.,1995-04-13,-1
552,2867,Fear my play beyond very husband.,2017-09-23,4
768,3090,Movie skill watch near save child.,1915-04-15,6
348,1542,East thousand situation difference example instead skin.,1978-02-18,-7
792,765,Nothing yes position peace event animal.,1975-09-12,-3
4152,2803,Military office until people at short course.,2013-11-21,-8
2305,3292,Government option state lose.,1968-05-21,10
1573,2675,Bag that cold American nice each.,1965-05-23,-8
2964,2301,Cause assume market glass person.,1997-01-28,9
1042,2843,See develop build help behind.,1981-11-27,0
1451,3159,Fact lot each light.,1933-04-27,-3
2006,108,Consumer choice commercial apply big until either.,1956-08-16,9
2805,266,Use hard arm pattern.,1943-04-29,4
1463,3971,Interest nor nature national born.,1954-02-14,4
1015,501,Area subject possible economy.,1940-05-31,-1
1786,775,Agency cost pretty attention fund.,1913-10-17,2
204,2295,High true leg huge generation dark.,1997-09-24,10
3319,27,Civil read fact effect establish reason.,1914-09-20,3
751,2273,Create see garden its image least half star.,1923-02-14,1
502,2173,Attention fire play fire create.,1969-12-17,-3
1056,631,Kid job less back hotel.,2010-08-31,-10
4945,1017,Make training low human new.,1994-05-03,2
168,1349,Play number other citizen.,1917-03-31,7
4265,3525,Writer determine glass nothing.,1997-06-20,3
434,3119,Indeed artist kitchen performance.,2002-01-30,-9
80,2822,Drive husband with apply message success identify.,1914-03-04,9
2562,1867,Response television until.,1906-04-17,3
1103,3457,Student base run quite.,1956-05-12,10
2829,60,Management play interesting might since future truth.,1909-06-12,-9
3536,788,Budget wear work.,1995-05-10,9
3819,2898,Color choose wide often far.,2010-07-17,3
433,2247,Television pay ability reveal professional especially little base.,2003-02-23,-10
4922,2873,Science table purpose hospital use building evidence.,1916-10-13,-3
58,200,As accept which fire.,1997-06-13,5
4547,833,Likely resource happen might cover budget same improve.,1955-03-30,-9
1105,1117,Possible they military thousand fight continue down.,1989-03-09,-4
3214,3626,Challenge bad evening better ability tree help.,1936-02-18,-8
3064,369,End successful also throw.,2014-03-01,0
1347,1791,Collection become at purpose.,1914-11-06,-9
1787,1283,Attack person explain continue star message everything.,1963-03-29,2
2914,3924,Road white design collection color.,1907-02-20,-4
2089,3018,Whatever person law ahead interest all could.,1935-04-16,9
4337,2927,Rather prevent author church conference machine authority there.,2000-05-30,-1
1313,3938,Determine seek put recently fact information.,1978-05-27,3
915,3549,Happen major explain really outside young mind.,2017-09-23,-8
2266,916,Language art analysis first anyone test.,1934-05-25,-10
1563,2255,Bar certain onto difficult look its daughter.,1933-08-11,-4
1524,811,Hundred which main which sport rather reach.,1996-09-06,6
497,1768,Hundred skin garden respond.,2005-06-10,9
976,2071,Hear some third senior include member.,1999-08-31,-6
1733,1121,Recent claim free bar.,1988-12-13,0
2393,2178,Poor just medical receive.,1958-05-10,7
1801,768,Long right option who other wonder if.,1996-12-12,-9
4882,3005,Happy bit resource.,1995-04-03,8
739,1317,Even point everyone inside what.,1956-03-25,8
1766,1390,Pull heart campaign treat decision.,1905-04-29,-9
1853,474,Offer Mr wind sing.,2004-05-20,0
4265,617,Glass during respond store.,1935-05-03,0
4020,3487,Practice present test stand deal.,1904-12-26,1
4848,3633,Network least after nothing fish.,2003-11-21,-7
1521,2465,Nature page send it.,1955-03-01,10
413,1961,Own hand with strong pay.,1973-09-07,4
622,2407,Off artist should adult.,1924-06-13,-2
502,819,Follow drop standard director degree.,2014-01-07,-5
1762,3465,Important coach actually society dream feeling.,2014-07-13,-9
2231,284,Perform mission exactly spend assume moment.,1948-06-22,-1
3559,3825,Pm common reduce image entire left.,1984-12-11,10
4938,2939,Control paper she even.,1973-07-20,-1
1162,396,First executive science and seem.,1979-07-24,1
4023,3269,Young star worry former choice technology.,2003-01-15,-9
4191,2615,Often thought after quickly near.,1963-10-23,3
4219,2916,Middle project adult necessary learn place low.,1925-06-05,0
1561,1941,Herself produce enjoy culture physical purpose receive.,2015-01-26,0
3145,1872,Memory collection end left do executive.,1921-11-15,7
1068,3303,Turn if believe until sense.,2016-10-01,-10
2646,1468,Camera field cover nearly board.,1950-09-03,7
2721,1137,Economic statement someone doctor stage sometimes week.,1961-06-13,8
2293,1481,White middle director.,2006-04-23,-6
3562,1811,Than first outside hard lead practice.,1962-07-19,-6
3371,2353,Economic woman summer.,1984-11-28,3
2332,1709,Skill party common buy nor week.,2010-09-29,9
591,2048,His where yard red.,1996-12-09,3
3481,2985,Indicate could without keep.,1909-02-18,3
4359,158,Senior reduce accept teach.,1924-01-22,0
2767,2315,Attack friend actually perhaps later.,1994-01-01,-7
1653,2335,Great soldier garden let.,1985-04-27,2
4371,2949,Animal color table democratic sea hope become along.,1979-08-24,0
1925,3881,Maybe black administration western project.,1953-11-09,-3
3292,3550,Southern power general dinner cover visit herself.,1929-01-10,-5
4107,2386,And energy game only own management.,1985-11-04,8
614,1016,Sister cause chair common head physical stage.,1978-01-03,0
1984,829,Professional under particularly.,1922-12-27,9
1823,1649,Voice kitchen from enjoy modern by forget.,1957-02-23,-2
2449,3755,Project pattern into author.,1924-01-06,5
3004,2053,Well popular call recent eat.,1934-08-07,-1
1149,714,Our interest radio until.,1931-04-16,10
3334,2823,Member suffer customer material current new trouble.,2010-01-17,3
2925,2349,Trip appear quality head study adult.,1948-06-15,6
848,2276,Nothing machine part lose role.,1955-07-23,-10
764,2414,Use marriage town arrive make of politics.,1937-06-24,3
848,2216,Color despite report fish right.,2003-04-25,-3
1869,3287,Training bad property.,1939-03-21,6
3408,551,Growth three protect your him pretty tonight.,1926-04-08,-3
3340,775,Minute respond quality employee station.,1974-05-18,-4
3621,402,Us interest state will choice bill animal military.,1961-12-29,-3
3128,1107,Mean support recognize reflect control industry almost.,1948-04-20,1
78,2487,Management although down pattern.,1925-07-12,-4
1872,1375,Thought well my believe however card miss.,1916-11-09,9
424,1988,Information notice name lot write.,1936-11-12,9
860,3504,Discover ahead leg who campaign little.,1936-01-14,1
3106,3717,Employee perform real first hit.,1999-04-04,-9
4350,581,Owner six gun business PM.,1946-02-02,-4
2963,3048,Whatever century environment drop.,1926-12-01,-1
4517,2454,Question head last forward can.,1915-07-03,8
4331,2896,Already question as stop condition oil card.,1924-11-07,-3
4644,2412,Sing institution wait skill region.,1948-08-26,0
2233,2044,Course defense responsibility environment cover health deep relate.,1949-04-29,1
3719,365,Economy them history real you bit.,1991-02-16,-3
3739,2394,Authority before still you treat consider kitchen back.,1940-01-12,7
224,1347,Defense want step poor Democrat.,1997-08-11,5
4895,2076,Position modern not free song east guess.,1927-06-09,-4
4643,3613,Good tonight age.,1969-10-04,8
1438,477,President else whatever.,2017-09-30,-4
1580,38,Fly establish though doctor factor fall trade.,2018-04-04,8
624,3451,Camera deep once reason among mission check.,1963-07-21,8
4703,993,Room world mouth central.,1909-10-27,-8
1233,3949,Writer deep economic effect pull stuff.,1975-06-26,1
3743,2312,Simply officer building during.,1958-09-16,1
1634,1089,Interview yeah reach sort.,1968-10-31,7
4850,1123,Full see environmental force north car capital local.,1972-07-09,7
4981,945,Teacher education whatever day quickly late.,1929-06-16,-7
4395,1303,Concern mean live learn.,2005-12-28,-3
1040,1895,Mean town record total machine only it.,1998-07-03,8
3228,2364,Assume question maintain service.,1910-09-10,-6
1449,2093,Street when town go before decade.,1906-10-02,5
2330,626,Firm student example.,1935-03-30,-5
979,3609,Decision resource friend take stock leader capital.,2000-07-09,-7
1607,1107,Foot mother might expert mention left thus change.,1993-01-20,10
869,3685,Know likely provide challenge care population appear world.,1949-12-27,-2
4505,1027,Only player ten.,1966-06-15,-4
359,1168,Poor news important history course ready exist.,2010-04-27,3
2110,2976,Them serve part big information decade model those.,1978-04-02,7
2191,2920,More beautiful animal care.,1940-04-09,-8
1972,1733,Concern son central government travel.,1925-11-30,-3
3828,3549,Speak Congress half use listen state.,1977-11-27,-6
413,1639,Tree be economy government former from happy.,1917-09-23,9
4910,3305,Tax describe able general avoid.,2002-02-16,-10
4312,1007,Able others card.,2015-03-02,-10
2143,3613,Part form customer which.,1970-12-24,-7
650,536,Economy floor watch trial may.,1989-01-07,1
2011,3703,Article material assume down sign debate teach.,1913-12-29,2
3943,2752,Large sea find individual walk.,1981-01-22,10
3846,2481,Above fire affect check debate teacher again help.,1995-04-15,0
2204,1708,And name doctor.,1914-03-25,-9
2147,2318,Film without ready director at body war.,1929-06-28,6
755,169,Challenge Mr think area.,1985-11-19,7
1649,850,Must might song whole life deal.,1986-02-17,7
4587,1116,National great performance her take.,2007-03-31,4
3832,2556,President keep next other similar when food.,1938-03-05,-2
283,2631,Middle according husband each.,2020-02-12,9
4762,2138,Agency heart smile.,1915-09-23,6
3790,1952,Section turn Mr family notice stuff.,1994-03-25,5
1477,3857,Note name sign whether travel.,1923-06-06,8
2033,2266,Door close suddenly.,1942-12-16,6
1563,3578,Drive possible including official.,1964-02-16,8
2609,1664,Two bar enter through whole.,2006-01-09,-5
1316,921,Service military story campaign institution.,1949-11-13,-7
1234,1938,Late our hundred sure front author building.,1986-11-22,8
3446,1126,Move man their understand pressure boy rich.,1973-04-06,10
1128,2219,Set test final five onto wrong week.,1910-08-11,9
4666,883,College law environmental far fish two.,1953-11-20,-2
2224,2560,Thank learn head fish event.,1929-12-18,9
814,1620,Area project answer maintain anything.,1972-10-27,2
142,2244,Station later sign true.,1907-09-08,-6
198,3366,Bit yard protect.,1953-04-09,2
2569,3577,Protect technology defense why sing respond professor list.,1937-09-10,-1
4152,2567,Couple interview movie page.,1956-12-22,6
3051,3696,Lose after student cold ago receive.,1916-09-16,-1
4818,3308,Within son weight race forward.,1979-12-21,5
4383,2030,Million suddenly article benefit perhaps north.,2001-11-10,-6
2509,2053,Painting artist none any wind in opportunity.,1935-06-07,-7
3930,3273,Few cover worry government view central focus.,1943-07-25,-7
3015,926,From travel issue relationship area.,2000-03-31,8
2788,3332,Tonight figure now look question.,1932-12-02,-5
1624,1501,Democratic trouble floor own state executive.,1921-10-02,3
3881,3214,Point shoulder big.,1954-02-08,4
2924,187,Public sing realize coach within among human.,1907-01-05,8
1733,3612,Term meet water bad.,1985-12-25,9
480,2611,Garden step spring deal record.,2002-05-31,4
2921,3011,Nation financial difference education lead kind prove.,2001-10-25,1
4992,2762,Sister line small general single research.,1969-03-04,9
1322,1218,Race me appear foot everybody speak.,1973-04-10,1
1932,1367,West right student place with approach little.,1986-02-23,4
4349,3392,Probably travel thank some chance rest.,1914-07-19,-1
4154,2352,Sing lawyer sister.,1967-05-31,-8
4882,3676,Turn executive expect western information product.,1941-07-18,3
2221,2281,Old person southern still beat product growth.,1949-05-10,5
3642,3042,Senior else center party add.,1961-09-17,-9
538,454,Large different deal moment style.,1941-04-21,-2
1958,2091,Off rich free.,1928-06-03,7
3496,2719,Better help that available.,1946-02-17,6
1808,3521,Author woman suggest receive onto bring.,1953-01-08,10
3756,3350,Up surface trade artist.,2001-03-23,-9
4476,2634,Share just forget save live set she.,2011-12-25,7
2988,2553,Professor sense red several.,1972-11-29,5
3484,2387,Force lot former skin until institution add teacher.,2020-04-28,9
3342,2205,Want bring star those trip.,2011-09-07,9
843,3901,Make letter that.,2003-09-24,-4
2446,3653,Measure organization image.,1957-10-19,2
2653,3795,Case deep summer mission suddenly certainly stuff.,1917-04-18,10
3815,3927,Support series bed.,1916-08-04,5
2342,1915,Ten American work well best.,1960-06-14,-8
4700,1111,Nor statement realize enter like improve.,1939-08-06,-1
699,3594,Police respond for rate Mrs.,1919-09-03,-8
2147,2997,Inside it thought.,1994-11-23,0
2711,3811,Opportunity arm board early.,1937-04-12,5
3044,3840,Along western much once.,1933-09-21,9
1481,3164,Might include south investment.,2003-10-01,-8
120,448,Around office can ask east from.,1975-06-12,10
1701,2760,Side kitchen view here seek ground light with.,1984-10-09,6
3725,3583,Return movement goal put.,1919-05-19,-9
2125,1913,Democratic stay million.,1935-02-06,-6
2836,1302,Mission evidence keep cup free happy.,1982-01-19,5
250,1428,Pay appear sometimes huge.,1987-07-28,-6
2691,3064,Single both movement along certain.,1955-12-21,-7
4328,2040,Meet herself oil job artist PM candidate.,1905-05-14,-6
3540,1671,Key billion section order future out professional.,1951-04-14,-8
675,3281,Music throughout large human.,1933-08-27,-9
4738,931,Firm door report nature amount.,1957-02-06,-5
2203,1293,Nature represent experience my hold laugh order.,1939-05-20,-5
1028,3860,Upon be especially court.,2006-03-26,-4
1171,1045,Available general control knowledge everybody.,2008-08-19,8
2705,2305,Food suggest success third capital.,1990-09-24,-6
414,2919,Tough mission water feeling eight degree street.,1961-07-31,-3
3410,1595,Floor allow enjoy lose certainly while.,1939-11-07,2
883,3711,Foot pull always enjoy arm.,1916-10-14,-8
3991,3185,They yard lot environmental.,1979-04-14,-4
3262,3775,Yourself exist well family piece.,1907-12-14,-9
1252,1955,Race over someone for type us action.,1980-01-06,-1
2115,2838,Either individual know question money rich.,2004-08-27,10
1070,860,Range last without.,1938-02-08,-5
833,3309,Seek alone laugh thought material.,1955-03-31,-3
2456,3759,Contain test but suggest doctor dinner serious.,1960-09-17,7
2232,2712,Machine go thought personal drop.,1975-03-21,9
2944,3439,Statement sister same individual yourself.,1922-10-01,-3
3931,3115,More even brother detail television Democrat.,1960-12-07,3
708,2045,Mention kind spring green Mr course size.,2007-03-10,3
779,2638,Sit accept risk everything already available market.,1919-03-12,4
243,3507,Trouble full through policy else.,1955-03-22,2
3701,2858,Arm right improve still benefit ask strong before.,1981-11-22,6
3836,1645,Much but discuss per skin study finally.,1925-11-10,-4
3900,2630,Family give number other near ahead prevent.,1938-06-30,5
1141,2942,Anything financial red left successful.,1927-06-23,-6
2553,3341,What program tax wait name trial kitchen.,1960-07-26,-3
1986,2785,Even trial color both.,1969-01-23,-4
4973,2648,Speech north boy land network media than do.,1957-02-12,5
2837,330,Man dream mind strategy base way.,1958-03-30,-1
112,1147,Among light artist physical threat board sport.,1914-03-09,5
3166,1629,Design eight ahead young as important.,1992-05-11,-3
3926,1024,Meet value market friend building player everything.,2003-09-30,-7
75,3040,Best table especially.,1974-10-06,10
441,877,Back simple recognize research.,1997-05-12,-10
1945,3046,Trip significant pick because.,1923-02-23,-1
1581,3953,Individual tend war war minute wall minute.,1985-01-29,-3
951,1482,Claim red boy space popular.,1939-09-24,4
479,2950,Ago tough into bring serious strategy manager.,1990-12-26,-6
1235,496,Hot feel significant wrong.,2017-08-12,-7
3013,2334,Class travel enough put once over way.,2018-04-22,2
3646,691,Place particularly allow moment contain result military seven.,1939-02-01,6
2202,3664,Big popular top support.,1972-02-07,-4
1755,3305,What green American individual mission instead.,1994-03-21,-6
3738,2294,Tonight wide much strong.,1970-01-09,7
2983,91,Full response say.,1905-08-13,3
3105,721,Ever decide on grow rule.,1943-02-12,2
3113,603,National or more theory.,1995-10-06,-1
4938,1063,Available box I finish car serve.,1992-02-19,1
1355,1048,Follow light top company stop.,1988-01-27,-8
1742,697,Surface street former drop rich not.,1973-02-09,-8
3303,1229,It rich itself friend might base.,1996-08-11,10
3333,2168,Pass political everyone prove.,1938-09-04,-7
326,408,Car development modern.,1921-07-30,1
4986,1190,School forget must whom stop.,2002-07-10,0
2807,944,Across oil finish.,1950-02-13,3
622,1230,Front real conference subject her bill.,1967-05-06,0
1803,3789,Still pretty attention six loss.,1909-08-25,2
4159,3316,Half red answer worker option.,2001-07-14,4
1678,2267,Forget look people decision.,1905-06-14,2
189,723,Article try we share.,1947-09-02,-1
2504,731,No bit quality.,1942-05-07,-1
2765,2931,Under article indicate will cup point wish all.,1955-01-30,0
1486,1606,Stand pull likely.,1937-02-15,-9
4711,2647,Occur during above with.,1925-10-16,8
2715,2853,Eight example receive station stand rich medical for.,1908-05-10,10
2737,265,Avoid budget particular.,1994-03-03,3
1395,1724,Support campaign situation could adult that must once.,1994-09-13,7
2580,2132,Wait either these world so process bad.,1908-05-21,-4
780,2850,Culture me dog kind lot.,1908-04-22,-8
965,484,Difficult especially job.,1958-07-30,-3
1556,1192,Enter war treatment red everybody political.,1915-02-18,8
3083,652,Last build spring rate.,1955-07-01,-4
2706,260,Total hard century probably manager wait hundred.,1950-12-23,10
4468,3083,Raise page maintain.,1962-04-07,-6
3166,3098,Structure name product treatment ago memory we price.,1984-05-03,4
4464,1592,Think cut market recognize training pretty.,1912-10-17,-8
545,1979,Instead inside think sell.,2016-03-28,3
3942,283,Voice boy this cut news weight explain it.,1991-08-01,-6
3673,989,Million however become art young there.,2002-03-27,-4
2252,1370,Institution lawyer seem through doctor water.,1914-01-17,-3
4317,1224,Us along common note water actually.,1969-01-01,-6
4018,1562,Single what seem member right.,1912-09-01,0
586,2473,Watch president lot.,2010-03-01,4
851,3604,South environmental turn same cut hit trial central.,1911-10-05,3
580,367,Professor tonight win and.,2019-05-21,-4
1458,2566,Participant age minute election.,2013-08-30,-1
14,3636,Nothing you performance product degree pressure.,1950-05-24,5
3993,1137,Argue program wife across risk bit.,2013-06-12,2
1583,3286,However cultural democratic street order next upon degree.,2002-10-08,1
706,2191,Determine ahead onto technology summer myself magazine.,1954-03-19,3
4796,454,Country question which player leader need.,2007-12-13,8
27,3356,Win anything community member food general.,1928-05-04,-10
4110,1311,Visit writer western black consider some.,1905-08-29,-5
1832,1915,Paper learn well learn material.,2015-08-22,3
1312,1440,Yourself book few.,1998-02-25,-1
3624,1667,Image almost practice water.,2002-11-02,5
4180,425,Likely on it fish though center race.,1974-04-30,4
2186,1155,Attorney skill trade behind occur whatever all deep.,1952-08-21,1
767,687,Commercial four investment he.,1964-12-22,-6
3834,3981,Down listen have.,1949-10-03,0
1749,2040,Cell address happen dark third.,1951-01-10,-9
1031,3296,Sort great order why computer.,2000-11-02,10
2696,1009,Out ready man by.,2012-03-17,-8
1254,582,Drive capital security want serve.,1924-02-24,2
2995,3302,Direction recent nation others your success skin conference.,1975-11-30,-4
1727,1872,Quickly wrong school teacher within where operation.,1914-04-29,-6
1538,2278,Mrs well owner image gun.,1990-04-17,-6
1606,3809,Behind detail military quickly trouble increase.,1910-03-01,-1
4732,1128,Discussion mission low happen down.,1956-01-11,-9
3689,837,Why tonight particularly give understand others rest.,1994-01-07,7
4845,822,Model interview take also.,1944-04-25,1
2007,3711,Authority trial partner social image pressure may.,2016-10-03,-4
769,2605,Party treat two town rule smile however.,1908-07-24,-3
2916,3793,Market site market leader.,1989-12-09,-8
1133,765,Attack throw interview example participant Mr professor.,1938-01-06,-1
4802,2144,Agree guess theory participant vote.,1936-08-22,0
4094,1313,Best young bad girl major.,1923-01-07,10
4896,1275,Since total determine animal phone music director.,1991-06-29,-10
3041,475,Economic catch quickly film.,1952-10-26,-7
1329,282,Fact senior fill red.,1961-04-28,1
3029,2995,Traditional time move month positive television theory hair.,1930-02-20,-3
3768,3552,Under discover bring event social.,1996-09-20,5
58,837,World assume born second best authority.,1926-01-26,-9
3701,307,Religious more available age easy might thank.,2013-07-13,9
1587,1904,Phone project fall move.,2020-02-18,-10
4461,2942,Music simply without movie here mouth.,2016-05-21,-9
4576,2596,Wide need beat force piece.,2017-10-04,-5
3372,1274,Garden new they edge power same.,1926-04-16,3
2832,92,Per address beat particularly build.,1969-10-25,-8
2506,3870,Seem man writer evening traditional main.,1917-05-19,-1
68,3513,Range spend money.,1912-09-04,10
4344,3128,Town television seek in computer stuff series top.,1952-09-30,-4
1764,1447,Carry these plan whom.,1944-09-04,4
2018,1589,Allow white court which born collection bank.,1915-06-15,5
1700,1940,Three season customer positive idea seek.,1993-01-06,-7
1410,2952,Claim off approach.,2010-10-18,2
3761,663,Minute tonight never capital paper director improve.,1977-12-24,2
2196,3294,Traditional create term.,1943-03-29,8
1058,3202,Decision middle meet season learn court.,1913-10-17,6
4012,2852,His country ball authority family.,1981-05-28,1
3055,3349,Which spring item.,1927-07-29,8
2614,2762,Night project result enough move sing head.,2009-05-31,-7
2868,2180,Strong role place kid.,1964-01-15,-5
4889,72,Able process national.,1932-07-05,-6
4587,3099,Sing think sit relate ground perform use camera.,1926-09-04,-6
1591,3697,Certain guy Mr clearly success fund tough tend.,2006-06-28,-6
4054,3214,Special chair discuss seem war activity budget.,1991-10-16,4
467,1578,Too memory start base.,1925-12-08,10
2342,1984,Director business theory your serious.,1940-04-30,1
3080,2882,Subject serve a there trip too.,1985-03-02,-7
4409,1532,Strong class price case.,1940-08-11,-8
2656,2589,View with response plan.,2013-08-17,-9
339,1556,Recently investment food win service.,2014-07-10,9
879,1426,Player home sea full.,1914-12-26,6
3230,1343,Yes around campaign sit recently.,1964-02-27,-7
4897,1682,History energy your.,1932-08-16,0
1808,1553,Present western ok nation.,1974-01-18,7
4026,820,Education bad environment material politics us enough.,1954-09-21,10
3793,3821,Security admit reveal white.,1991-08-26,-8
69,3910,Attack writer bill subject political land ask use.,1914-08-19,-9
1479,2081,Carry majority move myself.,1916-07-31,-4
3964,295,Real training against.,2006-09-05,6
2194,969,Continue able matter.,1912-12-26,3
3668,3044,Month pattern son body I.,2017-06-15,-9
3575,3241,My talk threat continue million draw his.,1949-12-19,9
1767,3360,Minute sign serious man same west toward.,2008-07-12,7
3551,1628,Already room lead single right respond everybody.,1963-12-25,-6
1849,1870,Alone sometimes yard however marriage national create.,1944-12-30,4
