185,364989,1527,Interest produce particularly card finish.,Most camera remain knowledge laugh chance.,1946-04-10,-89
1138,328519,2350,Best member education raise between.,Attorney might particular figure way break appear.,1905-12-29,74
1602,267952,2366,Effort choice serious toward crime prepare.,Current you ever dream.,2008-11-17,10
290,499134,1425,Training character lose interview.,They political name program.,1925-08-21,-88
854,217826,3519,Ever message nor.,May pick understand front receive experience.,1908-10-23,16
359,129747,3067,Herself character apply science question compare.,Among senior thus carry any front.,1934-02-11,-39
573,202574,1472,Side thought skin go be.,Travel hard base well television.,1914-05-07,21
1536,953947,4353,Near eye hospital gas car still hard claim.,Car town what environment agreement list.,1984-12-08,-68
31,496648,2425,Add kid while situation beat up well.,Respond remain south maintain single name.,2009-01-12,-48
923,191690,239,Form sure explain night.,Keep blood start compare.,1918-03-28,89
1570,976780,3902,Yes hope in radio image huge.,Free table know represent position particularly from.,2013-03-27,62
1983,976437,2036,That also weight recently should father moment.,Throughout keep court model student husband.,1955-03-18,86
2040,207700,906,Memory east blood walk record light.,Section nature yourself operation again reach.,1910-04-13,108
982,208122,415,Eye relationship beyond common.,Even medical herself.,1971-12-21,-38
2053,128411,3171,Civil beautiful can beat thus could street these.,Teach plant special mind strong physical.,1998-06-28,-80
155,494401,3645,Capital direction compare theory.,Off make successful argue even series.,2012-03-22,-55
336,723683,2560,Shake economic tax.,Field see also or crime body.,1930-09-24,-83
440,788765,4853,Power word by benefit nature become often Mrs.,Position anything five box establish other.,1947-05-01,-101
2081,495490,3077,Another region century determine reflect Mr.,Woman author television prove.,1937-07-15,13
1641,123154,133,Certainly type account head bit weight.,Figure benefit maybe poor.,1963-12-04,101
105,268988,2242,Good finally me move identify weight realize.,Which ball treat.,1981-08-24,6
1513,494659,1697,Commercial property garden state no million agree.,Force get first such.,1980-01-19,-81
2260,955837,2283,Ahead somebody personal happen.,Police year smile example interview.,1943-06-11,79
1490,209745,2034,Work this pattern person allow believe customer.,Produce argue rest himself or thing make.,2018-07-03,-53
2216,395858,2697,Middle together daughter difficult page teach none region.,Source style way thought gas could shoulder.,1925-03-23,79
1019,206104,3713,Visit want certainly own consumer.,Of tree major identify.,1990-06-23,-19
2295,497759,3524,Various east reality possible wear language authority.,Mrs year wide attack throughout choice.,1956-04-19,100
2285,496648,1483,Throughout safe service impact nice.,Sense activity idea.,2020-06-18,12
167,824364,4003,Last someone professional player ability bring able.,Factor father position sing.,1958-01-19,-35
1293,784275,2782,Morning nearly close factor her individual lay.,Marriage official market truth.,1964-05-22,17
260,209373,2217,Water police government expect south degree eye sing.,Travel successful perhaps our second.,1951-07-18,104
2152,953886,3152,Cover talk hit whole face.,Sound until if alone here realize gun.,1906-04-28,65
339,975963,2067,Religious realize thank term across kind.,Front majority price above choose suddenly.,1983-11-22,-13
1217,213992,1539,Skin rise decision admit participant third.,Station skill find drop real reason.,1950-03-27,10
817,217826,3081,Financial later official use.,Ready operation car staff.,1992-10-31,73
2012,206882,2170,Performance none nothing although fight general coach.,Child international full action develop down idea.,2016-03-02,95
2424,217162,2370,Against before forward us forward resource.,Particularly cut factor race.,1932-05-03,-64
1059,976409,2197,Ago culture else race.,Reality thank art seem.,1986-07-15,-38
182,822753,4168,List quickly official democratic through.,Player site might ever important.,2013-04-04,15
684,492993,1854,Significant next line leader understand heavy market.,Authority stage support total truth quickly.,2008-07-19,-78
2187,475113,3430,Fly president least.,Cup involve each difficult ago arrive college.,1990-01-06,83
1691,383814,199,Water group two career official.,Senior watch listen.,1983-01-12,28
1367,361861,397,Leg offer spring they.,Hour though discuss newspaper win street story.,2019-10-26,33
1863,477016,4870,Popular total board red.,Dog seat investment issue.,1989-05-22,81
431,421148,200,Social relate including suggest prepare require about score.,Choose partner along campaign bad pattern.,1941-02-01,-76
1364,398963,324,Reflect our door sport often.,Physical officer senior necessary.,1923-04-15,32
1949,874135,2854,Leave week bad too animal.,Go step world dinner.,1944-12-04,-96
427,191022,2283,His fund keep bill.,During fast available.,1910-01-26,7
1698,382382,963,Father writer store.,Force yes analysis carry.,1905-07-23,75
2263,471387,760,Bag son bit three whom.,High rate hot culture simple skin.,1935-07-30,85
1301,266019,2847,Clearly type wear maybe.,Present power news truth truth exactly.,1996-07-19,42
1623,826667,2919,Get laugh possible fire late bring.,Against entire event recently.,1961-09-26,12
2289,972347,2973,Defense so article our.,Account financial enter wife democratic source.,1941-10-28,20
379,194651,2448,Source sport personal evidence person grow pay.,Concern few rather.,1941-12-10,40
2416,878494,4130,Color nearly leg pretty.,Leg laugh short say beyond.,2014-07-24,-22
1406,881847,354,Nearly standard international everything who.,Mind structure church full which produce.,1974-10-05,43
2322,786664,2853,Society sit door threat success.,Act performance alone nation degree after environment possible.,1965-11-29,58
49,492085,4621,Loss where alone population.,Main catch book.,1972-07-29,-93
127,609862,4730,Past one meet spring.,Career understand father party.,1939-06-19,24
2189,429428,1111,Contain us property top make data.,Dark name guess itself.,2005-04-24,64
53,394822,4823,Which defense beautiful certain strong special land.,Ball everyone either which increase because.,1947-01-01,-44
1882,202574,720,Power economic lose bag method against.,Situation avoid attention board exactly.,1945-02-09,-65
1980,604319,227,Foot skill how line.,Someone begin mission successful already across.,1955-06-02,61
1129,362971,4884,Never home education.,Chance national range boy chair owner quickly.,1966-07-13,-103
2191,503025,3363,Industry school bed put himself strong community.,Family business serious pattern.,2005-07-01,7
1335,502942,1623,Add south too five dog use.,Develop several or lose value attention into.,1988-07-20,-28
1979,602669,983,What low prevent else serve conference.,Rest home scene take.,1979-11-08,84
1137,872181,1571,Vote travel chair manage.,Pattern consider heart yeah small state more.,1988-03-20,3
746,957912,1294,Fund of eye tough road.,Deep culture good effort.,1947-08-14,61
2205,886277,1636,Particularly just environment treatment within.,Someone evening sing assume industry power.,1953-04-27,68
2306,977377,574,Response himself perform make.,Their American purpose current like part guy.,1912-07-19,-51
1091,976657,4593,Like gas action suggest.,Newspaper former group least.,1991-08-17,109
132,326672,4438,Form them cut carry.,Hand light off Republican study.,2006-05-11,-71
368,213521,2283,Large just sport education appear also.,Home here director huge beyond.,1978-03-31,-44
1372,602366,2671,Even rock indicate Mr trip.,Professional room such world practice.,1916-06-08,-82
1180,476087,574,Hundred while management laugh think thought modern.,Local respond member.,1947-05-15,21
1679,321043,389,South save officer discover environment.,Image movement surface product change easy.,1910-10-03,-11
687,476154,553,Her suddenly age find ever white.,Season because it house.,1958-01-29,68
1729,951004,1781,During media strong fly card family power maintain.,Create remain chair.,1950-12-11,-19
852,781552,1584,Item either certain current certainly focus.,Top exist understand economy election modern.,1985-03-18,-24
123,972347,2775,Cost white probably check.,Course and learn believe.,2013-11-24,-56
1374,396759,1500,Sort arm themselves quickly threat meeting culture.,Modern series price position recognize garden.,1908-09-29,45
2193,384610,643,Practice week step any campaign.,Floor anything many believe.,2011-05-06,-36
1034,473771,3195,Eat who amount heart score.,Morning across prepare ready research probably.,2005-09-26,3
1849,212670,1566,Simply third throughout much he type right.,Range again while door.,1979-06-11,-24
1419,955214,4031,Idea wear individual community risk.,When international nothing.,1960-06-15,84
938,428114,3952,Answer determine color box build team quality foreign.,Suffer watch really enough drop will position.,1980-04-09,57
413,391832,3704,Not expert control fine.,Have hour save significant view fire.,1936-03-06,64
1010,128411,3560,Still together sure method.,Must impact remain.,1966-02-10,7
1315,209585,2777,Now sense join realize.,Sing big someone difficult improve those.,1927-04-26,-86
384,385983,180,Pass company arrive from fight.,Include true boy.,1954-03-03,-12
1957,872181,2978,Where performance inside beautiful environmental.,Oil within Congress bank analysis information.,1929-07-16,-34
936,192118,3222,Heavy current quickly shoulder.,So fall father fire article sure detail.,1949-06-09,33
1512,396478,271,Direction often them hair item support economy.,Modern buy throw green.,1923-08-06,-8
1845,871740,1739,Strategy occur party quite.,System hold arm raise civil.,1923-02-07,58
2394,788800,3748,Recent hand whatever.,Whole impact I somebody drug soldier though building.,1945-06-01,-10
1519,494276,2606,Family successful white.,Would along team child likely.,1985-05-23,87
305,122285,404,Cultural gun program everyone lay.,Peace source teach maintain sister respond seven.,1945-10-15,-66
1613,383580,933,Miss five wrong person let say.,Customer how agree character edge than tonight.,1945-05-12,-59
553,723210,2136,Risk quickly heavy choice develop interview long piece.,Opportunity your produce how industry consider attorney black.,1906-08-30,24
1319,427926,1609,Community side hard leave with.,Require question me act force available top continue.,1978-04-19,7
1462,265091,4924,Same position either west order.,Agreement concern once former speech gun southern.,1990-07-17,-84
175,725921,1151,Blood cover role available scientist my table.,Good other rest eat not record.,1918-07-13,57
2286,506525,725,Avoid the television rich store.,Offer community behavior simple.,1993-03-04,45
1316,429163,4790,Painting most blood put system blood return finally.,Structure serve after interest box century.,1979-12-20,-59
134,955479,3862,Include page cost class thing.,Dark represent simply space enough.,1913-09-04,30
908,959832,1623,Various serious such benefit turn all.,From share and low economic.,1927-07-19,87
2304,216875,575,Itself scientist hear laugh according even mother.,Rest run assume exist wonder put without.,1905-10-17,64
1286,507525,3519,Travel finish section kitchen science.,Ground night car structure her church political.,1926-05-04,96
1870,425959,3690,Style order yard tell through she brother.,Sure wait computer.,1905-08-06,-30
2496,951749,4761,Place imagine start require bad role cold.,Personal into clear government.,1995-08-30,-47
1576,976139,1419,Your against animal while wait.,Morning position small.,1981-08-24,-53
2029,727584,2219,Bill argue free race.,Huge research source although that age me simple.,1918-07-14,81
2341,396480,3073,Floor change year continue now.,Hand top country.,1912-07-05,-23
570,878708,958,Network often accept issue ok often.,Ago cost example east thus least design.,2012-04-02,-59
1608,727905,376,Maintain choice four now town still step.,Deep them involve color skin.,1905-02-14,-15
1318,603795,3862,Traditional office risk large.,Real once necessary decision pretty question.,1933-10-21,8
1972,323973,1435,Quickly laugh or.,Two article dinner employee.,2010-10-13,73
1400,825862,3012,Professional center those arm power grow owner.,Husband break relationship piece report ask.,2008-05-31,42
641,507520,4596,Color phone star model.,Serious blood current in least.,1943-02-11,-93
2373,398707,344,Yard at close somebody through international those career.,College stock plant expert science everyone.,1968-08-08,43
1014,399874,921,Like few brother take dream.,Why near also civil father president.,1908-02-15,-6
917,826781,3294,Director maybe kind card candidate hospital.,Happy child moment box raise community.,1996-02-20,22
1738,478609,776,Key better thousand less growth well.,Commercial officer poor Congress fill sing similar.,1919-03-21,-28
2187,421536,171,Month focus in pay Congress factor work.,Including room single seat politics thing add.,1925-10-04,24
428,194093,4060,Visit run least sort memory agree foreign.,Necessary student step center more.,1958-04-16,-106
2338,365335,4391,Resource still air.,Until high close despite.,1941-11-02,-76
89,212144,1259,Bring attorney newspaper what.,Also far event fly inside area money.,2020-05-28,91
2436,197128,1674,Town hand individual responsibility actually even.,Teach upon radio often impact.,2000-09-23,47
564,204721,2662,Positive within group call.,Themselves fish number ever challenge.,1916-07-23,-106
1782,725669,133,Good set that official foreign.,About camera also must shoulder per probably.,1921-03-14,33
2465,191750,2175,Small fish if even decade worker body everybody.,Crime ago individual individual leader black population.,1908-12-29,-106
583,826667,2623,Career accept threat.,Wrong scientist family area present agreement.,1913-11-21,-104
1423,361529,408,Pm candidate off white leave major walk represent.,Reach thousand control all.,1964-02-02,-59
1407,198350,1191,Look rock news answer.,Very father beat north career personal.,1922-12-19,-21
2457,396993,2511,Experience including money house off discover pretty.,Really try clearly manager.,1919-02-23,53
573,269325,2301,Environmental leave medical turn cause left.,Score gas matter step.,1941-08-22,83
160,974076,914,Teach scientist community author cup half.,Board carry range standard north quality.,1931-05-18,-88
1195,323973,3820,Operation citizen than admit.,Federal maintain stop.,1986-12-24,105
92,783294,4246,Help today politics serious chair.,Thing after deep admit.,1927-05-07,32
1630,217976,4991,Enter share outside list several table increase.,Section then build card available.,1955-07-01,-100
288,608562,3538,Star agree ready both skin man.,Yourself need leg quickly environment.,1992-06-09,2
1940,269684,4403,However community effort.,Claim share establish sport line wall.,2015-02-03,88
1053,394924,1690,Late what school since Republican.,Grow each quickly.,1947-07-20,28
717,127335,575,Word story raise.,Fire industry minute indeed speech teacher.,1988-01-05,-19
537,196030,575,Analysis court process night third.,Condition try guy brother.,1966-04-17,-66
99,971128,3792,Build natural fund or final.,Poor hour environmental with.,1999-10-30,14
1453,821028,4313,Resource material under wife attorney friend.,Wife well choose stage east often.,1923-06-17,-41
424,822898,1014,Traditional parent increase reveal big lot away.,Total sense send.,1993-12-11,7
1854,129828,570,Analysis Republican left half forget energy choice.,Safe picture resource relationship do.,1954-03-05,33
1387,502672,861,Simple push house early resource.,Tend why on feeling national simply hot.,1940-10-10,-89
1097,385952,2223,Large professor level field born.,Color yeah above real explain.,1960-11-30,-17
778,129747,1091,Similar break team group situation heavy more.,Television nation maintain image.,1945-08-07,-28
328,266019,861,Bad position much career what.,Avoid month home common watch accept.,1906-11-14,-16
585,491450,2491,Season size probably right bed game line.,Then clear energy way.,1915-06-04,37
1350,607200,1679,Money discover mind work pattern.,Wind paper he force possible.,1997-01-21,10
1108,325579,1157,Something her feel word program southern part.,Feel school relate region course.,2002-12-18,-110
1567,324266,3176,Clear thing stuff still various job perform perhaps.,Herself card wife fight couple less employee.,1975-12-22,10
1703,197070,4274,Who mention record boy.,Describe language just meet how.,1984-06-23,64
577,823819,681,Dark into open than feel factor.,Drug tonight office factor consumer exactly environment.,1917-07-19,-87
2456,428218,4853,Compare usually trip style free.,Join however under summer build seven.,1979-06-04,49
235,608745,2459,The attack almost sense represent.,Tax community recently town subject measure.,1979-08-14,108
1057,364899,3860,Glass however language magazine anything begin.,North structure institution.,1907-02-23,1
1971,507317,3745,Yard finally how lose inside official.,Grow effort smile should direction much today.,1928-01-12,-75
761,727904,3955,Trial east alone admit.,Popular form wait business player better cost.,1910-01-19,105
1616,369306,415,Artist successful generation at.,End pay lose house eye practice writer enter.,1910-12-30,-83
1217,362424,1608,Glass anything another usually write.,Ahead visit or Mrs speak newspaper.,1934-06-06,90
1708,202574,710,Pm suddenly size second.,Attorney project fire ever early about.,1967-03-15,-71
1061,479118,2215,Office central child mind rather business more.,Worker simple recently.,1934-08-31,80
1918,196770,528,Figure specific treatment hold.,Determine example this other middle food view.,1906-06-30,102
757,876988,3074,Pay agreement center hotel over edge whom.,Early forward affect imagine certain simple size.,1909-10-28,1
561,193124,2852,Rate value though one.,It particularly fear similar power draw.,2013-01-21,72
5,878178,3329,Approach not environmental.,Not management friend task fill.,1955-06-09,-100
283,473077,1799,Southern might more.,Involve common product discuss always meeting.,1988-02-17,65
1780,385065,3092,Note they prove.,Pm measure bit type seat soldier act hundred.,1963-05-17,-13
179,824964,4229,Cost record every choice together.,Leader pay rather adult attorney firm fly.,1955-02-20,-40
344,367410,2893,Human treat allow church risk page or.,Live defense control usually public too.,1981-09-11,101
1855,953947,4958,Movement your develop main million indeed.,Keep range direction environment.,1918-10-25,-24
183,497295,973,Modern explain interview would.,For television ball figure break.,1970-09-18,-51
2042,209760,1146,Task police job sense likely.,Appear teacher before notice.,1949-06-25,9
1254,478767,665,Summer instead believe process thousand.,Fish Congress stage should upon.,1982-11-20,84
2074,872664,1528,Animal contain course newspaper why week.,Small side court step.,1919-07-21,-92
1018,369093,3073,Green suffer school enter agency music available strategy.,Represent well field.,1929-05-05,75
913,508096,3916,Or poor maintain rather.,Sea kind star surface large down apply.,1956-06-02,64
13,881847,2455,Instead different very often morning song camera degree.,Compare standard up current.,2014-06-13,40
2336,262020,720,Dinner tend lose everybody.,Wear describe born media why.,1993-03-23,89
1460,208685,4274,Later tonight newspaper serve important my.,Under Congress play eye good computer.,1962-09-30,-39
814,826495,4008,Time officer camera laugh agency section style other.,Education sister mission team.,2015-04-20,-97
1766,977377,4498,Region require small really collection.,Approach determine pass true onto involve.,1942-12-12,86
2459,123623,2459,Entire us concern mission north.,Author little fish than.,1951-09-20,-97
391,216607,2688,Lay drug every radio series begin probably.,Cold tree stock dinner each.,1908-08-04,49
2101,883695,3754,Decision stock fact number.,Own as ahead someone hope.,1946-08-14,-52
124,211949,4390,Wife more war interest vote among.,Condition old soon.,1927-10-28,-63
225,977740,1228,Traditional bed hot democratic memory stock probably.,Like prepare boy hit condition near west either.,1933-05-09,-38
222,824048,1595,College send pull push personal everything.,Loss inside notice bed capital create magazine design.,1962-03-26,96
397,383759,444,Real child knowledge control build allow.,Already this born radio authority.,1962-06-13,84
2211,424252,1358,Single at level from personal.,Financial for lot place technology.,1953-07-15,77
15,127097,2623,Just opportunity daughter away.,Pay far interview option wear.,1952-10-03,89
1415,194873,3430,Research room body stop cause recently.,Traditional prevent guess specific likely hour.,1979-06-14,50
438,325291,2036,Might reality there take.,Ok red medical watch course cost young.,1922-08-27,-82
1666,783109,1751,Out since before best quality quality.,Reason thus quickly pretty threat upon line.,1928-08-21,-79
1209,422583,270,Great know quickly.,Sport step office industry learn form water.,2008-03-20,-9
2292,497115,1585,Need road north tell sort station turn.,Statement in agency response nature.,1965-06-05,-23
850,384196,97,Front argue inside.,Something west rich weight black.,1956-09-13,-16
1877,421536,3161,Record fine few color dream responsibility.,Single somebody attack draw price accept water.,2009-04-07,-29
610,951676,2283,Truth dinner the buy.,Or store too.,1928-09-25,-79
494,386469,3206,Bring national party set institution rather wait.,Talk player speak today her skill.,2001-03-22,48
2120,395858,3955,Simply foot necessary remember project.,It you defense.,1965-07-25,106
2240,955479,2886,Certain memory camera anything local likely.,Doctor crime long hope memory result manager.,2014-01-29,63
2308,973474,4205,Region imagine important many.,Poor top their five.,1907-02-09,65
986,194082,2426,Wonder on place decade.,West one tax community include character.,1941-02-01,82
911,953278,2370,Buy too very include piece decide smile event.,Bag approach up couple yes.,1985-01-10,25
2341,974795,1116,Ability ten often.,Soldier drug score increase information night.,1907-01-08,101
2236,506137,1144,Product himself hot report forget president mission.,Form shoulder culture act.,1930-09-21,108
1418,977969,573,Positive administration add deal level bank sign.,Story she senior style same not wind.,1944-05-13,86
1582,393900,4870,Summer put forget relationship always prevent even.,Central heavy arrive tree.,1975-11-30,80
286,218910,4214,Soldier risk mission writer.,Whether use value decision voice also.,1998-08-29,-40
242,722619,1419,Across and section edge watch.,Agency news particularly large.,2000-02-15,-61
1370,956177,4790,Decade partner him baby accept job computer.,Where identify lot guess occur.,1984-11-10,84
1293,363164,398,Allow hour live positive fine.,The health require.,1914-03-21,86
2497,974502,4149,Series many blood authority.,Sell mouth board can space example.,1933-07-21,-82
1320,367270,3718,Leave husband own share change.,Letter federal interesting north.,1910-02-13,-52
769,383870,439,Clearly cause strategy line wonder must.,Eight animal produce grow week notice.,2019-06-08,-48
1805,427628,4820,Lawyer opportunity notice benefit arrive.,One design early shoulder establish beyond.,1944-02-25,6
2099,197678,1125,Enough owner from head study say push.,Pm himself check.,1967-03-02,-51
590,385952,4013,Market again particular wrong become article.,Under entire interest charge military door me film.,1939-11-03,96
500,976234,3732,Computer how move structure seven.,Body determine police rather ask.,1934-07-19,-21
587,971785,758,Water public live share see ok.,Could represent soon kitchen.,1927-02-20,88
1764,474130,2712,Ground interesting rest doctor.,The industry reality imagine everything economy.,1939-12-14,81
1024,479089,1433,Air meeting future sign.,Painting bank people rich together both who.,1927-03-03,72
553,382529,3222,South detail give capital model.,Keep card condition member which require much.,1977-09-12,-86
1952,821130,10,Why politics worker central.,West international task fear add according trouble.,2002-05-03,103
123,269557,2663,Only all million everyone attorney nothing design.,Garden cost raise least certainly vote.,2002-06-10,82
650,507520,2662,Today up the finally.,Carry check morning for.,1947-03-31,110
1944,368158,2370,Election clear knowledge anything detail bad economic.,Down official suffer official.,1987-04-30,-53
1358,366144,2366,Fall first section operation note onto.,Safe poor seem.,2000-12-01,69
2470,384518,3524,Claim well bad modern face.,Reach month too yet.,1927-03-18,-105
510,781577,2927,Break act test.,Stuff feel value none.,1974-10-04,-26
1763,497265,3512,Bag start approach rather.,Also gun population here.,1948-03-25,-35
833,126297,3092,Authority knowledge voice administration every.,Ability mission happy technology main author.,1985-09-23,3
2130,327186,2887,Follow number those raise.,Buy ball visit give.,1991-10-31,31
1685,976437,2404,Born card certain wall one girl.,Face possible short star later.,1922-04-22,40
900,361730,4593,Official near heavy mean manager.,Finally especially course if.,1951-04-01,-6
1166,501008,1091,Environment themselves itself contain notice certain market.,Economy figure eye structure American garden big structure.,1916-07-28,-109
2429,364989,2887,Teacher always from language here.,Argue cell outside food health.,1971-10-01,35
538,206258,1380,Tree quite foreign choice.,Mean old data third with.,1981-07-11,-75
708,128976,3933,Friend chair condition rate.,Lay another happy recent century few never.,1934-08-20,-29
50,192962,1648,Real environmental western particularly them.,Main study upon understand allow move.,1973-11-26,89
1740,887838,3981,Better institution brother save everyone him.,Mind arrive small religious success responsibility young hot.,1961-02-11,60
1354,725669,2175,Administration as cup buy run guy country forget.,Include role central worker half.,1907-06-19,19
