673,881024,4375,Itself policy arm high.,There culture price suggest everyone.,1907-05-25,-85
2355,727272,3399,Act choice phone subject activity because factor.,Win newspaper task sure possible pretty so why.,1923-06-30,38
1050,128942,2459,Food culture develop wonder under newspaper black life.,Commercial president wonder minute.,2009-06-23,-75
1300,385065,3442,Catch blue deal sign gas.,Size phone main he office.,1915-01-19,57
1609,218333,4706,Former chair decade new determine scientist sign perhaps.,Identify opportunity treatment itself direction.,1998-07-23,20
1839,974861,4205,Hotel by analysis country whatever.,Fire continue any adult small.,2015-10-28,51
2370,193607,720,Offer science sense either.,Response recent stop information.,1938-12-01,59
1374,424644,226,Score travel never civil.,Usually game challenge tend campaign direction since moment.,2006-02-04,3
209,878178,1159,Song style tax speak learn many.,Occur foot save some.,1945-11-10,-21
499,396480,4160,Director economic price consumer single no.,North official professional government remember part marriage.,1927-12-11,108
1166,878178,3635,To development political power response main make.,One hope order serve.,1965-05-13,48
2396,194873,4968,Card police minute try long.,Even against themselves know.,1962-11-30,-9
269,393755,128,As drive boy tree they election.,Building wait would cause level garden off.,1913-01-14,-34
1884,874566,1308,Large they interesting.,National it tax suggest dark reason condition again.,1964-05-23,-101
2078,216406,1848,History pick space by move field.,Happen young yard run stand seek.,1977-02-04,-108
2043,384518,2639,Impact across sense modern.,Between threat show next ability glass.,1932-12-29,33
85,362791,3588,Protect hundred raise knowledge edge.,Model road cover bag understand guess job probably.,1908-07-11,4
2200,784265,4996,Player scientist board story just popular only.,Report yet contain your.,1939-08-25,34
824,218556,595,Medical or may record natural.,Reality perform eat finally.,1938-08-22,-36
1711,721431,2757,Short particularly executive side notice her.,Forget home skill establish or.,1958-08-25,-49
1166,956676,1793,Society themselves because trial.,Take report style it similar there.,1981-10-31,-62
629,216875,2847,Case better exactly federal quite beat hair huge.,Attention enjoy beat condition treatment out back.,1932-05-01,64
1890,193786,2722,Nation truth rather its sister stand fund.,Open foreign crime technology.,1992-08-04,-48
383,425654,3609,How federal control factor poor commercial story.,Mean chair where standard.,2005-04-04,91
1497,474535,773,Necessary two blood west.,Heavy issue church believe when girl speak.,1990-03-27,-4
250,365220,2142,Guess south fund reveal at sure provide.,Wear central from would.,1987-08-13,-50
447,208655,2205,Finish candidate main.,Full return receive.,1962-08-01,30
1215,827103,4924,Time air ball up test rather.,One which little spend.,1940-07-04,34
1455,202209,3949,Generation physical again system second card.,Including assume reason young.,1942-05-06,33
326,208908,4823,Result general machine woman.,Culture company cost answer smile.,1994-03-04,-100
2045,603552,1515,Foreign yourself yourself physical tough well.,Poor strategy work.,1962-08-13,1
2368,269684,762,Wrong after job main.,Here car like majority.,1984-07-28,104
2383,261960,844,More soldier condition.,Agree tax since again perhaps.,1996-04-13,93
388,495315,2298,Second voice energy people.,Network no music without believe.,1928-05-31,41
2405,201608,10,Prepare case success condition lead.,Month both kitchen tell any happy world.,1924-01-03,-47
15,474083,2515,Him lead whether huge.,Perhaps tree everyone mother need upon Republican.,1962-06-23,102
1551,972485,3095,True medical size fear whose worker someone.,Even tough fight begin future.,1943-12-14,47
1143,396900,2619,Find red member for.,Especially effect head fact would open.,1998-09-04,88
2020,392056,4438,Likely though late bag person morning heavy.,Number sense church generation.,2014-10-28,39
160,201342,3038,Amount day level style effort enough.,Sure agree fear notice stand up.,1984-08-27,-79
1602,213808,1799,Subject same finally feel military.,Picture responsibility way simply lose.,1979-04-14,0
353,971128,2668,Human serious physical product.,Safe weight age the base make know.,1980-08-30,-9
1377,213992,4216,Phone mind step even.,Outside family reality body magazine product opportunity.,2016-12-28,-60
1850,726352,3713,These fund building bill event human new door.,Bill well day.,1976-01-30,-57
45,322941,1935,Cell success help success their great.,In number whole pressure effect character.,1913-01-15,-54
715,494029,3921,Anyone choose worry.,Offer foot decade.,1972-07-16,-54
2461,727584,4249,No decide report else summer special.,Buy sometimes himself would material receive may.,1954-10-14,50
749,215785,103,Expert pay team out among.,Group coach name if.,1999-01-06,-56
2261,889416,1902,Notice myself statement government within chance.,Interesting fear leader modern.,1929-10-22,-103
316,505603,3018,Most full huge up.,Visit drop wife candidate budget.,2014-12-03,94
1793,953323,3933,Would state cut forward.,Animal stand walk likely develop top whose them.,2010-02-06,-22
2091,725049,822,Always doctor option son will.,Far find season community.,1960-07-25,-31
560,328519,2170,Wonder effect physical body get attack energy.,Song wrong morning since.,2005-06-11,98
1545,785721,1353,Picture project range expert turn analysis.,Push also understand result official sign.,1942-08-23,-79
2090,823932,1805,Professor who response like spring represent wait.,Exactly up help community possible season.,1912-06-14,64
591,428150,1430,Fire left over Mrs still soldier effect thought.,Thing building daughter fine.,2007-04-11,97
1444,971785,1342,Six dark dinner fire.,Real likely life lay.,1940-04-28,109
1543,126660,3092,Thing fast voice either news.,Cost season marriage sell size.,1975-03-26,79
1190,426026,4116,Least grow probably painting play modern market.,Group once all sister commercial chair baby.,1985-02-17,50
2276,975963,1854,Believe member evening treat east.,Tonight character dinner not seem young.,1997-06-29,-33
1035,394822,1306,Shoulder life build peace second spring soon.,Defense break include job require up head.,1983-04-01,61
1569,202489,3809,Director smile future director somebody after really.,Year consumer later along development do.,1915-12-09,-9
2307,608934,4166,Same door minute into.,Ask move once tree his improve a power.,1963-03-11,-19
1612,196030,2473,Office month tend PM human newspaper heavy.,Set professor himself sort old.,1964-04-10,3
677,212782,562,Notice lay lose capital.,Current particularly marriage wonder throughout as.,1923-07-27,-89
290,609498,4883,Southern talk sure politics hour take person single.,Apply situation glass commercial company respond.,1938-04-21,62
1484,727272,1867,Give quickly board significant goal difference.,Task table learn sign.,1923-09-29,32
1712,729742,935,Too which age picture strategy relationship evidence.,Professional house probably most.,1984-06-14,38
901,208655,3720,Between treatment charge data several.,Expect two past over responsibility.,2015-05-07,73
1488,787713,4991,Cost loss development full drug drop.,Scientist attention then line despite benefit.,1919-12-03,-77
1174,504605,3363,Democrat nation natural operation after.,Response name hotel particular.,1908-11-05,61
2010,365220,3389,Traditional wind again send institution.,Blue seat understand individual security wind.,1978-06-07,-41
1807,882969,2764,Choice force they east.,Likely night affect event poor.,1925-08-07,-34
1109,369491,3391,Detail message own office everybody.,Their free whole all nation wish federal.,2013-07-25,14
378,973648,4252,Condition Democrat give seven usually eight collection house.,Notice case rule across fire Mrs figure.,1934-10-10,59
1094,368158,4940,Opportunity per improve shoulder subject military politics.,Property because operation realize.,1932-01-29,70
2112,475182,4070,Civil book option occur consider owner as.,Face hope certainly indicate.,1913-05-01,49
1074,606965,1512,Ahead from simple evening bit also.,Help lose stage help reach say wish Republican.,2019-11-22,87
1286,215215,2712,Nearly stop impact member interest business.,Able gas remain ground stock yard it.,1954-10-10,-37
257,784158,3544,Church today citizen dog just something.,Either capital despite meeting although though.,1977-06-04,-67
432,883609,2053,Face think information onto manager article.,Draw near color physical newspaper.,1935-04-13,104
1086,194128,3877,Radio thank measure hit program cup.,Save majority one east law.,2017-02-12,-76
2155,608785,3316,Ground what vote probably alone state.,Nearly history clearly left year.,1963-12-15,-106
820,956905,4340,Social understand hear security yard future.,Admit middle media door focus place myself last.,2016-05-16,19
1672,389525,4284,Charge between when film.,Ahead difficult study happy garden break training.,1976-05-01,95
826,789244,1805,Mouth stock phone very something.,Evidence eat budget begin career rather society.,1931-10-15,98
2459,394387,3180,Accept line attention star two another never.,Reduce on forward box seven dream memory.,1923-11-10,91
2325,724213,570,Read might begin American development.,Dark national save.,1914-02-06,-45
808,384490,694,Its believe address couple ready.,Card save fact light million sing.,1955-01-24,61
2262,498334,3053,Above often fine structure head drive.,Bit store peace field challenge.,1932-06-04,33
472,426026,2283,Hear chair executive particular program phone kitchen.,Hair writer help they.,1918-04-16,40
852,957912,4745,This understand month cup.,Level family himself coach.,1981-04-23,99
1923,502390,3206,Claim figure read.,Large decade food physical all poor floor instead.,1909-09-15,-76
1451,366895,1472,Author accept certainly environment three rate business.,Turn man discuss everybody agency.,1910-02-10,-26
362,212462,4744,Little pick establish there crime.,Teacher but and hospital director doctor.,1975-12-18,-1
1400,209745,1907,Old piece a over certainly amount bed.,Finally charge property very.,1983-11-04,88
814,329834,3163,Side control popular music.,Development somebody owner nature would movie end sort.,1973-01-28,-43
2392,872539,2620,Start million feel economic.,Writer sit Mrs.,2007-12-20,51
191,194873,4284,Performance house miss money.,Debate feeling bed network.,1976-05-01,99
2134,889420,2461,Many compare seem little reach table.,Improve around rate.,1951-12-24,-102
74,729885,888,Government surface brother concern about especially development.,Few soldier will family discover.,1976-06-09,-80
2330,366197,679,Stage number during give old.,Necessary road area political lose they adult.,1959-07-10,15
2068,494324,3404,Without us no.,Cover change admit central.,1912-01-03,20
361,495561,107,Event happy morning hot put.,Per suddenly read manager other foot imagine.,1986-09-17,-106
2236,387467,3623,Even plant world face usually subject six.,Maintain political common.,1931-01-23,97
258,974795,681,Play Mrs join stuff could.,List ago continue site force.,1936-01-07,46
465,424293,3776,Clear dog piece sister huge race.,Risk cup fish concern.,1992-11-26,37
124,726706,3527,Candidate nation what world other.,Next sense former on or situation.,1925-09-07,-10
573,973375,2402,Human through unit ok.,Ready act two front body here here audience.,2009-06-03,57
2121,887978,1191,Use know forward pattern discover lot wind.,Go car interest edge.,1966-12-05,36
969,269347,3329,Few mean series cup why.,Manage sense place because.,1943-10-11,-33
1399,784943,3867,Toward still involve consumer product reflect.,Nation research professor site standard.,1976-01-20,-30
2324,216607,2639,Most approach discover ok glass a hair.,With song company change tend common street.,1942-11-22,5
489,327226,4166,According involve skin key more.,Air too especially.,2015-03-18,-33
810,508422,4744,Fill improve blue alone wrong action senior sea.,Strong human central them hair.,1983-06-11,95
1376,972138,3599,Song thank meet church away professor.,Than development magazine design low.,1987-10-21,106
2175,821029,1571,Art matter administration senior each question wear.,Five open fast should add guess.,1969-10-12,-104
327,497295,73,Put itself suddenly very often project police fish.,Security analysis pay individual.,2018-08-15,31
1145,475044,287,Picture carry skin prevent decade hotel long perform.,Must risk relate provide owner.,1999-12-23,6
2089,883609,1259,Growth give affect where.,End lay their knowledge glass teacher.,1925-03-26,-15
2235,192299,1190,Goal item kid rule.,Offer laugh crime side some back.,1935-12-14,65
122,729068,4229,Oil final concern build newspaper culture.,Just decide camera yeah fire well eight.,1995-12-13,26
623,956036,1805,Me should student course.,Choose where interview generation law scene country.,2000-05-18,-105
2042,957211,941,Phone best movie expect.,No explain movie join.,1970-12-05,-2
415,602287,4278,Offer continue bit apply guess especially.,Million police author marriage agency home end.,1944-11-14,-54
242,361529,4424,Pick center wife top southern.,Whole leader century reduce.,1944-03-01,30
99,502541,401,Individual Mr have here.,Medical management campaign pressure scientist stay attention decide.,1952-01-21,-56
1788,397299,1778,Party significant room somebody policy machine.,Thank ever serious way take good employee.,1909-04-10,92
2066,729929,4924,Book support guy short.,Car well more indicate much.,1988-05-24,22
1418,876988,1255,Door future number benefit notice air traditional.,Part international ball network heavy.,1927-06-17,-103
2296,977850,1833,Perform our recently term appear.,Place nice by.,2012-06-27,-107
1665,977776,3682,Certainly education voice.,Clear change black him drug mission consider form.,1982-08-15,64
1836,478767,1721,Series then night however majority instead.,Interest than away wind nor professional capital why.,1943-08-25,-6
532,875861,2350,Everybody right mission debate head into.,List need agent imagine page million century.,1932-04-13,-68
1896,199808,2092,Common then herself mission probably we.,Paper method chance billion so support.,1930-12-18,55
2120,269347,572,Shake commercial dog career can.,Figure indeed remember idea participant.,1962-09-26,9
1477,786586,754,Indicate beautiful military vote remember choose heart just.,Everyone air test certain.,1939-10-29,105
406,725478,730,Want item nation movie bad without once.,Both response cut fight father really production.,1934-05-15,-56
690,784943,1380,College edge figure close.,Him enter attack instead.,1927-11-06,25
450,727584,2852,Prevent mind particularly.,Instead bad total easy herself organization attention.,1936-12-06,-62
1539,955303,2958,Health quality future.,Employee no blue use read.,1936-04-28,-24
1580,473527,1674,Candidate reality level long relationship up.,Decision heavy base stage.,1907-01-26,91
1050,822031,817,Capital something interesting number if.,Wrong resource security interest.,1986-12-13,65
2399,208685,1793,Determine participant hard carry part.,How people she power.,1924-09-26,-62
1465,393900,2697,Owner push inside rise environmental hotel.,Point third especially.,1947-06-22,-2
2379,198106,1221,Join cut determine rather early something.,Natural visit yet two pull to fire.,2005-08-16,84
24,876224,4131,Year laugh practice everything your.,Employee arm call doctor southern control scene chance.,1918-11-20,25
892,978002,4424,Bank minute dog party film add.,Many various heavy then role find only.,1947-03-02,-32
1243,474083,1781,Tv check beyond anything.,Apply brother cause meet.,1928-02-19,78
333,124174,3157,They sort north there develop significant want.,Man big ok line to in stop.,1919-03-29,-53
1050,424293,3404,Last court suddenly group.,Music claim consider other.,1977-03-25,-63
2370,427641,4406,Environment anything question artist heavy.,Tonight book short.,1942-08-17,-76
1223,789146,561,Recognize fish health fish language.,Effect condition black.,1955-10-22,19
606,326415,1159,Good deal difference should black suddenly.,Plant Congress statement tend.,1914-11-25,37
1974,495561,4647,Cause watch easy.,Follow also century son ready yourself what.,2002-07-31,-104
720,785721,4760,Tend option than.,Out certainly along up avoid may blue wear.,1908-04-12,-75
2343,956458,3463,Adult help author toward.,My cultural claim heart amount with every effort.,1932-12-19,71
1263,422522,2379,Pressure drug mean war respond yeah.,How stuff season deep anything.,1986-07-29,-53
1302,883506,3261,By these teacher save realize check base.,These policy leg out foreign never between.,1953-05-14,38
1795,366144,2662,Reach often reality the represent police spring.,Card gun of course operation represent tree.,1991-02-13,-100
1725,957929,2441,Popular if main pattern.,Court save watch gun point.,2006-03-14,-39
1486,217275,3766,Understand blood nice service among teach development.,Detail us yet us create.,1904-09-25,-108
900,217976,4398,Guy grow race.,Continue rich allow trial.,1910-01-01,-53
2405,977670,227,Remember ten heart number subject huge.,Free stage low lay necessary report.,2002-02-12,-6
962,824364,340,Night during these property phone in.,Include sell sister high leg.,1936-07-16,-71
859,823819,3348,Set table bit seem care.,Section data among year.,1922-11-12,97
448,976466,1166,Throughout operation range church.,Education police step relate yard.,1931-10-27,-88
2343,972485,1752,Some very team letter political.,Kitchen everyone treat every myself.,1919-06-15,33
1247,873776,2560,Miss or social race from practice few.,Knowledge maybe attorney ever even indeed.,1925-09-16,65
2196,493443,1758,Everybody media moment shoulder assume.,Everybody leader account visit art which.,1966-12-14,85
476,363766,3720,College gun event chair perform throw.,Price feeling direction physical animal knowledge.,1976-10-30,-108
2105,788765,1751,Large phone bank sound bring student.,Site establish charge even fine.,1987-11-03,46
1455,261960,252,Line interview lay.,Increase hand citizen add concern standard.,2000-02-16,7
1552,324486,3305,Three cold reflect firm better class.,Service parent important.,2005-08-08,96
464,728995,3243,North middle several pay.,Officer identify age dream really away thousand street.,1946-07-11,7
1892,601343,570,On later house direction.,Here every ball value.,1946-09-16,25
1409,218153,3595,Public water investment something field cell.,Do instead gas reason event.,1983-10-26,80
259,202595,662,Sure drug close attention avoid.,Look your capital book exactly.,1932-01-20,-107
1008,728995,2515,Market chance material walk like top space.,Surface coach believe.,2005-06-01,-10
2361,396381,2366,Cover bar rate good during draw great.,That risk nice doctor season everyone.,1937-12-26,-7
1353,324486,1284,Consumer not debate century president.,Reach tax instead establish wall oil five.,2006-01-18,15
1692,324469,720,Task avoid use amount together well.,Cover food economy offer.,1977-12-25,-2
1432,427706,4160,Carry institution bit there could prepare adult.,Watch statement feel.,1951-05-16,-71
1464,218718,758,Consumer today reduce particularly season.,Laugh nice trial oil country.,1982-11-27,31
2367,721064,861,Film available necessary seek.,Send decision pick.,1950-10-11,91
1219,959675,3095,Ever single power.,Thank eight want stuff performance begin effect.,1982-03-26,58
335,477131,1489,Fly population give same or number study whether.,Support perhaps director.,1922-04-14,-90
985,399798,2210,Place drive employee.,Them paper base.,1927-07-12,78
1002,392790,4626,Treatment husband seem condition short sit.,Able today record decade require.,1945-04-10,10
1845,423042,4313,Present force speak behavior use.,Prevent middle color agency.,1971-08-07,-37
1605,269325,2915,Help economy sing answer.,Answer year nature conference past.,1964-07-01,59
724,384941,3348,While number thousand western.,Environment boy spring yourself build pay.,1989-04-29,1
2492,212855,2129,Food part structure according would hotel.,Arrive finish behavior.,2013-11-07,11
219,205646,3791,Age bed media catch capital size necessary.,Letter fire life long affect live.,1905-10-07,45
725,889280,2784,Expert decision arrive pressure class Mrs.,Instead car occur though.,1986-10-24,-69
2422,326095,567,Ground property notice forward wide perform success.,Our campaign fund both right add carry clear.,1907-07-12,-92
582,202463,1697,Design find law end herself half.,Suffer him goal.,2017-12-28,-2
1802,505494,1873,Away they activity inside heart again.,Wind lawyer ball suggest.,1970-12-04,75
580,202463,2481,Over answer because spend security maintain.,Television likely by.,1949-08-15,-65
496,326451,3682,Establish reduce eye board.,Peace article building shoulder doctor different.,1908-11-18,-45
1183,394059,1695,Find box brother door history attention trial.,Traditional you case eye.,1905-11-08,15
355,213521,4281,Society bring subject nature father.,Reduce land house today.,1919-12-15,-92
99,213808,2443,Right air local newspaper.,Tree determine data admit prepare rather pressure bit.,1917-12-04,9
1231,266019,4389,Live science hit at.,It many meet network once.,1991-07-11,88
251,729885,4948,Should fast keep develop.,Mrs fish style create suggest four think name.,1963-07-21,-97
1306,364989,2448,Stand common concern north just southern.,Form pull now man nice religious.,1978-10-04,38
659,788800,2219,Center economic popular company still stock.,Recognize often already main senior.,1912-05-23,54
824,217076,1609,If religious present.,About very reason lay.,1979-04-21,86
2149,479078,1368,Federal know there serious marriage again choice.,Right policy probably reduce.,1907-08-14,97
1141,879190,643,Project or scientist play.,Worry save American finally action them let.,1987-05-20,-108
1219,973648,3560,Apply future state provide design million decide.,Sea floor for eye.,1921-08-25,-48
46,784742,2448,Subject option detail.,Arrive day ok book marriage hard.,1954-10-17,43
299,607533,1739,Worker raise method card senior spring suggest key.,Be after his some general play seem.,1983-05-10,0
1292,727272,737,Student condition always understand off.,Mr accept prevent pay protect lead.,1950-11-25,-21
72,499134,262,Weight paper mind them see indicate.,Skill six culture different policy history health.,2003-05-01,98
2298,492993,2631,Forward energy some relate.,Cell remain resource act professional range also.,1981-10-22,62
2221,205646,4969,Second piece head site part.,House foreign morning significant nature.,1945-11-08,42
1783,268783,226,Glass require give leader look that traditional.,Evidence town choice five stop assume.,1974-05-20,22
1759,609913,4958,Billion tax chair today design hundred.,Successful three personal poor book ever traditional.,2005-09-08,-73
374,976657,2209,Daughter rise worry.,Movement bag truth enjoy.,1982-08-25,25
153,824701,1376,Set minute focus forward.,Hair campaign try.,2014-08-15,49
538,974795,4694,Create middle forget back carry organization then.,Sound worker safe agreement.,1957-02-09,-78
1019,505879,4249,Return certain level return.,Word consider blue response receive always person.,1974-08-13,28
1383,726247,2195,Sing federal film exactly bed understand.,Just measure fall no property seem.,1945-02-02,-83
1068,218718,575,Sort establish personal arrive most.,Describe head sense account blue movement.,1960-12-06,88
1415,872539,572,Whose whole age goal.,Century speech peace worry you whom.,1988-09-01,-16
2079,128976,948,Particular call democratic across weight.,Possible week history suggest them quickly conference might.,2016-07-04,38
1894,123425,2654,Six side writer true.,Painting society pick music.,1988-03-17,12
1299,727090,1398,Television husband long.,More organization wonder impact control.,1926-03-17,20
1204,723078,760,Toward home personal buy including.,Other think measure animal face three hard.,2004-06-24,107
1456,428280,1566,Any time change environment.,Week history commercial despite approach require live.,1906-12-02,51
2288,215785,1106,Standard summer growth road appear city.,Condition yourself little describe fear company stock.,1904-11-26,87
1008,953720,2261,Protect interview industry generation.,Miss road bag year worry skin lose.,1990-07-26,44
2441,887978,175,Size budget defense.,At forget consumer.,1934-09-13,21
1139,784943,1489,Ground team cell teacher as happen population.,Traditional ready entire reality.,1992-12-14,-75
2040,366474,4264,Manager ground fact different word attack.,Look case whom respond toward because Democrat.,1997-05-19,78
1400,726068,79,Walk just whatever.,Protect ever kid real occur total.,1914-06-07,49
553,213545,398,Put spring service cover but economy effort.,Use cause expert through.,1981-08-27,-45
1666,974861,3867,Serve cell development guy class recent.,Learn machine arrive.,1930-10-25,-9
2122,268968,2210,Rule expect fill not hard heavy.,Probably take feeling up bank.,2011-11-15,-17
2287,473050,697,Technology social community popular.,Area ask throughout after most it this current.,1951-07-21,106
716,123425,4548,High own present buy coach whose.,Yourself American memory tend those hot thank note.,1944-07-29,68
1562,397302,2105,Compare billion run small.,Program game late gun.,1950-12-23,96
2010,363164,553,Issue reduce word military its picture commercial.,Son while music third right they.,1949-03-12,-13
1252,385065,3786,Matter bag sister degree up able very.,Ago series politics particularly still class.,1918-02-11,-23
1181,785919,806,Nature authority together.,Community staff hope state.,1981-03-19,-89
836,888720,4932,Night phone term year.,Performance third close.,1934-08-18,12
751,205646,720,Money alone describe time will alone can.,Author program although unit.,1993-06-26,-26
495,204721,4214,Ten want cup institution these.,Watch week political theory.,2014-02-18,12
984,783596,1342,Lawyer no choice then worker total.,Face bag throw move.,1908-01-24,47
2044,784742,3404,East end wife seem.,Help including serve owner.,1976-04-22,16
755,362971,4249,Pretty read administration fill.,Into share term produce treatment them realize.,2000-12-13,-45
