1865,726352,4095,Group know role majority yeah consider trouble.,Believe fight father activity time sister onto letter.,1998-11-22,99
1337,384490,4148,Avoid maintain throughout minute.,Drug physical amount Congress follow.,1928-05-25,6
1978,824728,2408,Finally city tell traditional.,Choice with force ability list.,2009-11-06,27
1457,218153,2408,Again within road look.,Address rich customer expect art protect miss continue.,2009-07-06,-78
2279,497115,3812,Information forget sure voice left contain drop.,Coach community discover nature card.,1941-11-11,10
545,369544,3082,Have bill authority wait population simple.,Street loss today security partner argue cost figure.,1945-11-25,99
2127,393900,3983,Soon trade follow all mouth.,Without bad guy finish view.,1962-01-31,4
1783,879101,3955,News chair dog expect forward especially box.,Young interesting quite score best plan office.,1978-12-06,-67
1394,202489,3744,Minute side them.,He information learn social area matter.,1933-01-10,-103
587,422522,71,As research kid.,Picture will over pull letter exactly appear four.,1960-04-23,49
2141,399874,3960,After prove perform use western season.,Business manager me rich.,1989-03-25,51
2266,884764,4278,Yeah much time kid space.,Lay chair boy each during goal.,1971-01-15,-55
930,507520,1595,Expert every couple yes something tough first.,Stock he just inside throughout end produce.,2000-12-05,-19
2109,976437,4221,Town best especially father which check.,Daughter threat reduce friend.,1934-03-01,-109
634,199808,3162,Chance strategy partner interesting.,We until listen rather.,2020-03-30,-17
2441,211812,4951,Mrs pull ball military hit successful hold sort.,Dream how discussion expert.,1970-12-17,-63
2363,786282,1809,Far indeed low law.,Drive area return specific look support.,2010-01-01,6
2069,269113,3740,Seek cost sea.,My would sell onto.,1977-03-19,16
959,726352,4082,Fish peace better in.,Bar so result occur article issue development.,1984-06-30,-33
571,211812,1148,Audience partner like.,Travel arrive truth fear small tell.,1927-11-19,76
2464,191690,1079,You perhaps event give simple.,Book matter check five.,1992-03-25,30
2165,472217,4166,Member perform people open others least world.,Century use financial other fall degree.,1922-03-19,-63
157,327652,3947,Hand discuss economy each friend the.,Themselves measure significant story make call about.,1919-04-18,-31
213,828315,1527,Black hotel interesting him wall.,Situation across leg teacher then.,1960-03-02,41
647,722803,2594,Culture force use seem west.,Ago check cell increase every.,2005-01-08,10
950,972109,3521,Fire better within table computer.,Important film rich land.,1969-03-29,-103
680,889416,1539,Same where analysis Mr.,Store own state friend brother.,1995-10-16,-28
736,423030,4650,Step staff condition sell thousand.,Source difference clearly anything hope tonight benefit each.,1943-02-20,69
1369,478594,1115,Time book result risk.,Into similar create compare.,1975-04-28,-7
1931,202764,3020,Everyone true so nice decide box.,Order suddenly region analysis.,1977-01-25,101
2000,426856,3119,Check camera indeed practice protect.,Do reduce or represent media.,2017-08-05,43
2188,268921,888,Leg notice nearly.,Memory all different voice north thing shake.,1948-07-17,-76
2344,781580,4100,Spring discussion early inside force.,Worker decision religious field major consumer.,2016-12-25,64
1563,887294,2447,Practice center when hand president investment add role.,Truth hit care recent evidence series gun.,1997-04-27,-53
1912,211499,4852,Question order indeed consumer.,Early hand option.,1919-01-28,11
2189,195844,3309,Region professor sense five style.,Third church less.,1922-01-26,79
1122,607555,2053,Occur senior may.,Moment shoulder member else player sell help.,1917-04-16,-108
1772,978002,2447,Mother face pick offer interview.,Rule wife increase start.,1959-03-19,104
2154,327226,4353,Item result husband order relate specific happen.,Two hit her explain clearly mother.,1942-03-01,29
298,391873,4940,Friend garden above act.,Marriage someone easy high.,1971-04-20,1
1446,208122,247,Card alone win possible natural industry.,Camera authority figure knowledge teacher cost.,1987-01-13,19
2178,211499,1907,Place she at simply western summer last.,Easy new far card yes last until order.,1959-01-26,37
1400,824357,1294,Structure data power plant west discuss easy.,Long after police cut partner tough few.,1980-07-22,80
1315,366877,1115,Nearly hold race those.,Social media million wrong hundred everything.,1975-03-10,11
2250,872539,2195,Over town second not all city.,Per same building continue life.,2000-04-26,95
2337,781152,1094,Relate which page management international possible number top.,Case make cost.,1918-09-29,-101
1248,477383,262,His one parent likely.,Year discover skin current around later.,1998-08-29,10
1710,826136,2116,Cup development ability old water head environment blood.,Amount physical information exist home yourself heavy.,1963-02-23,6
471,502506,681,Interest product them condition everyone.,Here with whose bring speak treat seat.,1928-01-24,-107
1081,203901,1623,Less card throughout store before for single.,Republican near computer pass quickly night certainly.,1928-11-19,86
447,889236,4899,National cell second bed.,Town building toward operation religious culture learn safe.,1948-02-28,66
1465,977670,960,Note seven especially day recent pressure listen.,Expect decide field hour.,1972-04-24,61
19,824728,1353,Drug issue market create consumer student.,Campaign especially describe final election herself.,1933-07-15,30
351,269557,4488,Baby red too market design threat.,Stand cause moment deal know difficult.,2010-08-27,4
1415,607059,921,Bring politics person large.,Price government large land political arrive quality minute.,1914-10-30,7
1326,953278,4679,Before administration go argue low race college.,Support some someone sound bill nice visit.,2005-08-19,93
221,218997,70,Else rate avoid drive available section produce.,Other only reason floor until any change.,1971-04-03,-29
2214,369527,3617,Wide fast investment mention long sell.,Form strong nature especially.,1906-05-09,-35
1198,955837,107,Mother animal matter us.,Each thus if arm wind all.,1973-07-10,-32
1764,199808,1284,Report growth on feel apply really but.,Image nature financial night green draw.,1941-11-12,97
1257,385776,3201,Either happy agent morning.,Seven society art right.,1933-08-09,-36
395,883918,806,Herself actually current coach his night success.,Clearly cup spend indeed consumer subject.,2007-02-06,-39
236,218910,368,Want bank raise under knowledge.,Open much senior own manage.,1962-06-06,-14
835,784306,4370,Ask not will social management current knowledge.,Local light their rate hand about plan.,1934-04-30,-104
798,722803,2686,Offer fact allow will.,Value main bring step sit table.,1979-08-20,96
1850,788510,1690,South cut guess tonight figure.,Check organization keep sell center without care.,1986-02-14,-40
1976,497171,692,Probably learn sort data century like.,Me section edge ever perhaps.,1949-04-12,-72
1258,393957,2671,Civil system alone institution effect within will.,Responsibility husband around maintain energy staff police.,1908-06-18,-40
1668,265091,1797,Grow audience theory minute minute health buy.,Believe billion body certainly lawyer ever benefit.,1907-03-22,-37
541,474130,354,Entire produce agent.,Agreement style police quickly thousand miss doctor move.,1980-02-07,15
1485,976139,528,Free sister happen almost.,Civil clear want matter.,1964-05-10,33
568,429041,1430,Sort tough able real want shoulder.,Artist reach position wait successful itself show raise.,1953-06-16,100
32,873950,3607,Explain street meet west local.,Sign maintain necessary fill enough.,1910-10-31,-57
27,496383,4899,Record by page state among message movie.,Real factor agent impact or.,1977-06-16,-82
1234,213521,1553,Choose ten approach school.,Knowledge work around population.,1984-08-17,-66
542,823575,3980,Community affect worry.,Represent work white light one.,1931-04-07,5
1638,362424,1975,Paper letter trouble science eat describe.,Term night officer investment education education.,1941-04-07,-79
2291,503025,1907,Everybody miss impact.,Worker require heart above society ability.,1932-03-20,-82
1791,212855,730,Compare cut challenge management apply field back.,Budget dream spend if certain likely.,2016-10-28,50
2311,126085,1834,Church there indicate experience.,Important move me population often.,1933-11-13,105
151,268682,1551,Blood scene dog against.,Total international memory my.,1920-09-01,-34
514,721388,967,Card environmental wide you hair until her.,Option spring interest activity allow.,1957-11-28,89
1765,884608,4100,Page operation seven painting life protect reality.,Cup project page range sort.,1921-04-19,-28
126,327658,1191,Adult myself population article including.,Hundred break trip general well.,1925-05-16,-104
2031,426535,4424,Star back cultural tough.,Body young test friend.,1984-01-12,28
790,394822,4593,Sound run will natural tell play happen turn.,Nice home help training gun a alone.,2016-05-04,2
133,604391,1933,Particular eight along top student read.,Choice believe fact shoulder that only wish.,1942-08-22,-22
1978,505494,909,Next difference than pass best manager administration.,We job dog matter recently.,1936-02-21,0
1916,787713,4273,Everyone fight democratic program its light particular left.,Whole avoid scene fight important.,1992-10-25,103
1253,268968,2606,Half executive modern note travel themselves.,True animal according appear institution sell only check.,1923-04-03,81
671,325579,2154,Particular or loss administration thus between despite.,Ahead trial field road staff.,1947-08-09,-16
1610,382721,802,Measure view require book.,Travel staff under part.,1985-08-20,20
2199,217976,1750,Artist onto word budget view hold.,Fight factor bar unit.,1977-08-13,-39
590,269618,2624,Begin a minute data.,Toward final food range.,2004-06-24,79
1679,827923,3104,Author traditional level college scene.,Until sea bank cause concern.,1908-11-09,34
804,607200,3916,Market physical shake eight radio bar run.,Model party blood argue member building.,1949-05-08,95
805,365335,3081,Rich as strategy always see.,Alone watch occur senior.,1953-07-16,-77
344,123095,3163,Your thank meeting style decide million floor.,Total Congress sport Republican hair.,1976-04-14,-81
882,122285,271,Religious strategy explain speech.,Card station military edge leader.,1967-11-13,17
820,725049,1571,Kid want employee check box.,I entire the street.,2006-04-19,-74
1968,123154,3391,Property buy small right stuff.,Newspaper avoid involve.,1912-07-08,-37
2145,322673,3996,They majority particularly seven move majority chance stop.,Exist argue service government of.,1984-04-21,-50
1666,502672,4920,Brother money citizen both expert together pull.,Article culture force without employee.,2017-11-05,109
307,321358,1308,Save fish someone unit middle else.,Bar real time standard society stop.,1929-03-26,-8
575,824048,817,Network prevent detail forward myself ability among.,Into success number do represent movie.,1929-02-09,-82
2041,268571,3183,Section tonight coach.,Really measure society activity.,1940-06-20,48
1310,878187,4116,Education west way business.,Ball safe share explain third goal couple.,1968-03-28,-27
147,391873,247,Stand south good.,Certain we doctor TV else movement.,1971-01-27,19
1559,728118,227,Rise happy yes difficult toward single their.,What allow camera mission.,1960-02-06,-25
564,473685,2702,Say politics stand crime maintain alone civil effort.,Western after policy mission build decision lead.,1934-09-14,18
1505,476878,367,Account in choose fill plan.,Way through simple head growth.,1945-05-01,-26
1851,123154,3005,Yeah edge three too.,Administration large list long close site place.,2004-11-09,84
1758,219037,3527,We book staff idea when street.,Toward base need body billion style.,1932-02-08,-29
467,325907,2216,Exist them forward.,Surface lose parent between notice old whether.,1904-10-15,103
1977,883761,534,Suggest become something sometimes blood section network.,Rich American market theory.,1974-05-09,88
1667,368575,2723,Use million health record bank newspaper program perform.,Ready born story who defense finish.,1923-09-16,102
1896,193885,1567,Activity tax their page do.,Likely situation south physical letter new fire foot.,1932-12-11,21
2400,323051,2217,Teach however computer.,College stock from step.,2005-02-25,2
981,723259,3345,American others rather loss something foot put.,Provide majority pattern floor beautiful air.,1961-01-09,60
1263,975436,1837,Concern believe appear approach focus ever.,Wish later nation detail walk look fill wear.,2012-08-10,85
1270,364989,3201,At send song hard.,Factor ready expert name police.,1926-04-08,48
332,783294,3001,Cell fund although other over where such.,Environmental deal find red heavy second.,2011-11-10,-64
583,605352,2498,Own as clear yeah.,Also again manage difference party.,1984-08-13,-39
1601,724583,830,Wish size gas piece.,Win both local natural theory.,1919-07-10,73
873,193786,4593,Reality chance week visit send more treat.,Three we military school.,1934-10-22,3
103,494029,1758,House choose few probably smile wear smile.,Near speech notice town participant.,1913-08-26,-73
1859,429075,2154,Dinner statement generation place.,Anyone federal more candidate.,1916-10-30,-66
1210,385994,983,Race star part carry power close.,Recently pay program author whom too yeah.,1928-10-12,58
2266,601547,3645,Edge suddenly whole source.,Market third attorney here suggest.,1983-01-25,4
155,198813,1168,Other rise end attention subject try report exist.,Leader page art range step better.,1977-12-03,-28
2363,269684,4884,Movie single per situation.,Structure major season probably seek.,1937-01-05,-42
2128,821899,3982,The study into.,Particular figure tend admit difference fine.,1958-05-18,105
1392,391763,4394,Lot meeting political at answer health.,Least occur nor sense.,1984-05-13,-52
1948,724990,1467,Consumer mind single who partner goal throw.,Expect threat maybe direction young main.,2008-10-30,105
1928,785123,1086,Out pretty nation cost.,Office see event group.,1935-02-18,31
1164,785995,383,Company way ask.,Often take figure mind table interview child resource.,1969-01-18,-71
1566,953278,1997,Ten throw old.,Imagine spend present sister speak author.,2017-04-05,-8
1863,821917,4402,Here finish good check stage.,Trial carry feeling need.,2010-10-12,82
1442,364674,3786,Bit brother property debate matter inside popular.,Feeling process one future.,1980-04-24,75
1419,882856,4996,Crime little almost price concern.,Least focus thank start such.,1990-11-10,87
736,971972,415,Artist view will simple house teacher customer.,Remain contain sell western organization enjoy heavy.,1938-02-03,97
1215,205646,659,Teacher seek response themselves.,Over approach president next level but country.,1912-12-31,23
2417,788510,4807,Avoid bank few yard voice.,Area second speech seem find change ground stuff.,1978-10-08,101
1825,878103,4055,Somebody score personal their star nearly special.,Both nature maintain news TV series mention.,1990-10-26,-11
378,786282,2111,Manager benefit season kind gun near political.,Foreign soldier air three.,1990-10-07,36
1955,191467,754,Development happy usually move gun safe exist over.,Open then data soldier.,1991-02-16,-93
2348,979647,4082,Security around pressure determine.,Turn light management newspaper right possible area.,1939-01-18,-66
877,973895,3489,Paper government argue TV crime visit remember.,According near large effort reduce.,2005-02-27,-94
1770,128411,389,Movie nearly difficult matter answer rule possible.,Free none against.,1930-09-29,53
1506,218524,4761,Glass current today true gun.,Kind decide serious.,1905-07-15,109
528,265358,3043,Peace response benefit.,Option gun coach receive.,1972-06-05,108
773,824964,2230,Spring at investment order down perform available.,Statement general without nice popular.,2016-03-10,27
1119,607200,861,Agreement public live lawyer culture.,Member spring stop develop.,2000-06-03,75
1141,208122,2635,Century explain his mention.,It class rise project west or activity.,1969-11-07,44
385,421554,376,Seven above that window must performance enjoy.,Show office generation magazine today.,1926-10-15,89
1928,727725,2515,National grow key large forward bag fight.,Around hand attack thought.,2010-09-29,-79
1680,724213,560,Could task animal hard green.,Tree glass moment thought brother less compare need.,1918-12-10,14
182,202546,2726,Yourself establish find some yeah where risk occur.,Simply north church require history.,1964-04-28,-67
443,976780,2209,Account mouth according write early owner else.,Must month pay herself dinner less.,1985-06-04,16
1797,789244,912,Fire spend relationship plant go piece.,Too concern door individual stop.,1945-04-23,-59
784,324570,1683,Anyone world growth task that around claim leave.,Development military than improve.,2013-07-30,-60
1918,785995,982,Instead person edge TV memory him.,Appear nature trip western approach language.,1982-01-07,72
594,212782,2210,May star store including production of.,Similar defense college reveal draw commercial.,1974-02-06,-95
1993,213808,773,Consider project responsibility pick responsibility.,Hand begin on strategy five than.,1957-07-08,29
1405,207394,3201,Use total century hotel star finish.,Develop then option pattern design game notice ago.,1952-06-08,-68
1220,329180,2389,Box few room effort age meet.,Decide meeting yet wish.,1954-05-28,-72
1853,126660,1205,Ago field more up.,Charge single art happen often positive.,1904-10-29,13
894,361730,4916,Other only remember matter yet consumer by modern.,They fight scene piece walk test.,1932-03-14,32
2305,323302,252,City writer eat entire significant deep.,Town student leader weight son.,1935-03-07,-74
2017,955899,113,Lay others film guess interesting happy.,Data cold board billion create.,2017-05-22,-51
1744,427641,1009,Strong country accept.,Degree point near sit mouth.,1906-02-14,106
283,495955,1308,Note who design always force effect stop.,Bit student be.,2014-09-27,95
714,383805,3226,Clear star material forward letter protect leave.,Land benefit PM expert produce rest.,1952-05-05,-102
1542,196772,662,Return act say behavior.,Hot six share.,1930-03-04,41
1799,383805,354,Table fish pressure.,Court son loss.,2005-11-06,13
760,385952,2560,Ok organization usually a save soon.,View health around sing if they.,1939-10-04,47
1239,213808,2548,Election stuff by often research ask management.,Official authority his floor.,1962-09-07,-46
520,884608,3626,Offer for food door.,Enough forget anything learn forward issue administration.,1932-07-26,98
383,821917,1157,Activity knowledge structure challenge table.,Without address respond goal act myself stage.,1987-07-03,-18
695,726247,2441,Stage too nature weight former thing by should.,Behind second size everyone event.,1918-06-09,16
1874,821978,2053,Huge ground quickly.,Candidate direction arrive participant add tell tonight place.,2008-07-01,11
776,196770,4403,Fill million tough behind.,Rock stand major weight discover send loss.,1956-08-31,-32
419,324486,41,Event history understand size focus wife cover.,Usually sound fight.,1983-05-09,39
276,956458,2870,Fill accept out.,Site budget my research position Democrat.,2008-11-13,-83
55,726068,2893,Yet tend use mention per performance reflect.,Among rich else.,2016-07-27,-62
487,608785,408,Impact wall outside especially.,It memory stand reflect explain bar dog.,2015-07-25,-72
1424,491450,3283,Door inside operation hit phone.,Pattern sport player inside cover citizen unit.,2020-01-12,8
1221,823174,1294,Because idea section human rest.,Organization second certainly investment let.,1955-05-11,-105
1548,603552,2195,Course although table resource.,Plan power I safe debate lead rest.,1993-01-06,-99
1254,979826,830,Lose room music understand see party of.,Player mean natural experience.,1932-10-17,72
1860,607279,3267,Ever economic eight out.,Very civil side issue agree month.,2008-01-09,-92
104,603354,4958,Guess kid central development learn mean.,Kind character able happy laugh character.,1965-02-20,21
1205,212462,4131,Leg officer wear.,Knowledge college test nature yes bit enough method.,1954-12-18,-12
275,506761,2588,Really art audience why result inside center.,Usually decision despite.,2018-10-08,17
3,124575,1245,Part apply should without may.,Green officer know forward heavy several.,1942-01-10,80
1819,422522,3916,Law police maybe.,Government city yeah few try.,1975-03-08,-5
1647,476878,4216,Help strong voice center.,Low whom increase without yet.,1971-01-21,-21
172,196438,3776,Include high reason choice news.,Prove choice deep popular street represent cup watch.,2007-08-19,90
362,205347,1805,Glass within toward cause still which open reduce.,Opportunity stay power rate just occur term song.,1937-12-15,35
475,784713,4249,Imagine poor kid method soon maybe.,End approach let he yard.,1990-06-07,-41
1129,269557,553,Forget area seem glass air.,Take fly network several.,1983-02-07,-76
1514,502390,1035,Executive pretty environment with.,News cut lead so a hard easy account.,1906-12-19,-15
89,362760,3226,Several pressure have put guy politics understand.,Nice book away special commercial.,2018-08-16,-75
1284,472369,2180,Or vote season sell special never usually.,Drug fast operation.,1949-05-24,-86
968,201701,2034,Still mouth eight.,Learn perhaps myself physical way.,1942-01-03,24
2094,388300,3206,Heart risk single financial pattern grow daughter.,Them anything bar pick.,1975-02-07,-103
979,502475,1698,Camera yard her least school local.,Area environment language.,2008-10-12,53
484,788765,4353,Radio husband yet because specific black.,Customer whole husband floor part.,1937-04-09,-62
1728,209373,3544,Candidate customer industry list tend.,Sort long quickly material able either power large.,1996-02-20,38
747,875716,3195,Beyond son window easy great.,News different recent yeah.,1959-06-13,-37
1960,478594,4284,Add care clear million class probably public.,Inside difference spend red hear civil rich.,1938-03-29,-103
1626,326281,1697,Accept thought individual education.,Old their garden week.,1985-09-16,-89
929,505603,572,Authority well organization with.,Film fact thing arm.,2014-02-10,44
1782,821917,4031,Eight chance agent stand.,Stay tax upon line game.,1919-05-27,20
168,504622,4412,Hope major body scientist husband wish.,Investment discover find himself forward product.,1905-12-07,31
2452,492355,595,Find project family start college.,Tough must middle central it suddenly too.,1965-01-11,56
397,879101,246,Sound factor team industry wish.,Across hospital recognize sister item.,1934-08-09,-96
1073,426535,2962,Around other once no fear although right.,North style bit.,1978-04-04,-1
751,607420,4916,Lose fire four poor woman.,Southern skill time.,1931-11-06,-61
2331,882856,2443,Even close even PM.,Reality now possible present coach left.,1967-07-19,98
1419,888720,3600,Money good old.,Cold common brother item.,1992-01-20,-63
184,494401,3654,Serious staff century fire.,Task should natural.,2015-03-04,-34
1572,384518,3391,Interview economy how study voice include rich town.,Total decade time special.,1954-06-30,1
61,196954,4165,Tree garden herself history probably major simply.,Wonder hit worker specific.,1932-02-05,-6
696,424252,542,Interest of artist deal.,Peace activity those author responsibility together.,1978-09-01,-84
1099,824053,1175,Hand somebody it economic serve appear performance.,Give if couple star star arrive week fire.,1965-05-06,-95
1398,427761,324,However idea wait garden range identify simply.,Kid against security describe population will check figure.,1948-03-14,-79
2318,127097,4130,Focus up top.,Reach create other side establish suffer.,1960-01-21,74
2065,607059,4248,Score fine may party.,Operation big opportunity ask half listen suggest discuss.,1997-06-16,70
100,601256,2251,Fly three pull fall spring a end enter.,Window lot break mission someone wait.,1922-02-25,-84
617,268921,3001,Common structure century dark read.,Either among what score water middle miss.,2009-08-07,60
258,194651,3801,Far nearly short would until class go.,Building sense maintain health team office sign.,2016-03-11,89
451,606965,2217,Recently effort fine law.,Little successful sister.,1919-09-07,81
958,506525,1948,Others final class education.,Important college course must save ahead down.,1949-07-03,-75
204,878178,354,Image live technology drive not project.,Security personal result.,1994-06-23,-49
923,784950,1713,Current discover government city brother treat.,Board open approach price reflect.,1922-11-15,-25
1083,322673,3318,Sit first song ten.,Response together test level.,1963-12-06,92
616,363766,2216,Side evidence eight after.,Decision remain reflect nearly Congress.,1915-03-14,27
1032,721388,3952,Health activity increase kid front benefit.,Open show positive.,1972-04-18,-109
1387,473295,4416,Popular young avoid step provide else treatment.,Way fact agent.,1957-09-05,-30
109,889416,4278,Admit might city production recent.,Truth great maintain meeting wish box store.,1951-06-11,-35
1399,212144,4969,Federal center of.,Upon sound tree.,1977-09-19,6
2336,787026,812,Gas ahead in buy score agency economic.,Best also garden learn country.,1904-10-31,45
2212,972593,3916,Door miss talk draw itself last hair matter.,Side them public model anyone administration fire.,1905-11-09,-19
1720,266285,681,Class once student across those.,Benefit act become.,1908-12-03,-44
1568,492490,271,Support trade base to.,Right audience central seek ask arm money month.,2010-04-01,-83
926,955104,4273,Have why catch perhaps.,Or off serious very thought beat big.,1945-12-08,-96
2207,398865,323,Those degree continue science source history.,Return on parent safe.,2019-05-15,-110
1740,505879,2394,Low reason provide throughout model drug either.,Project decide wind use fall per people.,1947-08-12,1
2435,367008,4519,Among board suffer hit name wall leader team.,Conference particular senior test do.,2000-10-24,17
