94,601343,325,Support member choose road dog.,Among employee store probably special from.,1911-09-30,-15
55,361754,1990,That dog will early become its.,Them democratic friend do tough.,1996-06-27,-21
2365,972915,4394,Season rise room operation sport.,Leave peace best fill of they.,1951-01-30,16
2140,213521,3226,Laugh such remain movement upon white.,Statement age share market road.,1939-06-18,-66
949,782183,4990,Court east draw trial listen wall.,Newspaper including sing want establish number.,1963-05-10,38
422,885079,44,Subject necessary capital worry mention send.,Town coach finally deep daughter.,1961-10-20,-74
224,321358,972,Lose simple American if.,Focus white catch question.,1942-01-21,-6
2076,268371,4031,Standard lot news simple.,Discover could firm hear mean data ever prepare.,1942-12-01,9
14,872181,4940,Have wind yard identify.,Off feel sign seek scientist.,1956-01-29,91
2409,209973,1191,Yet voice moment.,Worry physical live.,1947-09-26,-68
219,972485,1793,Likely including lay ok theory before.,Skill after middle tonight option customer among.,2019-12-07,-95
611,496674,2455,Again western too involve operation leg which significant.,Head increase any join.,2010-09-01,-65
642,194873,1262,Six system a car state successful.,She spring new thing PM go.,2004-01-20,54
1883,494659,4951,Soldier future goal less series down bank bring.,Official clearly choice experience however.,1917-08-13,-106
1764,502274,935,Dream model meeting full free whom.,Toward help hit natural professor air much successful.,1926-08-11,-87
2371,326281,1338,Accept single surface person first.,Thing tonight right fill should consumer.,1984-08-05,41
1513,365892,3792,Capital show must.,His goal seven place push rate standard.,1963-11-20,81
2272,192118,1907,Their computer town again red scientist Mr.,Until charge body picture note guy identify.,2009-06-22,87
2273,475585,1172,Those have become evening run or drive.,Model player attorney attack color something form.,1963-04-14,19
180,499279,1021,Shake outside only evening simple.,List before sea win different.,1969-09-24,98
1566,368046,3543,Personal although else thank poor cold while.,General onto respond model sing former.,1930-04-08,-4
722,324932,1828,Sign difference near sea.,Prove reveal our we evidence find.,1944-02-16,94
761,389525,4148,Sometimes specific how four most successful.,Do star middle actually court necessary.,1964-08-28,34
2051,216225,4835,Around news writer political picture.,Statement strong despite remember source.,1961-02-04,80
1632,956458,4607,Father this attorney activity.,Responsibility white explain third read.,1947-03-18,-97
1726,326398,884,There bill again tend business.,Field yourself game test very trouble spend.,1947-07-04,21
1469,473668,3524,Situation those ahead goal table character.,Hundred cut discussion rich.,1983-03-24,-51
1711,608785,102,Whatever there theory.,Total evening Mr.,1919-12-22,-18
77,126321,3318,Throw notice discuss rock we hair discuss.,Executive heart adult writer industry behavior.,2010-07-10,-27
1096,322478,4416,Conference about success news sea interesting.,Television school although point your attention travel majority.,2000-01-13,98
2216,824607,2727,Page air hospital alone candidate other affect.,On create for country meeting bring travel air.,1912-03-29,48
506,399874,1595,Dog history themselves night trial strong.,Bit appear alone through determine.,1945-01-16,11
649,384518,1655,Place water number action establish final hand.,Administration page lot until onto form government upon.,2011-09-14,-12
1548,213808,1286,Brother another maybe year exist section personal.,Including watch later clearly some stock sound.,1967-08-18,-92
1006,822604,4000,Other institution activity so.,Some behind wait south.,1999-03-18,-96
604,196954,662,Open structure meet mission information act.,Indeed drop PM sense list.,1981-05-30,93
1530,971972,3480,Sport because young.,Travel forget under hold board step.,1910-06-26,76
86,322673,3860,Police letter trade product.,Hot have wish military.,1908-06-09,-15
233,369544,4117,Various idea fact sense.,Suffer enter leave candidate senior.,1974-05-06,50
835,873776,1205,Figure notice brother hold.,Bed by two tax quite.,1975-01-08,-57
1595,268555,3718,Seek include gun quite ahead score score.,Generation tax decide dream debate pull.,2013-03-17,-84
1231,215215,1873,Form food idea company operation possible.,Truth all bed build.,1935-05-08,-68
656,399608,1168,Poor manager size media Mr how.,Girl speech the smile investment employee health.,2020-05-15,-91
1840,363164,4761,Front whose market month also interesting bed.,Prove work she good.,1917-11-17,-4
2359,721964,311,Without from wife choose because amount.,Surface result executive money yet call.,1922-02-05,60
88,427735,795,Approach soon future answer structure candidate partner play.,Last seven its list method.,1947-07-08,-83
184,364989,3568,Lay sort social deal.,Eye world best child.,1924-11-08,-92
2425,211499,1781,Sport Mrs above leg about material never.,Take major way hair manage station father.,1918-03-09,51
226,326041,4100,Technology the practice now want agency.,School per method plant modern leader often.,1952-09-25,53
6,826136,2105,Owner factor set force list society.,Never police fish decade.,1918-08-25,-46
1149,727725,150,Third future first market occur science executive.,Floor teacher whether successful system wide.,1969-08-09,-105
2333,874135,1694,Big trial wind father man.,Change either build color his.,1985-01-18,28
722,825862,73,Start late vote clearly middle dark anyone recent.,Successful decision beyond response maintain.,1965-02-24,57
2362,398707,2654,Second guess institution identify political girl.,Those game current easy picture decade identify perform.,1976-12-12,22
1616,972593,3776,New artist beat pull.,Through likely time these edge.,1954-06-29,-85
616,398357,2149,Go note political subject.,Property me same another leg.,1949-04-28,-101
1084,324469,590,Parent degree old call stuff ahead.,Size break road a benefit over.,2020-06-23,-91
1679,973419,4792,Present wish well.,Factor rock agency little.,2020-01-12,9
2401,218997,3075,That college film understand season.,Type raise hand Mr structure show general happen.,1929-02-13,-83
2289,824964,2276,Black during tonight individual contain big be.,Issue beat theory strong price everything.,1970-06-10,-41
143,216400,1513,Three case parent despite.,Congress job human claim material home.,2000-01-29,0
652,602287,2663,Put whole by local pattern.,Thank material these unit help late.,1984-11-10,-44
1876,821130,4489,Can along must approach young view attorney.,Relate mission already account here party onto.,1961-07-24,-32
1744,478609,1342,Better meet you treatment.,Create sort visit.,1957-01-30,-82
81,216607,921,State scene main child rich six.,Artist total month sense.,1962-12-05,-110
963,262819,3682,His interest arrive hit apply education.,Kid ball trip just color wrong term.,2010-08-08,67
2155,979647,3348,Require certain after yard might.,Kid least however computer order.,1916-09-13,-1
61,196080,1585,Specific mouth third model certainly story clear always.,Save baby put year.,1981-12-08,-13
1252,196030,3318,Describe seven dream.,Girl a shake.,1993-04-19,-74
670,722619,4744,Involve radio range however.,Level condition money less defense you yeah.,1931-09-01,58
608,123095,4345,Loss meet charge very issue black energy.,Continue son then chair quality.,1953-12-22,79
1853,503025,3599,Special meeting artist employee sit return.,Attention then race education firm or scene.,1934-04-19,87
1148,213808,4184,Defense happy you chance.,Say edge project end ok away car.,1971-04-17,-44
601,979826,4045,Sense peace light good political.,Property country little it.,1943-07-14,-70
40,202595,355,Few listen actually soldier add two former.,Skin long let policy pull wind floor popular.,1906-02-22,-44
2125,192118,3179,Spend agree yourself town.,All affect true along how about.,1982-12-22,21
339,365335,4130,Prepare conference across worry never want them source.,Fire war realize there view color view main.,1964-11-29,-22
954,876060,753,Their once since movement along ready side.,Always science look world.,1910-03-01,18
726,506761,665,Deep expect already several.,Than what sport gun gun forget.,1976-03-26,-100
735,875716,3348,Traditional civil fund skill.,Thing recently population onto behavior follow thought.,1910-11-16,-91
870,494103,3095,Behind pressure bring toward others.,Tough safe not common water.,1934-04-05,-63
2383,977969,2712,Scene cultural task decide.,Art decade suffer season would type by.,2006-12-03,13
287,953947,2281,Production avoid think idea outside various everyone.,Despite listen space during.,1996-04-19,14
1156,198106,2389,Many power environment own identify other.,Must west writer tax number well spring.,1996-02-18,90
498,826495,921,Ability thought product collection Republican.,A institution who half.,1975-01-05,-40
737,202367,4412,Argue vote grow food information perform cost.,Building thing tree degree.,1917-10-08,-96
2448,976440,113,Attack require turn late media.,Democrat dog major popular may.,1970-04-11,6
624,201608,2052,Figure top money simply most assume protect least.,Success question husband use score teach threat.,2014-07-17,44
1352,788225,2672,Direction south life successful history.,Really reach senior north.,1993-02-19,-9
594,202489,4899,Green stay but remain culture building.,Significant visit weight.,1969-10-11,-55
1927,884608,3609,East join house night director smile heart.,Pick country produce building worry.,1968-09-21,-49
2194,499134,1284,Cover structure agree difficult.,Run interest religious discover image base.,1998-03-07,11
855,602282,3129,Increase political peace friend share according.,Arrive arm popular fine stop.,1940-08-29,74
382,369491,694,Forget some western until think.,Side during effect behavior require.,1926-05-15,53
997,472617,1342,Daughter world operation loss because.,Nothing seat see gas everything religious local begin.,1916-11-26,13
566,128942,1930,Between government set.,Relationship south idea them.,2009-02-12,-42
187,602669,2298,Culture manage follow now early economic through hospital.,Magazine focus party official past.,1966-08-11,-83
489,269557,3697,House general yeah indicate per experience effect.,Listen cold plant make already time upon.,1905-12-16,21
121,192022,133,Raise activity establish crime over seat should.,Must term enough see.,1958-11-02,-109
2200,786282,2784,Attention company whatever exist father offer.,Cold do up think.,1992-08-02,-80
2103,262819,3053,Perform draw appear sell.,Much focus second receive fast option owner.,1956-11-17,27
1135,873356,4216,Report theory gas compare card.,Movement author page treatment politics standard citizen.,2011-09-05,-21
2209,884608,3519,Provide commercial project break alone single.,Street trial yes month job.,1958-02-20,92
1967,205218,432,Coach might believe work house.,Reality under should age expert.,2013-08-12,5
2123,495315,902,Person attorney around station knowledge enter property.,Little front new money pass these.,1909-09-21,19
2090,977670,2624,Position someone event radio.,Less executive beautiful left become air wear.,1907-11-06,57
1072,878103,980,Item but eight system miss face.,Under television doctor mind form but.,2013-09-24,-53
753,824364,4229,Picture buy wonder tax.,Child assume today maybe determine be woman.,1910-07-22,-66
2404,366175,776,Woman international edge.,Certain option within would perhaps society without.,1910-12-18,-2
453,201342,2301,Stand treat might door investment.,Themselves modern could look their.,1924-02-13,-46
1333,503071,2722,Middle next interview speech represent.,Firm child tax final.,1977-02-13,11
575,499769,3996,Guess tough speak this.,Author thousand officer number building ready run customer.,1938-08-23,-31
334,878187,324,Once magazine pattern run.,Laugh tell center study.,1908-08-04,-10
752,268843,1352,Never or answer dinner.,Exactly trial action finally account move culture political.,1910-10-22,88
411,492355,1796,Buy color down far girl trip party structure.,Story allow model exactly let prepare build.,1914-03-27,-26
618,498332,4138,Somebody large item pass data yard out.,Range fast north cell.,1954-08-28,109
705,781152,1689,Its subject eight beautiful bed marriage draw mean.,Senior animal suggest step support computer.,1967-01-27,-107
1194,976780,4933,Rich goal artist range PM cost paper.,Big as able I produce perform.,1963-03-28,-14
680,974840,639,Low candidate garden side someone follow development.,Discussion later where moment morning.,1905-01-07,97
685,127335,4618,Once push police stuff provide happy quickly.,Cultural agree mean day.,1916-12-11,-19
793,395938,340,Into debate news simply something.,Which science very leader story decade change.,2007-10-27,104
739,787713,3720,American politics room there story son onto.,Miss method page bank.,1976-08-12,-104
706,474083,3005,Activity staff score effect others.,Talk produce admit teach ball focus.,1989-11-27,-50
1657,422945,3116,Want upon customer.,Force including candidate crime probably catch.,1929-03-24,17
1294,889236,4991,Short over suffer test.,Very agency account ball.,1952-05-19,-39
1282,979647,2195,Ok picture recent everything understand might far.,Within change half agreement.,1936-02-07,-5
1092,954168,1553,See another until clearly.,Meeting I drop rest recent.,2006-07-04,60
1686,826194,103,Especially protect son until perhaps beautiful second.,Responsibility international can painting understand large.,1998-05-25,3
864,829074,812,Discover hair also country talk eat movie seat.,Vote right watch more government modern.,2014-04-01,106
2214,323051,3327,View director government firm miss sit southern.,Community political put mind fight.,2018-06-03,103
1729,976565,1125,Almost dark six contain trial cultural.,Memory out require rate long.,1924-07-25,110
159,384671,404,Information mother PM car continue administration.,Idea consider for color.,1951-02-25,-24
390,126096,1935,Success use direction fine safe.,Million event source really brother machine their again.,2015-05-01,-77
828,365335,1648,Major important something price these whether.,Upon forget customer piece today place as.,1915-07-16,-59
44,501008,1609,Both system let risk strategy.,Throw western high drive expert.,1923-10-17,37
2087,976234,2473,Window party inside born fill issue whatever dark.,Building college door civil success.,2001-10-27,108
1436,395295,3955,Reach sound film or way rule.,Concern career night these both film receive fill.,2006-11-17,-29
40,502640,2195,Her sit community my.,Window tell official middle source.,1988-03-13,-50
832,609862,718,Second big build according less dog.,Individual agent relationship kid smile truth.,1976-05-23,-105
657,422522,3381,Open test that stuff morning technology newspaper group.,Different phone machine many way second.,1916-03-19,-55
1706,269668,401,Reveal garden event trip base.,Night example TV weight direction lead increase.,1938-08-07,35
2402,886277,3754,Off many blood produce American.,We feel so ever relate.,1986-06-19,-57
2198,212462,4498,Indeed position might office whatever big south.,According and south power.,1915-02-10,-108
1561,786282,1009,Project miss travel result.,Before somebody along sea threat kind and.,1952-09-22,-57
2485,325440,3067,Adult join role couple foot.,Standard market above difficult.,1908-01-25,99
2311,471515,4591,Chair music size.,Tend data least tax daughter soon probably.,1974-01-05,19
2370,218534,595,Style when assume thousand that receive.,List important decade place west happy.,1951-10-15,-92
1767,422583,3543,While Democrat speak mind.,Third however fast radio food same.,1938-09-28,-63
39,492993,4940,Through memory increase put in stage that.,Election identify information thousand hundred.,1990-07-06,-105
88,193428,2554,Case song politics knowledge program floor attention.,Husband instead cause national.,1987-09-26,20
441,782353,4404,Mission across behind recent institution everyone work.,Fire hand wish individual strategy direction.,1948-05-20,35
1848,124575,3017,Thing government executive road final occur side.,Million per should again indeed prevent fire.,1979-02-16,-92
358,496648,3152,Point put executive nation left camera least.,Assume throw medical participant radio process site.,1991-10-15,45
376,265091,3156,Pm talk prevent responsibility.,Sign majority not look operation make region.,1967-04-29,-79
2039,363037,1763,Music commercial toward ten.,Personal enough material number father rate.,1906-11-27,62
2103,971128,3082,Happy daughter animal.,All real example.,2018-02-12,-58
2416,383805,1669,Rather under rock office second modern.,Real help after list.,1911-02-27,70
2048,608785,4357,Might role challenge address.,Style interesting piece less quality outside.,2012-01-07,-11
1224,201086,4178,Phone true trouble good team those game.,Three expert mention.,1987-09-14,56
2238,873153,1797,Writer bill prevent trip wall.,Environment form my low.,1982-05-01,-23
1477,361135,4951,Free cover effort woman question town.,Sea young street state seat.,1973-06-18,98
495,491380,679,City child specific.,Coach century from film little page.,1955-11-18,69
1016,971972,370,Down marriage seven charge.,Note trouble particularly its.,1956-09-10,-23
2239,607555,4362,Base evidence go himself race every.,Buy off each local indicate try executive.,1908-06-02,-104
2081,369527,872,Must major away reason who fine.,Week yourself ready board quickly model.,1915-06-10,-110
2192,269668,2852,Without discussion future ok.,Expert garden simple away option alone.,1980-08-18,17
1666,785697,4519,Could no window month seat operation never.,Window interest pressure author.,1967-04-10,-45
2058,363674,973,Take economic create trip they protect might.,Should same government well budget.,1975-08-29,-19
2333,369527,1433,Value training bed page forward issue agent.,Maintain response remain identify better past series.,1975-12-09,-76
1344,194175,4745,Control can so when tough gas myself.,Manager quickly member raise sometimes message not.,1985-08-22,44
1129,382770,4769,Another many dog occur avoid hour carry.,Tell beyond somebody language.,2019-09-28,58
2014,218997,1539,Rate war chance far memory movie consider.,Treatment meeting item write.,1941-12-31,29
2093,324486,806,Age management security particularly.,Grow thus your least.,1914-06-29,-46
2038,262149,1782,Huge account animal couple popular.,Benefit do shoulder worker respond say air.,1983-06-20,105
1830,198813,397,Contain produce six point song.,Either box force power year debate.,1937-05-19,99
999,361529,311,Life media address total will through prevent.,Lot realize challenge listen.,1927-10-21,-16
979,471895,3441,Remain notice plant bag approach single.,By class light information world anything strategy finish.,1970-12-28,-21
491,494401,1852,Talk half seat establish.,Civil system budget often those his most.,2004-04-19,-48
481,721964,3607,Travel professor seat knowledge.,Upon spend property her night in life.,1990-06-04,11
238,399874,1259,My mouth race international people agency rest.,Necessary race low may always pay detail.,2013-07-04,-97
712,603795,562,Back pass him back theory information possible.,Carry east anyone popular reason.,2020-03-04,104
94,206258,1679,Environmental face television.,Who past one floor contain scene event.,1906-09-05,104
1560,956905,1980,Glass since special research yourself national.,Cultural recent current heavy region place garden.,1975-09-10,47
2065,473222,3671,Want some approach six.,Explain how challenge later meeting power.,2003-08-13,-49
263,959675,3294,Return relationship hundred amount girl than make as.,Bill candidate group focus.,1905-12-06,-109
814,203834,370,Likely very decision hope.,Note toward help and south population scientist.,1973-04-28,33
1164,202489,4947,Probably physical actually anything.,Police pass energy ahead service follow.,1973-12-31,-109
1603,217976,2349,Door especially we never forget.,Sister majority make note skin newspaper there.,1967-06-14,94
1379,476087,1353,Keep police entire never follow region.,Sing manage huge relationship decade would public.,2003-10-23,24
1634,395295,3111,Kitchen wide whatever hot surface employee without rather.,Training world opportunity.,1923-02-22,38
1792,609199,2251,Country through land chance.,Soldier to approach tend particular challenge great usually.,1911-12-22,-98
2052,219037,2132,Quickly reality painting without fall.,Treatment behind sign their every.,1961-03-15,-37
2240,879190,97,And movement total onto course.,People father the enter mention mother amount draw.,1951-01-30,47
137,269684,2210,Life kind himself and rock down vote.,Sea less for check cause character.,1939-03-21,-102
1377,601665,3074,Responsibility reality production statement fish loss realize financial.,Four begin identify father mind state.,1906-12-10,-18
1673,475113,171,Could discussion enjoy quality theory determine.,Worker never late.,2015-09-13,73
530,603529,4883,Imagine real court.,Community director spring.,1988-10-06,80
32,976437,445,Rise drug until impact other join rich.,A note get begin.,1940-03-16,-106
2248,723078,3732,Continue bar drive conference outside serious.,South anyone know fall indeed become floor.,1993-05-13,-62
1916,422945,760,Challenge character will agree history.,White decide friend still reveal.,1907-04-03,-94
86,502942,2764,Available paper whom.,Language need maybe through.,1998-07-23,-90
900,828007,2727,Difference fall office yet.,Former politics describe skill tonight.,1982-02-12,16
370,972347,1298,Learn bit concern want hand.,Exist live development.,1992-07-21,58
64,885387,1116,Catch expect phone imagine southern.,Should company cultural hard history her.,1913-03-06,26
217,206167,1695,Increase what both bar people start something.,Research street floor beautiful reduce note.,1950-06-28,-46
2093,191690,1150,Return analysis rise control board news.,Media trial technology usually while instead will.,2008-05-25,18
164,504605,4550,Nice alone whatever herself gas.,Write yes yet example.,1964-12-06,54
2332,821858,3654,Executive alone sell culture evening choice agreement.,Majority public teacher wear.,2008-03-14,85
2011,508006,1746,Clear system owner necessary science eat western fear.,Trip floor while cultural stand.,1936-10-24,0
2066,262020,4375,She offer raise summer the.,Everyone behavior through they.,1925-09-23,-97
985,428204,3726,Interview section too American among.,Spring quickly standard own beat size word.,2005-08-29,8
2200,269347,1744,Moment use weight accept hold.,Charge shoulder stand staff beat standard.,1978-07-25,58
723,828315,561,Chance collection feel establish tree company.,Likely water foot sing however draw.,1987-07-10,-41
1517,207629,1425,Back thank up story ready current left.,Into next successful scene stop federal manage.,2000-06-24,-27
2470,784713,1878,Special evidence bag safe.,Beat truth tend movie air sort hospital four.,2020-05-24,68
2390,473449,4184,Partner skill field else suffer.,Left resource leg news nice.,1928-02-04,-24
922,972593,1116,Move across last letter when education.,Finish through can letter way tough specific.,1944-03-03,42
797,127097,4391,Total national gun mother speech long strategy.,Difference sure before administration much.,1971-03-16,7
163,888720,3996,Within seem every term.,Present catch best plant work.,1987-03-07,59
935,427628,1172,Much adult economy condition team decade we.,Order security whole.,1962-10-03,15
2395,322117,2116,Inside beat person democratic difficult audience stage until.,Stay spend life much billion fish common agency.,1972-06-02,81
418,726068,2092,Keep only everybody guess.,Say style window sing.,1967-03-19,-56
1684,601256,3805,Account police each she public.,Important now story share.,1960-07-27,40
1680,123095,983,Suffer those worry executive.,Fund have toward marriage buy evidence season.,1947-07-09,103
2058,399874,4591,Everybody visit season rock when group art.,Mention if on if current particularly contain agency.,1907-08-21,108
1003,383759,1669,Health degree debate control soon.,Program general today nearly.,1905-01-17,-22
2209,473295,3933,Other throughout customer.,Marriage about government base plan attorney lawyer all.,1935-04-15,61
1153,213992,245,Wide help develop occur number.,Camera traditional yard center least yard.,1934-06-24,15
2104,429075,367,Seek piece perhaps nation network shake account measure.,Grow score detail respond.,2005-03-05,45
1071,384002,1805,East during bad treatment individual bank win.,Study water technology ready course team.,2001-03-27,-49
801,321358,4822,Good face concern hard new coach.,Significant good up parent.,1993-10-30,96
1144,726352,1191,Own player example such space property.,Feeling open mission manager skin late.,1978-11-11,22
79,392484,145,Probably strategy past talk.,Music improve strong from evening second form.,1922-04-01,-46
378,428114,1648,Attention tonight turn reveal office.,Customer movement so seven tend write.,1916-01-26,-8
769,126684,367,Turn four major pay.,Attention cold draw job fly.,1916-01-30,-87
749,215215,3726,Mr on capital child author.,Alone worker later to.,1967-05-03,19
2002,974861,4092,Range method exactly sport must inside.,List customer list yourself.,1921-02-18,73
790,497909,1041,Feeling general tree.,To national democratic trouble discussion.,1986-10-13,12
1916,609913,3680,What event mention light ask notice marriage hit.,Election pressure mouth benefit door say responsibility model.,1927-03-09,-76
470,192022,3095,Stay leg area sense last hand miss.,Energy hundred large last hand husband.,1947-06-10,-19
1191,782183,3430,Say bit imagine single result almost seek.,Significant list shake suddenly.,1955-01-17,41
1827,473771,4366,Wonder ago bank party never gun.,Adult more as number environment sometimes imagine.,1964-07-21,-13
1377,322478,4601,Wonder political party represent field product person.,Work base whose hour use picture seat.,1964-09-11,92
689,396904,3012,Author side option answer.,Production ask although pull.,1952-10-12,39
